Sheet: Equations
A1: Part | B1: Equation for… | C1: C++ = Paper? | D1: CellML = C++? | E1: Notes (C++ = Paper) | F1: Notes (CellML = C++) | G1: Notes Modelica
A2: I_Na | B2: act.falpha | C2: x | D2: x | E2: weird but correct handling of discontinuity (L’Hospital without last step of inserting limit)
B3: act.fbeta | C3: x | D3: x
B4: inact_fast.fsteady.falpha | C4: x | D4: x
B5: inact_fast.fsteady.fbeta | C5: x | D5: x
B6: inact_fast.ftau | C6: x | D6: x
B7: inact_slow.ftau | C7: x | D7: x
B8: I | C8: x | D8: (x) | E8: weird but correct handling of discontinuity (L’Hospital without last step of inserting limit) | F8: CellML has no handling for discontinuity
A9: I_Ca,L | B9: act.ftau.falpha | C9: x | D9: x
B10: act.ftau.fbeta | C10: x | D10: x
B11: act.fsteady | C11: x | D11: x
B12: inact_fast.ftau | C12: x | D12: x
B13: inact_fast.fsteady | C13: x | D13: x
B14: inact_slow.ftau | C14: x | D14: x
B15: I | C15: - | D15: (x) | E15: ACh term added + rescue factor 1 | F15: no rescue factor
A16: I_to | B16: act.fsteady | C16: x | D16: x
B17: act.ftau.falpha | C17: x | D17: x
B18: act.ftau.fbeta | C18: x | D18: x
B19: inact_fast.fsteady | C19: x | D19: x
B20: inact_fast.ftau | C20: x | D20: x
B21: inact_slow.ftau | C21: x | D21: x
B22: I | C22: x | D22: x
A23: I_K,r | B23: act_fast.fsteady | C23: x | D23: x
B24: act_fast.ftau | C24: x | D24: x
B25: act_slow.ftau | C25: x | D25: x
B26: inact.ftau.falpha | C26: x | D26: x | G26: accidentally switched falpha and fbeta
B27: inact.ftau.fbeta | C27: x | D27: x
B28: inact.fsteady | C28: x | D28: x
B29: I | C29: x | D29: x
A30: I_f | B30: act.ftau | C30: x | D30: x
B31: act.fsteady | C31: - | D31: x | E31: act_shift moves curve depending on ACh concentration
B32: I | C32: x | D32: x
A33: I_st | B33: act.ftau.falpha | C33: - | D33: x | E33: paper has wrong sign for second V and C++ code multiplies by factor 1/1000 | F33: called “sustained outward in CellML”
B34: act.ftau.fbeta | C34: (x) | D34: x | E34: mulitplied by factor 1/1000 in C++
B35: act.fsteady | C35: x | D35: x
B36: inact.falpha | C36: (x) | D36: x | E36: mulitplied by factor 1/1000 in C++
B37: inact.fbeta | C37: (x) | D37: x | E37: mulitplied by factor 1/1000 in C++
B38: I | C38: x | D38: x
A39: I_K,1 | B39: n_pot | C39: x | D39: x
B40: voltage_act.fn | C40: x | D40: x
B41: voltage_inact | C41: x | D41: x | E41: convoluted and different order of magnitude for F/RT
B42: I | C42: x | D42: x
A43: I_b | B43: I | C43: x | D43: x
A44: I_p | B44: I | C44: x | D44: x
A45: I_NaCa | B45: d_i | C45: x | D45: x
B46: d_o | C46: x | D46: x
B47: k_43 | C47: x | D47: x
B48: k_12 | C48: x | D48: x
B49: k_14 | C49: - | D49: x | E49: error in paper: negative sign for Q_n
B50: k_41 | C50: x | D50: x
B51: k_34 | C51: x | D51: x
B52: k_21 | C52: x | D52: x
B53: k_23 | C53: x | D53: x
B54: k_32 | C54: x | D54: x
B55: x1,x2,x3,x4 | C55: x | D55: x
B56: I | C56: x | D56: x
A57: I_Ach | B57: I | C57: - | D57: x | E57: ACh is not present in paper (although it was added in the year before the publication)
A58: CaHandling | B58: sub_cyto/j_ca | C58: x | D58: x
B59: jsr_sub/j_rel | C59: x | D59: x
B60: cyto_nsr/j_up | C60: x | D60: x
B61: nsr_jsr/j_tr | C61: x | D61: x
B62: tc/diff_f_tc | C62: (x) | D62: x | E62: different order of magnitude for k and kb
B63: tmc/diff_f_tmc | C63: (x) | D63: x | E63: different order of magnitude for k and kb
B64: tmm/diff_f_tmm | C64: (x) | D64: x | E64: [Mg2+] directly inserted as constant
B65: cm_cyto/diff_f_cmi | C65: (x) | D65: x | E65: different order of magnitude for k and kb
B66: cm_sub/diff_f_cms | C66: (x) | D66: x | E66: different order of magnitude for k and kb
B67: cq/diff_f_cq | C67: (x) | D67: x | E67: different order of magnitude for k and kb
B68: cst/diff_f_cst | C68: - | D68: x | E68: multiplied by factor 1/1000 in C++
B69: cyto.rate/ca_in | C69: - | D69: x | E69: Kurata 2002 has negative sign for TC and TMC terms, but Inada 2009 gives positive sign (CellML and C++ have negative sign)
B70: sub.rate/ca_sub | C70: (x) | D70: x | E70: SL_tot not given in paper
B71: jsr.rate/ca_rel | C71: x | D71: x
B72: nsr.rate/ca_up | C72: x | D72: x

Sheet: Parameters (AN)
A1: Part | B1: Name (paper) | C1: Name (C++) | D1: Name (CellML) | E1: Name (InaMo) | F1: Unit | G1: Value in paper | H1: Value in C++ | I1: Value in CellML | J1: Value in InaMo | K1: Paper = C++ | L1: C++ = CellML | M1: InaMo = CellML | N1: Paper source
A2: Cell | B2: [Na+]_o | C2: na_out | D2: Nao | E2: na_ex | F2: mM | G2: 140 | H2: 140 | I2: 140 | J2: 140 | K2: of:=IF(OR(ISTEXT([.G2]);ISTEXT([.H2]));"";IF([.G2]=[.H2];"equal";-LOG(ABS([.G2]-[.H2])/MAX(ABS([.G2]);ABS([.H2]));10))) -> equal | L2: of:=IF(OR(ISTEXT([.H2]);ISTEXT([.I2]));"";IF([.H2]=[.I2];"equal";-LOG(ABS([.H2]-[.I2])/MAX(ABS([.H2]);ABS([.I2]));10))) -> equal | M2: of:=IF(OR(ISTEXT([.G2]);ISTEXT([.J2]));"";IF([.G2]=[.J2];"equal";-LOG(ABS([.G2]-[.J2])/MAX(ABS([.G2]);ABS([.J2]));10))) -> equal | N2: Inada2009,S15 | O2: C++ code measures in M instead of mM | R2: of:=COUNTIF([.K2:.K86];"<1")&"/"&(COUNTA([.K2:.K86])-COUNTBLANK([.K2:.K86])) -> 7/70 | S2: of:=COUNTIF([.L2:.L86];"<1")&"/"&(COUNTA([.L2:.L86])-COUNTBLANK([.L2:.L86])) -> 4/77
B3: [Ca2+]_o | C3: ca_out | D3: Cao | E3: ca_ex | F3: mM | G3: 2 | H3: 2 | I3: 2 | J3: 2 | K3: of:=IF(OR(ISTEXT([.G3]);ISTEXT([.H3]));"";IF([.G3]=[.H3];"equal";-LOG(ABS([.G3]-[.H3])/MAX(ABS([.G3]);ABS([.H3]));10))) -> equal | L3: of:=IF(OR(ISTEXT([.H3]);ISTEXT([.I3]));"";IF([.H3]=[.I3];"equal";-LOG(ABS([.H3]-[.I3])/MAX(ABS([.H3]);ABS([.I3]));10))) -> equal | M3: of:=IF(OR(ISTEXT([.G3]);ISTEXT([.J3]));"";IF([.G3]=[.J3];"equal";-LOG(ABS([.G3]-[.J3])/MAX(ABS([.G3]);ABS([.J3]));10))) -> equal | N3: Inada2009,S15
B4: [K+]_o | C4: k_out | D4: Ko | E4: k_ex | F4: mM | G4: 5.4 | H4: 5.4 | I4: 5.4 | J4: 5.4 | K4: of:=IF(OR(ISTEXT([.G4]);ISTEXT([.H4]));"";IF([.G4]=[.H4];"equal";-LOG(ABS([.G4]-[.H4])/MAX(ABS([.G4]);ABS([.H4]));10))) -> equal | L4: of:=IF(OR(ISTEXT([.H4]);ISTEXT([.I4]));"";IF([.H4]=[.I4];"equal";-LOG(ABS([.H4]-[.I4])/MAX(ABS([.H4]);ABS([.I4]));10))) -> equal | M4: of:=IF(OR(ISTEXT([.G4]);ISTEXT([.J4]));"";IF([.G4]=[.J4];"equal";-LOG(ABS([.G4]-[.J4])/MAX(ABS([.G4]);ABS([.J4]));10))) -> equal | N4: Inada2009,S15
B5: [Na+]_i | C5: na_in | D5: Nai | E5: na_in | F5: mM | G5: 8 | H5: 8 | I5: 8 | J5: 8 | K5: of:=IF(OR(ISTEXT([.G5]);ISTEXT([.H5]));"";IF([.G5]=[.H5];"equal";-LOG(ABS([.G5]-[.H5])/MAX(ABS([.G5]);ABS([.H5]));10))) -> equal | L5: of:=IF(OR(ISTEXT([.H5]);ISTEXT([.I5]));"";IF([.H5]=[.I5];"equal";-LOG(ABS([.H5]-[.I5])/MAX(ABS([.H5]);ABS([.I5]));10))) -> equal | M5: of:=IF(OR(ISTEXT([.G5]);ISTEXT([.J5]));"";IF([.G5]=[.J5];"equal";-LOG(ABS([.G5]-[.J5])/MAX(ABS([.G5]);ABS([.J5]));10))) -> equal | N5: Inada2009,S15
B6: [K+]_i | C6: k_in | D6: Ki | E6: k_in | F6: mM | G6: 140 | H6: 140 | I6: 140 | J6: 140 | K6: of:=IF(OR(ISTEXT([.G6]);ISTEXT([.H6]));"";IF([.G6]=[.H6];"equal";-LOG(ABS([.G6]-[.H6])/MAX(ABS([.G6]);ABS([.H6]));10))) -> equal | L6: of:=IF(OR(ISTEXT([.H6]);ISTEXT([.I6]));"";IF([.H6]=[.I6];"equal";-LOG(ABS([.H6]-[.I6])/MAX(ABS([.H6]);ABS([.I6]));10))) -> equal | M6: of:=IF(OR(ISTEXT([.G6]);ISTEXT([.J6]));"";IF([.G6]=[.J6];"equal";-LOG(ABS([.G6]-[.J6])/MAX(ABS([.G6]);ABS([.J6]));10))) -> equal | N6: Inada2009,S15
B7: [Ca2+]_i | C7: ca_in | D7: Cai | E7: ca_sub | F7: mM | G7: 0.0001 | H7: 0.00010817 | J7: 0.0001 | K7: of:=IF(OR(ISTEXT([.G7]);ISTEXT([.H7]));"";IF([.G7]=[.H7];"equal";-LOG(ABS([.G7]-[.H7])/MAX(ABS([.G7]);ABS([.H7]));10))) -> 1.12188477317523 | L7: of:=IF(OR(ISTEXT([.H7]);ISTEXT([.I7]));"";IF([.H7]=[.I7];"equal";-LOG(ABS([.H7]-[.I7])/MAX(ABS([.H7]);ABS([.I7]));10))) -> -0 | M7: of:=IF(OR(ISTEXT([.G7]);ISTEXT([.J7]));"";IF([.G7]=[.J7];"equal";-LOG(ABS([.G7]-[.J7])/MAX(ABS([.G7]);ABS([.J7]));10))) -> equal | N7: Inada2009,Sup-p3 | O7: only used if [Ca2+]_i is assumed to be constant (no CaHandling)
B8: - | C8: ach | D8: ACh | E8: ach | F8: mM | G8: - | H8: - | I8: 0 | J8: 0 | K8: of:=IF(OR(ISTEXT([.G8]);ISTEXT([.H8]));"";IF([.G8]=[.H8];"equal";-LOG(ABS([.G8]-[.H8])/MAX(ABS([.G8]);ABS([.H8]));10))) ->  | L8: of:=IF(OR(ISTEXT([.H8]);ISTEXT([.I8]));"";IF([.H8]=[.I8];"equal";-LOG(ABS([.H8]-[.I8])/MAX(ABS([.H8]);ABS([.I8]));10))) ->  | M8: of:=IF(OR(ISTEXT([.G8]);ISTEXT([.J8]));"";IF([.G8]=[.J8];"equal";-LOG(ABS([.G8]-[.J8])/MAX(ABS([.G8]);ABS([.J8]));10))) ->  | N8: - | O8: not given in C++, seems to be disabled in CellML (always 0)
B9: - | C9: stim_start | D9: stim_start | E9: - | F9: s | G9: - | H9: - | I9: 0.1 | J9: - | K9: of:=IF(OR(ISTEXT([.G9]);ISTEXT([.H9]));"";IF([.G9]=[.H9];"equal";-LOG(ABS([.G9]-[.H9])/MAX(ABS([.G9]);ABS([.H9]));10))) ->  | L9: of:=IF(OR(ISTEXT([.H9]);ISTEXT([.I9]));"";IF([.H9]=[.I9];"equal";-LOG(ABS([.H9]-[.I9])/MAX(ABS([.H9]);ABS([.I9]));10))) ->  | M9: of:=IF(OR(ISTEXT([.G9]);ISTEXT([.J9]));"";IF([.G9]=[.J9];"equal";-LOG(ABS([.G9]-[.J9])/MAX(ABS([.G9]);ABS([.J9]));10))) ->  | N9: -
B10: - | C10: stim_end | D10: stim_end | E10: - | F10: s | G10: - | H10: - | I10: 99999 | J10: - | K10: of:=IF(OR(ISTEXT([.G10]);ISTEXT([.H10]));"";IF([.G10]=[.H10];"equal";-LOG(ABS([.G10]-[.H10])/MAX(ABS([.G10]);ABS([.H10]));10))) ->  | L10: of:=IF(OR(ISTEXT([.H10]);ISTEXT([.I10]));"";IF([.H10]=[.I10];"equal";-LOG(ABS([.H10]-[.I10])/MAX(ABS([.H10]);ABS([.I10]));10))) ->  | M10: of:=IF(OR(ISTEXT([.G10]);ISTEXT([.J10]));"";IF([.G10]=[.J10];"equal";-LOG(ABS([.G10]-[.J10])/MAX(ABS([.G10]);ABS([.J10]));10))) ->  | N10: -
B11: - | C11: stim_period | D11: stim_period | E11: - | F11: s | G11: - | H11: - | I11: 1 | J11: - | K11: of:=IF(OR(ISTEXT([.G11]);ISTEXT([.H11]));"";IF([.G11]=[.H11];"equal";-LOG(ABS([.G11]-[.H11])/MAX(ABS([.G11]);ABS([.H11]));10))) ->  | L11: of:=IF(OR(ISTEXT([.H11]);ISTEXT([.I11]));"";IF([.H11]=[.I11];"equal";-LOG(ABS([.H11]-[.I11])/MAX(ABS([.H11]);ABS([.I11]));10))) ->  | M11: of:=IF(OR(ISTEXT([.G11]);ISTEXT([.J11]));"";IF([.G11]=[.J11];"equal";-LOG(ABS([.G11]-[.J11])/MAX(ABS([.G11]);ABS([.J11]));10))) ->  | N11: -
B12: - | C12: stim_duration | D12: stim_duration | E12: - | F12: s | G12: - | H12: - | I12: 0.001 | J12: - | K12: of:=IF(OR(ISTEXT([.G12]);ISTEXT([.H12]));"";IF([.G12]=[.H12];"equal";-LOG(ABS([.G12]-[.H12])/MAX(ABS([.G12]);ABS([.H12]));10))) ->  | L12: of:=IF(OR(ISTEXT([.H12]);ISTEXT([.I12]));"";IF([.H12]=[.I12];"equal";-LOG(ABS([.H12]-[.I12])/MAX(ABS([.H12]);ABS([.I12]));10))) ->  | M12: of:=IF(OR(ISTEXT([.G12]);ISTEXT([.J12]));"";IF([.G12]=[.J12];"equal";-LOG(ABS([.G12]-[.J12])/MAX(ABS([.G12]);ABS([.J12]));10))) ->  | N12: -
B13: - | C13: i_stim | D13: stim_amplitude | E13: - | F13: A | G13: - | H13: -0.00000000756 | I13: -0.000000002 | J13: - | K13: of:=IF(OR(ISTEXT([.G13]);ISTEXT([.H13]));"";IF([.G13]=[.H13];"equal";-LOG(ABS([.G13]-[.H13])/MAX(ABS([.G13]);ABS([.H13]));10))) ->  | L13: of:=IF(OR(ISTEXT([.H13]);ISTEXT([.I13]));"";IF([.H13]=[.I13];"equal";-LOG(ABS([.H13]-[.I13])/MAX(ABS([.H13]);ABS([.I13]));10))) -> 0.133447003919149 | M13: of:=IF(OR(ISTEXT([.G13]);ISTEXT([.J13]));"";IF([.G13]=[.J13];"equal";-LOG(ABS([.G13]-[.J13])/MAX(ABS([.G13]);ABS([.J13]));10))) ->  | N13: - | O13: C++ uses different values for 1D model and single-cell
B14: C_m | C14: cm | D14: C_m | E14: l2.c | F14: F | G14: 0.00000000004 | H14: 0.00000000004 | I14: 0.00000000004 | J14: 0.00000000004 | K14: of:=IF(OR(ISTEXT([.G14]);ISTEXT([.H14]));"";IF([.G14]=[.H14];"equal";-LOG(ABS([.G14]-[.H14])/MAX(ABS([.G14]);ABS([.H14]));10))) -> equal | L14: of:=IF(OR(ISTEXT([.H14]);ISTEXT([.I14]));"";IF([.H14]=[.I14];"equal";-LOG(ABS([.H14]-[.I14])/MAX(ABS([.H14]);ABS([.I14]));10))) -> equal | M14: of:=IF(OR(ISTEXT([.G14]);ISTEXT([.J14]));"";IF([.G14]=[.J14];"equal";-LOG(ABS([.G14]-[.J14])/MAX(ABS([.G14]);ABS([.J14]));10))) -> equal | N14: Inada2009,S15
B15: T | C15: T | D15: T | E15: temp | F15: K | G15: 310 | H15: 310.15 | I15: 310 | J15: 310 | K15: of:=IF(OR(ISTEXT([.G15]);ISTEXT([.H15]));"";IF([.G15]=[.H15];"equal";-LOG(ABS([.G15]-[.H15])/MAX(ABS([.G15]);ABS([.H15]));10))) -> 3.31548052644537 | L15: of:=IF(OR(ISTEXT([.H15]);ISTEXT([.I15]));"";IF([.H15]=[.I15];"equal";-LOG(ABS([.H15]-[.I15])/MAX(ABS([.H15]);ABS([.I15]));10))) -> 3.31548052644537 | M15: of:=IF(OR(ISTEXT([.G15]);ISTEXT([.J15]));"";IF([.G15]=[.J15];"equal";-LOG(ABS([.G15]-[.J15])/MAX(ABS([.G15]);ABS([.J15]));10))) -> equal | N15: Inada2009,S1
B16: E_K | C16: rev_k | D16: E_K | E16: v_k | F16: V | G16: of:=8.31446261815324 * [.G15] / 96485.33212 * LOG([.G4]/[.G6]) -> -0.0377661201386988 | H16: of:=8.31446261815324 * [.H15] / 96485.33212 * LOG([.H4]/[.H6]) -> -0.0377843940677982 | I16: of:=8.31446261815324 * [.I15] / 96485.33212 * LOG([.I4]/[.I6]) -> -0.0377661201386988 | J16: of:=8.31446261815324 * [.J15] / 96485.33212 * LOG([.J4]/[.J6]) -> -0.0377661201386988 | K16: of:=IF(OR(ISTEXT([.G16]);ISTEXT([.H16]));"";IF([.G16]=[.H16];"equal";-LOG(ABS([.G16]-[.H16])/MAX(ABS([.G16]);ABS([.H16]));10))) -> 3.31548052644541 | L16: of:=IF(OR(ISTEXT([.H16]);ISTEXT([.I16]));"";IF([.H16]=[.I16];"equal";-LOG(ABS([.H16]-[.I16])/MAX(ABS([.H16]);ABS([.I16]));10))) -> 3.31548052644541 | M16: of:=IF(OR(ISTEXT([.G16]);ISTEXT([.J16]));"";IF([.G16]=[.J16];"equal";-LOG(ABS([.G16]-[.J16])/MAX(ABS([.G16]);ABS([.J16]));10))) -> equal | N16: calculated with Nernst, but not given
A17: I_Na | B17: g_Na | C17: - | D17: - | E17: - | F17: S | G17: 0.000000253 | H17: of:=[.H18] * [.H2] / 8.31446261815324 / [.H15] * (96485.33212 * 96485.33212) -> 0.00000025270548106024 | I17: of:=[.I18] * [.I2] / 8.31446261815324 / [.I15] * (96485.33212 * 96485.33212) -> 0.000000252827757905915 | J17: 0.000000253 | K17: of:=IF(OR(ISTEXT([.G17]);ISTEXT([.H17]));"";IF([.G17]=[.H17];"equal";-LOG(ABS([.G17]-[.H17])/MAX(ABS([.G17]);ABS([.H17]));10))) -> 2.93400729278736 | L17: of:=IF(OR(ISTEXT([.H17]);ISTEXT([.I17]));"";IF([.H17]=[.I17];"equal";-LOG(ABS([.H17]-[.I17])/MAX(ABS([.H17]);ABS([.I17]));10))) -> 3.3154805264454 | M17: of:=IF(OR(ISTEXT([.G17]);ISTEXT([.J17]));"";IF([.G17]=[.J17];"equal";-LOG(ABS([.G17]-[.J17])/MAX(ABS([.G17]);ABS([.J17]));10))) -> equal | N17: Inada2009,S15 | O17: CellML and C++ give value for P_Na but misleadingly call variable g_Na, paper gives g_Na instead
B18: - | C18: g_na | D18: g_Na | E18: na_p | F18: m³/s | G18: of:=[.G17]/[.G2] * 8.31446261815324 * [.G15] / (96485.33212 * 96485.33212) -> 5.00340631296801E-016 | H18: 5E-016 | I18: 5E-016 | J18: of:=[.J17]/[.J2] * 8.31446261815324 * [.J15] / (96485.33212 * 96485.33212) -> 5.00340631296801E-016 | K18: of:=IF(OR(ISTEXT([.G18]);ISTEXT([.H18]));"";IF([.G18]=[.H18];"equal";-LOG(ABS([.G18]-[.H18])/MAX(ABS([.G18]);ABS([.H18]));10))) -> 3.16698122426156 | L18: of:=IF(OR(ISTEXT([.H18]);ISTEXT([.I18]));"";IF([.H18]=[.I18];"equal";-LOG(ABS([.H18]-[.I18])/MAX(ABS([.H18]);ABS([.I18]));10))) -> equal | M18: of:=IF(OR(ISTEXT([.G18]);ISTEXT([.J18]));"";IF([.G18]=[.J18];"equal";-LOG(ABS([.G18]-[.J18])/MAX(ABS([.G18]);ABS([.J18]));10))) -> equal | N18: calculated from g_Na via p_from_g
B19: - | C19: NEGLIGIBLE_SMALL | D19: delta_m | E19: - | F19: V | G19: - | H19: 0.000001 | I19: 0.00000001 | J19: 0.000001 | K19: of:=IF(OR(ISTEXT([.G19]);ISTEXT([.H19]));"";IF([.G19]=[.H19];"equal";-LOG(ABS([.G19]-[.H19])/MAX(ABS([.G19]);ABS([.H19]));10))) ->  | L19: of:=IF(OR(ISTEXT([.H19]);ISTEXT([.I19]));"";IF([.H19]=[.I19];"equal";-LOG(ABS([.H19]-[.I19])/MAX(ABS([.H19]);ABS([.I19]));10))) -> 0.00436480540245004 | M19: of:=IF(OR(ISTEXT([.G19]);ISTEXT([.J19]));"";IF([.G19]=[.J19];"equal";-LOG(ABS([.G19]-[.J19])/MAX(ABS([.G19]);ABS([.J19]));10))) ->  | N19: - | O19: delta when discontinuity handling is turned on, not in paper
A20: I_Ca,L | B20: g_Ca,L | C20: g_l | D20: g_CaL | E20: g_max | F20: S | G20: 0.0000000185 | H20: 0.0000000185 | I20: 0.0000000185 | J20: 0.0000000185 | K20: of:=IF(OR(ISTEXT([.G20]);ISTEXT([.H20]));"";IF([.G20]=[.H20];"equal";-LOG(ABS([.G20]-[.H20])/MAX(ABS([.G20]);ABS([.H20]));10))) -> equal | L20: of:=IF(OR(ISTEXT([.H20]);ISTEXT([.I20]));"";IF([.H20]=[.I20];"equal";-LOG(ABS([.H20]-[.I20])/MAX(ABS([.H20]);ABS([.I20]));10))) -> equal | M20: of:=IF(OR(ISTEXT([.G20]);ISTEXT([.J20]));"";IF([.G20]=[.J20];"equal";-LOG(ABS([.G20]-[.J20])/MAX(ABS([.G20]);ABS([.J20]));10))) -> equal | N20: Inada2009,S15
B21: E_Ca,L | C21: rev_l | D21: E_CaL | E21: v_eq | F21: V | G21: 0.0621 | H21: 0.0621 | I21: 0.0625 | J21: 0.0621 | K21: of:=IF(OR(ISTEXT([.G21]);ISTEXT([.H21]));"";IF([.G21]=[.H21];"equal";-LOG(ABS([.G21]-[.H21])/MAX(ABS([.G21]);ABS([.H21]));10))) -> equal | L21: of:=IF(OR(ISTEXT([.H21]);ISTEXT([.I21]));"";IF([.H21]=[.I21];"equal";-LOG(ABS([.H21]-[.I21])/MAX(ABS([.H21]);ABS([.I21]));10))) -> 2.19382002601612 | M21: of:=IF(OR(ISTEXT([.G21]);ISTEXT([.J21]));"";IF([.G21]=[.J21];"equal";-LOG(ABS([.G21]-[.J21])/MAX(ABS([.G21]);ABS([.J21]));10))) -> equal | N21: Inada2009,S15
B22: - | C22: act_shift | D22: act_shift | E22: - | F22: V | G22: 0 | H22: 0 | I22: 0 | J22: 0 | K22: of:=IF(OR(ISTEXT([.G22]);ISTEXT([.H22]));"";IF([.G22]=[.H22];"equal";-LOG(ABS([.G22]-[.H22])/MAX(ABS([.G22]);ABS([.H22]));10))) -> equal | L22: of:=IF(OR(ISTEXT([.H22]);ISTEXT([.I22]));"";IF([.H22]=[.I22];"equal";-LOG(ABS([.H22]-[.I22])/MAX(ABS([.H22]);ABS([.I22]));10))) -> equal | M22: of:=IF(OR(ISTEXT([.G22]);ISTEXT([.J22]));"";IF([.G22]=[.J22];"equal";-LOG(ABS([.G22]-[.J22])/MAX(ABS([.G22]);ABS([.J22]));10))) -> equal | N22: Inada2009,S4 | O22: Paper does not have parameter but changes formula
B23: - | C23: slope_factor_act | D23: slope_factor_act | E23: - | F23: V | G23: -0.00661 | H23: -0.00661 | I23: -0.00661 | J23: -0.00661 | K23: of:=IF(OR(ISTEXT([.G23]);ISTEXT([.H23]));"";IF([.G23]=[.H23];"equal";-LOG(ABS([.G23]-[.H23])/MAX(ABS([.G23]);ABS([.H23]));10))) -> equal | L23: of:=IF(OR(ISTEXT([.H23]);ISTEXT([.I23]));"";IF([.H23]=[.I23];"equal";-LOG(ABS([.H23]-[.I23])/MAX(ABS([.H23]);ABS([.I23]));10))) -> equal | M23: of:=IF(OR(ISTEXT([.G23]);ISTEXT([.J23]));"";IF([.G23]=[.J23];"equal";-LOG(ABS([.G23]-[.J23])/MAX(ABS([.G23]);ABS([.J23]));10))) -> equal | N23: Inada2009,S4 | O23: Paper does not have parameter but changes formula
B24: - | C24: inact_shift | D24: inact_shift (f) | E24: - | F24: V | G24: -0.005 | H24: -0.005 | I24: -0.005 | J24: -0.005 | K24: of:=IF(OR(ISTEXT([.G24]);ISTEXT([.H24]));"";IF([.G24]=[.H24];"equal";-LOG(ABS([.G24]-[.H24])/MAX(ABS([.G24]);ABS([.H24]));10))) -> equal | L24: of:=IF(OR(ISTEXT([.H24]);ISTEXT([.I24]));"";IF([.H24]=[.I24];"equal";-LOG(ABS([.H24]-[.I24])/MAX(ABS([.H24]);ABS([.I24]));10))) -> equal | M24: of:=IF(OR(ISTEXT([.G24]);ISTEXT([.J24]));"";IF([.G24]=[.J24];"equal";-LOG(ABS([.G24]-[.J24])/MAX(ABS([.G24]);ABS([.J24]));10))) -> equal | N24: Inada2009,S4 | O24: Paper has -29mV, CellML and C++ use -24mV – 5mV
B25: - | C25: - | D25: inact_shift (f2) | E25: - | F25: V | G25: -0.005 | H25: -0.005 | I25: -0.005 | J25: -0.005 | K25: of:=IF(OR(ISTEXT([.G25]);ISTEXT([.H25]));"";IF([.G25]=[.H25];"equal";-LOG(ABS([.G25]-[.H25])/MAX(ABS([.G25]);ABS([.H25]));10))) -> equal | L25: of:=IF(OR(ISTEXT([.H25]);ISTEXT([.I25]));"";IF([.H25]=[.I25];"equal";-LOG(ABS([.H25]-[.I25])/MAX(ABS([.H25]);ABS([.I25]));10))) -> equal | M25: of:=IF(OR(ISTEXT([.G25]);ISTEXT([.J25]));"";IF([.G25]=[.J25];"equal";-LOG(ABS([.G25]-[.J25])/MAX(ABS([.G25]);ABS([.J25]));10))) -> equal | N25: Inada2009,S4 | O25: Paper has -29mV, CellML and C++ use -24mV – 5mV
B26: - | C26: ach_l | D26: i_ACh | E26: k_ach | F26: A | G26: - | H26: - | I26: - | J26: - | K26: of:=IF(OR(ISTEXT([.G26]);ISTEXT([.H26]));"";IF([.G26]=[.H26];"equal";-LOG(ABS([.G26]-[.H26])/MAX(ABS([.G26]);ABS([.H26]));10))) ->  | L26: of:=IF(OR(ISTEXT([.H26]);ISTEXT([.I26]));"";IF([.H26]=[.I26];"equal";-LOG(ABS([.H26]-[.I26])/MAX(ABS([.H26]);ABS([.I26]));10))) ->  | M26: of:=IF(OR(ISTEXT([.G26]);ISTEXT([.J26]));"";IF([.G26]=[.J26];"equal";-LOG(ABS([.G26]-[.J26])/MAX(ABS([.G26]);ABS([.J26]));10))) ->  | N26: - | O26: CellML uses current here, but naming and use in C++ suggests that this is supposed to be a parameter
A27: I_to | B27: g_to | C27: g_to | D27: g_to | E27: g_max | F27: S | G27: 0.00000002 | H27: 0.00000002 | I27: 0.00000002 | J27: 0.00000002 | K27: of:=IF(OR(ISTEXT([.G27]);ISTEXT([.H27]));"";IF([.G27]=[.H27];"equal";-LOG(ABS([.G27]-[.H27])/MAX(ABS([.G27]);ABS([.H27]));10))) -> equal | L27: of:=IF(OR(ISTEXT([.H27]);ISTEXT([.I27]));"";IF([.H27]=[.I27];"equal";-LOG(ABS([.H27]-[.I27])/MAX(ABS([.H27]);ABS([.I27]));10))) -> equal | M27: of:=IF(OR(ISTEXT([.G27]);ISTEXT([.J27]));"";IF([.G27]=[.J27];"equal";-LOG(ABS([.G27]-[.J27])/MAX(ABS([.G27]);ABS([.J27]));10))) -> equal | N27: Inada2009,S15
A28: I_K,r | B28: g_K,r | C28: g_kr | D28: g_Kr | E28: g_max | F28: S | G28: 0.0000000015 | H28: 0.0000000015 | I28: 0.0000000015 | J28: 0.0000000015 | K28: of:=IF(OR(ISTEXT([.G28]);ISTEXT([.H28]));"";IF([.G28]=[.H28];"equal";-LOG(ABS([.G28]-[.H28])/MAX(ABS([.G28]);ABS([.H28]));10))) -> equal | L28: of:=IF(OR(ISTEXT([.H28]);ISTEXT([.I28]));"";IF([.H28]=[.I28];"equal";-LOG(ABS([.H28]-[.I28])/MAX(ABS([.H28]);ABS([.I28]));10))) -> equal | M28: of:=IF(OR(ISTEXT([.G28]);ISTEXT([.J28]));"";IF([.G28]=[.J28];"equal";-LOG(ABS([.G28]-[.J28])/MAX(ABS([.G28]);ABS([.J28]));10))) -> equal | N28: Inada2009,S15
A29: I_f | B29: g_f | C29: g_f | D29: g_f | E29: g_f | F29: S | G29: 0 | H29: 0 | I29: 0 | J29: - | K29: of:=IF(OR(ISTEXT([.G29]);ISTEXT([.H29]));"";IF([.G29]=[.H29];"equal";-LOG(ABS([.G29]-[.H29])/MAX(ABS([.G29]);ABS([.H29]));10))) -> equal | L29: of:=IF(OR(ISTEXT([.H29]);ISTEXT([.I29]));"";IF([.H29]=[.I29];"equal";-LOG(ABS([.H29]-[.I29])/MAX(ABS([.H29]);ABS([.I29]));10))) -> equal | M29: of:=IF(OR(ISTEXT([.G29]);ISTEXT([.J29]));"";IF([.G29]=[.J29];"equal";-LOG(ABS([.G29]-[.J29])/MAX(ABS([.G29]);ABS([.J29]));10))) ->  | N29: Inada2009,S15
B30: - | C30: - | D30: - | E30: v_eq | F30: V | G30: -0.03 | H30: -0.03 | I30: -0.03 | J30: - | K30: of:=IF(OR(ISTEXT([.G30]);ISTEXT([.H30]));"";IF([.G30]=[.H30];"equal";-LOG(ABS([.G30]-[.H30])/MAX(ABS([.G30]);ABS([.H30]));10))) -> equal | L30: of:=IF(OR(ISTEXT([.H30]);ISTEXT([.I30]));"";IF([.H30]=[.I30];"equal";-LOG(ABS([.H30]-[.I30])/MAX(ABS([.H30]);ABS([.I30]));10))) -> equal | M30: of:=IF(OR(ISTEXT([.G30]);ISTEXT([.J30]));"";IF([.G30]=[.J30];"equal";-LOG(ABS([.G30]-[.J30])/MAX(ABS([.G30]);ABS([.J30]));10))) ->  | N30: Inada2009,S7 | O30: inlined in CellML
A31: I_st | B31: g_st | C31: g_st | D31: g_st | E31: g_st | F31: S | G31: 0 | H31: 0 | I31: 0 | J31: - | K31: of:=IF(OR(ISTEXT([.G31]);ISTEXT([.H31]));"";IF([.G31]=[.H31];"equal";-LOG(ABS([.G31]-[.H31])/MAX(ABS([.G31]);ABS([.H31]));10))) -> equal | L31: of:=IF(OR(ISTEXT([.H31]);ISTEXT([.I31]));"";IF([.H31]=[.I31];"equal";-LOG(ABS([.H31]-[.I31])/MAX(ABS([.H31]);ABS([.I31]));10))) -> equal | M31: of:=IF(OR(ISTEXT([.G31]);ISTEXT([.J31]));"";IF([.G31]=[.J31];"equal";-LOG(ABS([.G31]-[.J31])/MAX(ABS([.G31]);ABS([.J31]));10))) ->  | N31: Inada2009,S15
B32: E_st | C32: rev_st | D32: E_st | E32: E_st | F32: V | G32: 0.0374 | H32: -0.0374 | I32: -0.0374 | J32: - | K32: of:=IF(OR(ISTEXT([.G32]);ISTEXT([.H32]));"";IF([.G32]=[.H32];"equal";-LOG(ABS([.G32]-[.H32])/MAX(ABS([.G32]);ABS([.H32]));10))) -> -0.301029995663981 | L32: of:=IF(OR(ISTEXT([.H32]);ISTEXT([.I32]));"";IF([.H32]=[.I32];"equal";-LOG(ABS([.H32]-[.I32])/MAX(ABS([.H32]);ABS([.I32]));10))) -> equal | M32: of:=IF(OR(ISTEXT([.G32]);ISTEXT([.J32]));"";IF([.G32]=[.J32];"equal";-LOG(ABS([.G32]-[.J32])/MAX(ABS([.G32]);ABS([.J32]));10))) ->  | N32: Kurata2002,A1 | O32: C++ has wrong sign that was transmitted to CellML
A33: I_K,1 | B33: g_K,1 | C33: g_k1 | D33: g_K1 | E33: g_max | F33: S | G33: 0.0000000125 | H33: 0.0000000125 | I33: 0.0000000125 | J33: 0.0000000125 | K33: of:=IF(OR(ISTEXT([.G33]);ISTEXT([.H33]));"";IF([.G33]=[.H33];"equal";-LOG(ABS([.G33]-[.H33])/MAX(ABS([.G33]);ABS([.H33]));10))) -> equal | L33: of:=IF(OR(ISTEXT([.H33]);ISTEXT([.I33]));"";IF([.H33]=[.I33];"equal";-LOG(ABS([.H33]-[.I33])/MAX(ABS([.H33]);ABS([.I33]));10))) -> equal | M33: of:=IF(OR(ISTEXT([.G33]);ISTEXT([.J33]));"";IF([.G33]=[.J33];"equal";-LOG(ABS([.G33]-[.J33])/MAX(ABS([.G33]);ABS([.J33]));10))) -> equal | N33: Inada2009,S15
A34: I_b | B34: g_b | C34: g_b | D34: g_b | E34: g_max | F34: S | G34: 0.0000000018 | H34: 0.0000000018 | I34: 0.0000000018 | J34: 0.0000000018 | K34: of:=IF(OR(ISTEXT([.G34]);ISTEXT([.H34]));"";IF([.G34]=[.H34];"equal";-LOG(ABS([.G34]-[.H34])/MAX(ABS([.G34]);ABS([.H34]));10))) -> equal | L34: of:=IF(OR(ISTEXT([.H34]);ISTEXT([.I34]));"";IF([.H34]=[.I34];"equal";-LOG(ABS([.H34]-[.I34])/MAX(ABS([.H34]);ABS([.I34]));10))) -> equal | M34: of:=IF(OR(ISTEXT([.G34]);ISTEXT([.J34]));"";IF([.G34]=[.J34];"equal";-LOG(ABS([.G34]-[.J34])/MAX(ABS([.G34]);ABS([.J34]));10))) -> equal | N34: Inada2009,S15
B35: E_b | C35: rev_b | D35: E_b | E35: v_eq | F35: V | G35: -0.0525 | H35: -0.0525 | I35: -0.0525 | J35: -0.0525 | K35: of:=IF(OR(ISTEXT([.G35]);ISTEXT([.H35]));"";IF([.G35]=[.H35];"equal";-LOG(ABS([.G35]-[.H35])/MAX(ABS([.G35]);ABS([.H35]));10))) -> equal | L35: of:=IF(OR(ISTEXT([.H35]);ISTEXT([.I35]));"";IF([.H35]=[.I35];"equal";-LOG(ABS([.H35]-[.I35])/MAX(ABS([.H35]);ABS([.I35]));10))) -> equal | M35: of:=IF(OR(ISTEXT([.G35]);ISTEXT([.J35]));"";IF([.G35]=[.J35];"equal";-LOG(ABS([.G35]-[.J35])/MAX(ABS([.G35]);ABS([.J35]));10))) -> equal | N35: Inada2009,S15
A36: I_p | B36: I_p,max | C36: p_max | D36: I_p | E36: i_max | F36: A | G36: 0.0000000000246 | H36: of:=0.0000000000984*0.25 -> 0.0000000000246 | I36: 0.0000000000246 | J36: 0.0000000000246 | K36: of:=IF(OR(ISTEXT([.G36]);ISTEXT([.H36]));"";IF([.G36]=[.H36];"equal";-LOG(ABS([.G36]-[.H36])/MAX(ABS([.G36]);ABS([.H36]));10))) -> equal | L36: of:=IF(OR(ISTEXT([.H36]);ISTEXT([.I36]));"";IF([.H36]=[.I36];"equal";-LOG(ABS([.H36]-[.I36])/MAX(ABS([.H36]);ABS([.I36]));10))) -> equal | M36: of:=IF(OR(ISTEXT([.G36]);ISTEXT([.J36]));"";IF([.G36]=[.J36];"equal";-LOG(ABS([.G36]-[.J36])/MAX(ABS([.G36]);ABS([.J36]));10))) -> equal | N36: Inada2009,S15 | O36: called \bar{I} in formula
B37: K_m,Na | C37: - | D37: - | E37: k_m_Na | F37: mM | G37: 5.64 | H37: 5.64 | I37: 5.64 | J37: 5.64 | K37: of:=IF(OR(ISTEXT([.G37]);ISTEXT([.H37]));"";IF([.G37]=[.H37];"equal";-LOG(ABS([.G37]-[.H37])/MAX(ABS([.G37]);ABS([.H37]));10))) -> equal | L37: of:=IF(OR(ISTEXT([.H37]);ISTEXT([.I37]));"";IF([.H37]=[.I37];"equal";-LOG(ABS([.H37]-[.I37])/MAX(ABS([.H37]);ABS([.I37]));10))) -> equal | M37: of:=IF(OR(ISTEXT([.G37]);ISTEXT([.J37]));"";IF([.G37]=[.J37];"equal";-LOG(ABS([.G37]-[.J37])/MAX(ABS([.G37]);ABS([.J37]));10))) -> equal | N37: Zhang2000,Table 10 | O37: Demir1994 gives 5.46, but Zhang2000 gives 5.64
B38: K_m,K | C38: - | D38: - | E38: k_m_K | F38: mM | G38: 0.621 | H38: 0.621 | I38: 0.621 | J38: 0.621 | K38: of:=IF(OR(ISTEXT([.G38]);ISTEXT([.H38]));"";IF([.G38]=[.H38];"equal";-LOG(ABS([.G38]-[.H38])/MAX(ABS([.G38]);ABS([.H38]));10))) -> equal | L38: of:=IF(OR(ISTEXT([.H38]);ISTEXT([.I38]));"";IF([.H38]=[.I38];"equal";-LOG(ABS([.H38]-[.I38])/MAX(ABS([.H38]);ABS([.I38]));10))) -> equal | M38: of:=IF(OR(ISTEXT([.G38]);ISTEXT([.J38]));"";IF([.G38]=[.J38];"equal";-LOG(ABS([.G38]-[.J38])/MAX(ABS([.G38]);ABS([.J38]));10))) -> equal | N38: Zhang2000,Table 10
A39: I_NaCa | B39: k_NaCa | C39: k_naca | D39: kNaCa | E39: k_NaCa | F39: A | G39: 0.00000000592 | H39: of:=0.0000000011832 * 5 -> 0.000000005916 | I39: 0.000000005916 | J39: 0.00000000592 | K39: of:=IF(OR(ISTEXT([.G39]);ISTEXT([.H39]));"";IF([.G39]=[.H39];"equal";-LOG(ABS([.G39]-[.H39])/MAX(ABS([.G39]);ABS([.H39]));10))) -> 3.17026171539491 | L39: of:=IF(OR(ISTEXT([.H39]);ISTEXT([.I39]));"";IF([.H39]=[.I39];"equal";-LOG(ABS([.H39]-[.I39])/MAX(ABS([.H39]);ABS([.I39]));10))) -> equal | M39: of:=IF(OR(ISTEXT([.G39]);ISTEXT([.J39]));"";IF([.G39]=[.J39];"equal";-LOG(ABS([.G39]-[.J39])/MAX(ABS([.G39]);ABS([.J39]));10))) -> equal | N39: Inada2009,S15
B40: Qci | C40: - | D40: Qci | E40: q_ci | F40: 1 | G40: 0.1369 | H40: 0.1369 | I40: 0.1369 | J40: 0.1369 | K40: of:=IF(OR(ISTEXT([.G40]);ISTEXT([.H40]));"";IF([.G40]=[.H40];"equal";-LOG(ABS([.G40]-[.H40])/MAX(ABS([.G40]);ABS([.H40]));10))) -> equal | L40: of:=IF(OR(ISTEXT([.H40]);ISTEXT([.I40]));"";IF([.H40]=[.I40];"equal";-LOG(ABS([.H40]-[.I40])/MAX(ABS([.H40]);ABS([.I40]));10))) -> equal | M40: of:=IF(OR(ISTEXT([.G40]);ISTEXT([.J40]));"";IF([.G40]=[.J40];"equal";-LOG(ABS([.G40]-[.J40])/MAX(ABS([.G40]);ABS([.J40]));10))) -> equal | N40: Dokos1996,p271
B41: Qn | C41: - | D41: Qn | E41: q_n | F41: 1 | G41: 0.4315 | H41: 0.4315 | I41: 0.4315 | J41: 0.4315 | K41: of:=IF(OR(ISTEXT([.G41]);ISTEXT([.H41]));"";IF([.G41]=[.H41];"equal";-LOG(ABS([.G41]-[.H41])/MAX(ABS([.G41]);ABS([.H41]));10))) -> equal | L41: of:=IF(OR(ISTEXT([.H41]);ISTEXT([.I41]));"";IF([.H41]=[.I41];"equal";-LOG(ABS([.H41]-[.I41])/MAX(ABS([.H41]);ABS([.I41]));10))) -> equal | M41: of:=IF(OR(ISTEXT([.G41]);ISTEXT([.J41]));"";IF([.G41]=[.J41];"equal";-LOG(ABS([.G41]-[.J41])/MAX(ABS([.G41]);ABS([.J41]));10))) -> equal | N41: Dokos1996,p271
B42: Qco | C42: - | D42: Qco | E42: q_co | F42: 1 | G42: 0 | H42: 0 | I42: 0 | J42: 0 | K42: of:=IF(OR(ISTEXT([.G42]);ISTEXT([.H42]));"";IF([.G42]=[.H42];"equal";-LOG(ABS([.G42]-[.H42])/MAX(ABS([.G42]);ABS([.H42]));10))) -> equal | L42: of:=IF(OR(ISTEXT([.H42]);ISTEXT([.I42]));"";IF([.H42]=[.I42];"equal";-LOG(ABS([.H42]-[.I42])/MAX(ABS([.H42]);ABS([.I42]));10))) -> equal | M42: of:=IF(OR(ISTEXT([.G42]);ISTEXT([.J42]));"";IF([.G42]=[.J42];"equal";-LOG(ABS([.G42]-[.J42])/MAX(ABS([.G42]);ABS([.J42]));10))) -> equal | N42: Dokos1996,p271
B43: Kci | C43: - | D43: Kci | E43: k_c_i | F43: mM | G43: 0.0207 | H43: 0.0207 | I43: 0.0207 | J43: 0.0207 | K43: of:=IF(OR(ISTEXT([.G43]);ISTEXT([.H43]));"";IF([.G43]=[.H43];"equal";-LOG(ABS([.G43]-[.H43])/MAX(ABS([.G43]);ABS([.H43]));10))) -> equal | L43: of:=IF(OR(ISTEXT([.H43]);ISTEXT([.I43]));"";IF([.H43]=[.I43];"equal";-LOG(ABS([.H43]-[.I43])/MAX(ABS([.H43]);ABS([.I43]));10))) -> equal | M43: of:=IF(OR(ISTEXT([.G43]);ISTEXT([.J43]));"";IF([.G43]=[.J43];"equal";-LOG(ABS([.G43]-[.J43])/MAX(ABS([.G43]);ABS([.J43]));10))) -> equal | N43: Dokos1996,p271
B44: K1ni | C44: - | D44: K1ni | E44: k_1n_i | F44: mM | G44: 395.3 | H44: 395.3 | I44: 395.3 | J44: 395.3 | K44: of:=IF(OR(ISTEXT([.G44]);ISTEXT([.H44]));"";IF([.G44]=[.H44];"equal";-LOG(ABS([.G44]-[.H44])/MAX(ABS([.G44]);ABS([.H44]));10))) -> equal | L44: of:=IF(OR(ISTEXT([.H44]);ISTEXT([.I44]));"";IF([.H44]=[.I44];"equal";-LOG(ABS([.H44]-[.I44])/MAX(ABS([.H44]);ABS([.I44]));10))) -> equal | M44: of:=IF(OR(ISTEXT([.G44]);ISTEXT([.J44]));"";IF([.G44]=[.J44];"equal";-LOG(ABS([.G44]-[.J44])/MAX(ABS([.G44]);ABS([.J44]));10))) -> equal | N44: Dokos1996,p271
B45: K2ni | C45: - | D45: K2ni | E45: k_2n_i | F45: mM | G45: 2.289 | H45: 2.289 | I45: 2.289 | J45: 2.289 | K45: of:=IF(OR(ISTEXT([.G45]);ISTEXT([.H45]));"";IF([.G45]=[.H45];"equal";-LOG(ABS([.G45]-[.H45])/MAX(ABS([.G45]);ABS([.H45]));10))) -> equal | L45: of:=IF(OR(ISTEXT([.H45]);ISTEXT([.I45]));"";IF([.H45]=[.I45];"equal";-LOG(ABS([.H45]-[.I45])/MAX(ABS([.H45]);ABS([.I45]));10))) -> equal | M45: of:=IF(OR(ISTEXT([.G45]);ISTEXT([.J45]));"";IF([.G45]=[.J45];"equal";-LOG(ABS([.G45]-[.J45])/MAX(ABS([.G45]);ABS([.J45]));10))) -> equal | N45: Dokos1996,p271
B46: K3ni | C46: - | D46: K3ni | E46: k_3n_i | F46: mM | G46: 26.44 | H46: 26.44 | I46: 26.44 | J46: 26.44 | K46: of:=IF(OR(ISTEXT([.G46]);ISTEXT([.H46]));"";IF([.G46]=[.H46];"equal";-LOG(ABS([.G46]-[.H46])/MAX(ABS([.G46]);ABS([.H46]));10))) -> equal | L46: of:=IF(OR(ISTEXT([.H46]);ISTEXT([.I46]));"";IF([.H46]=[.I46];"equal";-LOG(ABS([.H46]-[.I46])/MAX(ABS([.H46]);ABS([.I46]));10))) -> equal | M46: of:=IF(OR(ISTEXT([.G46]);ISTEXT([.J46]));"";IF([.G46]=[.J46];"equal";-LOG(ABS([.G46]-[.J46])/MAX(ABS([.G46]);ABS([.J46]));10))) -> equal | N46: Dokos1996,p271
B47: Kcni | C47: - | D47: Kcni | E47: k_cn_i | F47: mM | G47: 26.44 | H47: 26.44 | I47: 26.44 | J47: 26.44 | K47: of:=IF(OR(ISTEXT([.G47]);ISTEXT([.H47]));"";IF([.G47]=[.H47];"equal";-LOG(ABS([.G47]-[.H47])/MAX(ABS([.G47]);ABS([.H47]));10))) -> equal | L47: of:=IF(OR(ISTEXT([.H47]);ISTEXT([.I47]));"";IF([.H47]=[.I47];"equal";-LOG(ABS([.H47]-[.I47])/MAX(ABS([.H47]);ABS([.I47]));10))) -> equal | M47: of:=IF(OR(ISTEXT([.G47]);ISTEXT([.J47]));"";IF([.G47]=[.J47];"equal";-LOG(ABS([.G47]-[.J47])/MAX(ABS([.G47]);ABS([.J47]));10))) -> equal | N47: Dokos1996,p271
B48: K3no | C48: - | D48: K3no | E48: k_3n_o | F48: mM | G48: 4.663 | H48: 4.663 | I48: 4.663 | J48: 4.663 | K48: of:=IF(OR(ISTEXT([.G48]);ISTEXT([.H48]));"";IF([.G48]=[.H48];"equal";-LOG(ABS([.G48]-[.H48])/MAX(ABS([.G48]);ABS([.H48]));10))) -> equal | L48: of:=IF(OR(ISTEXT([.H48]);ISTEXT([.I48]));"";IF([.H48]=[.I48];"equal";-LOG(ABS([.H48]-[.I48])/MAX(ABS([.H48]);ABS([.I48]));10))) -> equal | M48: of:=IF(OR(ISTEXT([.G48]);ISTEXT([.J48]));"";IF([.G48]=[.J48];"equal";-LOG(ABS([.G48]-[.J48])/MAX(ABS([.G48]);ABS([.J48]));10))) -> equal | N48: Dokos1996,p271
B49: K1no | C49: - | D49: K1no | E49: k_1n_o | F49: mM | G49: 1628 | H49: 1628 | I49: 1628 | J49: 1628 | K49: of:=IF(OR(ISTEXT([.G49]);ISTEXT([.H49]));"";IF([.G49]=[.H49];"equal";-LOG(ABS([.G49]-[.H49])/MAX(ABS([.G49]);ABS([.H49]));10))) -> equal | L49: of:=IF(OR(ISTEXT([.H49]);ISTEXT([.I49]));"";IF([.H49]=[.I49];"equal";-LOG(ABS([.H49]-[.I49])/MAX(ABS([.H49]);ABS([.I49]));10))) -> equal | M49: of:=IF(OR(ISTEXT([.G49]);ISTEXT([.J49]));"";IF([.G49]=[.J49];"equal";-LOG(ABS([.G49]-[.J49])/MAX(ABS([.G49]);ABS([.J49]));10))) -> equal | N49: Dokos1996,p271
B50: K2no | C50: - | D50: K2no | E50: k_2n_o | F50: mM | G50: 561.4 | H50: 561.4 | I50: 561.4 | J50: 561.4 | K50: of:=IF(OR(ISTEXT([.G50]);ISTEXT([.H50]));"";IF([.G50]=[.H50];"equal";-LOG(ABS([.G50]-[.H50])/MAX(ABS([.G50]);ABS([.H50]));10))) -> equal | L50: of:=IF(OR(ISTEXT([.H50]);ISTEXT([.I50]));"";IF([.H50]=[.I50];"equal";-LOG(ABS([.H50]-[.I50])/MAX(ABS([.H50]);ABS([.I50]));10))) -> equal | M50: of:=IF(OR(ISTEXT([.G50]);ISTEXT([.J50]));"";IF([.G50]=[.J50];"equal";-LOG(ABS([.G50]-[.J50])/MAX(ABS([.G50]);ABS([.J50]));10))) -> equal | N50: Dokos1996,p271
B51: Kco | C51: - | D51: Kco | E51: k_c_o | F51: mM | G51: 3.663 | H51: 3.663 | I51: 3.663 | J51: 3.663 | K51: of:=IF(OR(ISTEXT([.G51]);ISTEXT([.H51]));"";IF([.G51]=[.H51];"equal";-LOG(ABS([.G51]-[.H51])/MAX(ABS([.G51]);ABS([.H51]));10))) -> equal | L51: of:=IF(OR(ISTEXT([.H51]);ISTEXT([.I51]));"";IF([.H51]=[.I51];"equal";-LOG(ABS([.H51]-[.I51])/MAX(ABS([.H51]);ABS([.I51]));10))) -> equal | M51: of:=IF(OR(ISTEXT([.G51]);ISTEXT([.J51]));"";IF([.G51]=[.J51];"equal";-LOG(ABS([.G51]-[.J51])/MAX(ABS([.G51]);ABS([.J51]));10))) -> equal | N51: Dokos1996,p271
A52: I_Ach | B52: - | C52: g_ach_max | D52: g_ACh_max | E52: g_max | F52: S | G52: - | H52: 0.0000000198 | I52: 0.0000000198 | J52: - | K52: of:=IF(OR(ISTEXT([.G52]);ISTEXT([.H52]));"";IF([.G52]=[.H52];"equal";-LOG(ABS([.G52]-[.H52])/MAX(ABS([.G52]);ABS([.H52]));10))) ->  | L52: of:=IF(OR(ISTEXT([.H52]);ISTEXT([.I52]));"";IF([.H52]=[.I52];"equal";-LOG(ABS([.H52]-[.I52])/MAX(ABS([.H52]);ABS([.I52]));10))) -> equal | M52: of:=IF(OR(ISTEXT([.G52]);ISTEXT([.J52]));"";IF([.G52]=[.J52];"equal";-LOG(ABS([.G52]-[.J52])/MAX(ABS([.G52]);ABS([.J52]));10))) ->  | N52: - | O52: not in paper
B53: - | C53: k_ach | D53: K_ACh | E53: k_ach | F53: mM | G53: - | H53: 0.00035 | I53: 0.00035 | J53: - | K53: of:=IF(OR(ISTEXT([.G53]);ISTEXT([.H53]));"";IF([.G53]=[.H53];"equal";-LOG(ABS([.G53]-[.H53])/MAX(ABS([.G53]);ABS([.H53]));10))) ->  | L53: of:=IF(OR(ISTEXT([.H53]);ISTEXT([.I53]));"";IF([.H53]=[.I53];"equal";-LOG(ABS([.H53]-[.I53])/MAX(ABS([.H53]);ABS([.I53]));10))) -> equal | M53: of:=IF(OR(ISTEXT([.G53]);ISTEXT([.J53]));"";IF([.G53]=[.J53];"equal";-LOG(ABS([.G53]-[.J53])/MAX(ABS([.G53]);ABS([.J53]));10))) ->  | N53: - | O53: not in paper
B54: - | C54: inact_fast.n.start | D54: achf | E54: inact_fast.n.start | F54: 1 | G54: - | H54: - | I54: 0.760266 | J54: - | K54: of:=IF(OR(ISTEXT([.G54]);ISTEXT([.H54]));"";IF([.G54]=[.H54];"equal";-LOG(ABS([.G54]-[.H54])/MAX(ABS([.G54]);ABS([.H54]));10))) ->  | L54: of:=IF(OR(ISTEXT([.H54]);ISTEXT([.I54]));"";IF([.H54]=[.I54];"equal";-LOG(ABS([.H54]-[.I54])/MAX(ABS([.H54]);ABS([.I54]));10))) ->  | M54: of:=IF(OR(ISTEXT([.G54]);ISTEXT([.J54]));"";IF([.G54]=[.J54];"equal";-LOG(ABS([.G54]-[.J54])/MAX(ABS([.G54]);ABS([.J54]));10))) ->  | N54: - | O54: not in paper
B55: - | C55: alpha_achf | D55: alpha_achf | E55: - | F55: 1/s | G55: - | H55: 73.1 | I55: 73.1 | J55: 73.1 | K55: of:=IF(OR(ISTEXT([.G55]);ISTEXT([.H55]));"";IF([.G55]=[.H55];"equal";-LOG(ABS([.G55]-[.H55])/MAX(ABS([.G55]);ABS([.H55]));10))) ->  | L55: of:=IF(OR(ISTEXT([.H55]);ISTEXT([.I55]));"";IF([.H55]=[.I55];"equal";-LOG(ABS([.H55]-[.I55])/MAX(ABS([.H55]);ABS([.I55]));10))) -> equal | M55: of:=IF(OR(ISTEXT([.G55]);ISTEXT([.J55]));"";IF([.G55]=[.J55];"equal";-LOG(ABS([.G55]-[.J55])/MAX(ABS([.G55]);ABS([.J55]));10))) ->  | N55: - | O55: not in paper
B56: - | C56: alpha_achs | D56: alpha_achs | E56: - | F56: 1/s | G56: - | H56: 3.7 | I56: 3.7 | J56: 3.7 | K56: of:=IF(OR(ISTEXT([.G56]);ISTEXT([.H56]));"";IF([.G56]=[.H56];"equal";-LOG(ABS([.G56]-[.H56])/MAX(ABS([.G56]);ABS([.H56]));10))) ->  | L56: of:=IF(OR(ISTEXT([.H56]);ISTEXT([.I56]));"";IF([.H56]=[.I56];"equal";-LOG(ABS([.H56]-[.I56])/MAX(ABS([.H56]);ABS([.I56]));10))) -> equal | M56: of:=IF(OR(ISTEXT([.G56]);ISTEXT([.J56]));"";IF([.G56]=[.J56];"equal";-LOG(ABS([.G56]-[.J56])/MAX(ABS([.G56]);ABS([.J56]));10))) ->  | N56: - | O56: not in paper
B57: - | C57: inact_slow.n.start | D57: achs | E57: inact_slow.n.start | F57: 1 | G57: - | H57: - | I57: 0.764665 | J57: - | K57: of:=IF(OR(ISTEXT([.G57]);ISTEXT([.H57]));"";IF([.G57]=[.H57];"equal";-LOG(ABS([.G57]-[.H57])/MAX(ABS([.G57]);ABS([.H57]));10))) ->  | L57: of:=IF(OR(ISTEXT([.H57]);ISTEXT([.I57]));"";IF([.H57]=[.I57];"equal";-LOG(ABS([.H57]-[.I57])/MAX(ABS([.H57]);ABS([.I57]));10))) ->  | M57: of:=IF(OR(ISTEXT([.G57]);ISTEXT([.J57]));"";IF([.G57]=[.J57];"equal";-LOG(ABS([.G57]-[.J57])/MAX(ABS([.G57]);ABS([.J57]));10))) ->  | N57: - | O57: not in paper
A58: CaHandling | B58: V_cell | C58: vol_cell | D58: V_cell | E58: v_cell | F58: m³ | G58: 3.5E-015 | H58: of:= 1/1000 * (([.$H14] - 0.00000000002) / 0.000000000045 * (0.000000000007147123 - 0.00000000000219911) + 0.00000000000219911) -> 4.39822688888889E-015 | I58: of:=0.00000439823 / POWER(1000;3) -> 4.39823E-015 | J58: of:= 1/1000 * (([.$J14] - 0.00000000002) / 0.000000000045 * (0.000000000007147123 - 0.00000000000219911) + 0.00000000000219911) -> 4.39822688888889E-015 | K58: of:=IF(OR(ISTEXT([.G58]);ISTEXT([.H58]));"";IF([.G58]=[.H58];"equal";-LOG(ABS([.G58]-[.H58])/MAX(ABS([.G58]);ABS([.H58]));10))) -> 0.68989157755861 | L58: of:=IF(OR(ISTEXT([.H58]);ISTEXT([.I58]));"";IF([.H58]=[.I58];"equal";-LOG(ABS([.H58]-[.I58])/MAX(ABS([.H58]);ABS([.I58]));10))) -> 6.15036241454006 | M58: of:=IF(OR(ISTEXT([.G58]);ISTEXT([.J58]));"";IF([.G58]=[.J58];"equal";-LOG(ABS([.G58]-[.J58])/MAX(ABS([.G58]);ABS([.J58]));10))) -> 0.68989157755861 | N58: Kurata2002,A1 | O58: C++ code uses function based on C_m that is not given in paper
B59: V_i | C59: vol_i | D59: v_cyto | E59: v_cyto | F59: m³ | G59: of:=0.46*[.G58]-[.G60] -> 1.575E-015 | H59: of:=0.46*[.H58]-[.H60] -> 1.9792021E-015 | I59: of:=0.46*[.I58]-[.I60] -> 1.9792035E-015 | J59: of:=0.46*[.J58]-[.J60] -> 1.9792021E-015 | K59: of:=IF(OR(ISTEXT([.G59]);ISTEXT([.H59]));"";IF([.G59]=[.H59];"equal";-LOG(ABS([.G59]-[.H59])/MAX(ABS([.G59]);ABS([.H59]));10))) -> 0.68989157755861 | L59: of:=IF(OR(ISTEXT([.H59]);ISTEXT([.I59]));"";IF([.H59]=[.I59];"equal";-LOG(ABS([.H59]-[.I59])/MAX(ABS([.H59]);ABS([.I59]));10))) -> 6.15036241444218 | M59: of:=IF(OR(ISTEXT([.G59]);ISTEXT([.J59]));"";IF([.G59]=[.J59];"equal";-LOG(ABS([.G59]-[.J59])/MAX(ABS([.G59]);ABS([.J59]));10))) -> 0.68989157755861 | N59: Kurata2002,A1
B60: V_sub | C60: vol_sub | D60: v_sub | E60: v_sub | F60: m³ | G60: of:=0.01*[.G58] -> 3.5E-017 | H60: of:=0.01*[.H58] -> 4.39822688888889E-017 | I60: of:=0.01*[.I58] -> 4.39823E-017 | J60: of:=0.01*[.J58] -> 4.39822688888889E-017 | K60: of:=IF(OR(ISTEXT([.G60]);ISTEXT([.H60]));"";IF([.G60]=[.H60];"equal";-LOG(ABS([.G60]-[.H60])/MAX(ABS([.G60]);ABS([.H60]));10))) -> 0.68989157755861 | L60: of:=IF(OR(ISTEXT([.H60]);ISTEXT([.I60]));"";IF([.H60]=[.I60];"equal";-LOG(ABS([.H60]-[.I60])/MAX(ABS([.H60]);ABS([.I60]));10))) -> 6.1503624145435 | M60: of:=IF(OR(ISTEXT([.G60]);ISTEXT([.J60]));"";IF([.G60]=[.J60];"equal";-LOG(ABS([.G60]-[.J60])/MAX(ABS([.G60]);ABS([.J60]));10))) -> 0.68989157755861 | N60: Kurata2002,A1
B61: V_rel | C61: vol_rel | D61: v_jsr/v_rel | E61: v_jsr | F61: m³ | G61: of:=0.0012*[.G58] -> 4.2E-018 | H61: of:=0.0012*[.H58] -> 5.27787226666667E-018 | I61: of:=0.0012*[.I58] -> 5.277876E-018 | J61: of:=0.0012*[.J58] -> 5.27787226666667E-018 | K61: of:=IF(OR(ISTEXT([.G61]);ISTEXT([.H61]));"";IF([.G61]=[.H61];"equal";-LOG(ABS([.G61]-[.H61])/MAX(ABS([.G61]);ABS([.H61]));10))) -> 0.68989157755861 | L61: of:=IF(OR(ISTEXT([.H61]);ISTEXT([.I61]));"";IF([.H61]=[.I61];"equal";-LOG(ABS([.H61]-[.I61])/MAX(ABS([.H61]);ABS([.I61]));10))) -> 6.15036241457576 | M61: of:=IF(OR(ISTEXT([.G61]);ISTEXT([.J61]));"";IF([.G61]=[.J61];"equal";-LOG(ABS([.G61]-[.J61])/MAX(ABS([.G61]);ABS([.J61]));10))) -> 0.68989157755861 | N61: Kurata2002,A1
B62: V_up | C62: vol_up | D62: v_nsr/v_up | E62: v_nsr | F62: m³ | G62: of:=0.0116*[.G58] -> 4.06E-017 | H62: of:=0.0116*[.H58] -> 5.10194319111111E-017 | I62: of:=0.0116*[.I58] -> 5.1019468E-017 | J62: of:=0.0116*[.J58] -> 5.10194319111111E-017 | K62: of:=IF(OR(ISTEXT([.G62]);ISTEXT([.H62]));"";IF([.G62]=[.H62];"equal";-LOG(ABS([.G62]-[.H62])/MAX(ABS([.G62]);ABS([.H62]));10))) -> 0.68989157755861 | L62: of:=IF(OR(ISTEXT([.H62]);ISTEXT([.I62]));"";IF([.H62]=[.I62];"equal";-LOG(ABS([.H62]-[.I62])/MAX(ABS([.H62]);ABS([.I62]));10))) -> 6.15036241458504 | M62: of:=IF(OR(ISTEXT([.G62]);ISTEXT([.J62]));"";IF([.G62]=[.J62];"equal";-LOG(ABS([.G62]-[.J62])/MAX(ABS([.G62]);ABS([.J62]));10))) -> 0.68989157755861 | N62: Kurata2002,A1
B63: k_b_CM | C63: - | D63: - | E63: BufferCM.kb | F63: 1/s | G63: 542 | H63: 542 | I63: 542 | J63: 542 | K63: of:=IF(OR(ISTEXT([.G63]);ISTEXT([.H63]));"";IF([.G63]=[.H63];"equal";-LOG(ABS([.G63]-[.H63])/MAX(ABS([.G63]);ABS([.H63]));10))) -> equal | L63: of:=IF(OR(ISTEXT([.H63]);ISTEXT([.I63]));"";IF([.H63]=[.I63];"equal";-LOG(ABS([.H63]-[.I63])/MAX(ABS([.H63]);ABS([.I63]));10))) -> equal | M63: of:=IF(OR(ISTEXT([.G63]);ISTEXT([.J63]));"";IF([.G63]=[.J63];"equal";-LOG(ABS([.G63]-[.J63])/MAX(ABS([.G63]);ABS([.J63]));10))) -> equal | N63: Kurata2002,A1
B64: k_b_CQ | C64: - | D64: - | E64: cq.kb | F64: 1/s | G64: 445 | H64: 445 | I64: 445 | J64: 445 | K64: of:=IF(OR(ISTEXT([.G64]);ISTEXT([.H64]));"";IF([.G64]=[.H64];"equal";-LOG(ABS([.G64]-[.H64])/MAX(ABS([.G64]);ABS([.H64]));10))) -> equal | L64: of:=IF(OR(ISTEXT([.H64]);ISTEXT([.I64]));"";IF([.H64]=[.I64];"equal";-LOG(ABS([.H64]-[.I64])/MAX(ABS([.H64]);ABS([.I64]));10))) -> equal | M64: of:=IF(OR(ISTEXT([.G64]);ISTEXT([.J64]));"";IF([.G64]=[.J64];"equal";-LOG(ABS([.G64]-[.J64])/MAX(ABS([.G64]);ABS([.J64]));10))) -> equal | N64: Kurata2002,A1
B65: k_b_TC | C65: - | D65: - | E65: tc.kb | F65: 1/s | G65: 446 | H65: 446 | I65: 446 | J65: 446 | K65: of:=IF(OR(ISTEXT([.G65]);ISTEXT([.H65]));"";IF([.G65]=[.H65];"equal";-LOG(ABS([.G65]-[.H65])/MAX(ABS([.G65]);ABS([.H65]));10))) -> equal | L65: of:=IF(OR(ISTEXT([.H65]);ISTEXT([.I65]));"";IF([.H65]=[.I65];"equal";-LOG(ABS([.H65]-[.I65])/MAX(ABS([.H65]);ABS([.I65]));10))) -> equal | M65: of:=IF(OR(ISTEXT([.G65]);ISTEXT([.J65]));"";IF([.G65]=[.J65];"equal";-LOG(ABS([.G65]-[.J65])/MAX(ABS([.G65]);ABS([.J65]));10))) -> equal | N65: Kurata2002,A1
B66: k_b_TMC | C66: - | D66: - | E66: tmc.kb | F66: 1/s | G66: 7.51 | H66: 7.51 | I66: 7.51 | J66: 7.51 | K66: of:=IF(OR(ISTEXT([.G66]);ISTEXT([.H66]));"";IF([.G66]=[.H66];"equal";-LOG(ABS([.G66]-[.H66])/MAX(ABS([.G66]);ABS([.H66]));10))) -> equal | L66: of:=IF(OR(ISTEXT([.H66]);ISTEXT([.I66]));"";IF([.H66]=[.I66];"equal";-LOG(ABS([.H66]-[.I66])/MAX(ABS([.H66]);ABS([.I66]));10))) -> equal | M66: of:=IF(OR(ISTEXT([.G66]);ISTEXT([.J66]));"";IF([.G66]=[.J66];"equal";-LOG(ABS([.G66]-[.J66])/MAX(ABS([.G66]);ABS([.J66]));10))) -> equal | N66: Kurata2002,A1
B67: k_b_TMM | C67: - | D67: - | E67: tmm.kb | F67: 1/s | G67: 751 | H67: 751 | I67: 751 | J67: 751 | K67: of:=IF(OR(ISTEXT([.G67]);ISTEXT([.H67]));"";IF([.G67]=[.H67];"equal";-LOG(ABS([.G67]-[.H67])/MAX(ABS([.G67]);ABS([.H67]));10))) -> equal | L67: of:=IF(OR(ISTEXT([.H67]);ISTEXT([.I67]));"";IF([.H67]=[.I67];"equal";-LOG(ABS([.H67]-[.I67])/MAX(ABS([.H67]);ABS([.I67]));10))) -> equal | M67: of:=IF(OR(ISTEXT([.G67]);ISTEXT([.J67]));"";IF([.G67]=[.J67];"equal";-LOG(ABS([.G67]-[.J67])/MAX(ABS([.G67]);ABS([.J67]));10))) -> equal | N67: Kurata2002,A1
B68: k_b_SL | C68: - | D68: - | E68: sl.kb | F68: 1/s | G68: 1 | H68: 1 | I68: 1 | J68: 1 | K68: of:=IF(OR(ISTEXT([.G68]);ISTEXT([.H68]));"";IF([.G68]=[.H68];"equal";-LOG(ABS([.G68]-[.H68])/MAX(ABS([.G68]);ABS([.H68]));10))) -> equal | L68: of:=IF(OR(ISTEXT([.H68]);ISTEXT([.I68]));"";IF([.H68]=[.I68];"equal";-LOG(ABS([.H68]-[.I68])/MAX(ABS([.H68]);ABS([.I68]));10))) -> equal | M68: of:=IF(OR(ISTEXT([.G68]);ISTEXT([.J68]));"";IF([.G68]=[.J68];"equal";-LOG(ABS([.G68]-[.J68])/MAX(ABS([.G68]);ABS([.J68]));10))) -> equal | N68: Inada2009,S12 | O68: diff_f_csl is multiplied by 0.001 after definition
B69: k_f_CM | C69: - | D69: - | E69: BufferCM.k | F69: 1/(mM s) | G69: 227700 | H69: 227700 | I69: 227700 | J69: 227700 | K69: of:=IF(OR(ISTEXT([.G69]);ISTEXT([.H69]));"";IF([.G69]=[.H69];"equal";-LOG(ABS([.G69]-[.H69])/MAX(ABS([.G69]);ABS([.H69]));10))) -> equal | L69: of:=IF(OR(ISTEXT([.H69]);ISTEXT([.I69]));"";IF([.H69]=[.I69];"equal";-LOG(ABS([.H69]-[.I69])/MAX(ABS([.H69]);ABS([.I69]));10))) -> equal | M69: of:=IF(OR(ISTEXT([.G69]);ISTEXT([.J69]));"";IF([.G69]=[.J69];"equal";-LOG(ABS([.G69]-[.J69])/MAX(ABS([.G69]);ABS([.J69]));10))) -> equal | N69: Kurata2002,A1
B70: k_f_CQ | C70: - | D70: - | E70: cq.k | F70: 1/(mM s) | G70: 534 | H70: 534 | I70: 543 | J70: 534 | K70: of:=IF(OR(ISTEXT([.G70]);ISTEXT([.H70]));"";IF([.G70]=[.H70];"equal";-LOG(ABS([.G70]-[.H70])/MAX(ABS([.G70]);ABS([.H70]));10))) -> equal | L70: of:=IF(OR(ISTEXT([.H70]);ISTEXT([.I70]));"";IF([.H70]=[.I70];"equal";-LOG(ABS([.H70]-[.I70])/MAX(ABS([.H70]);ABS([.I70]));10))) -> 1.78055732014952 | M70: of:=IF(OR(ISTEXT([.G70]);ISTEXT([.J70]));"";IF([.G70]=[.J70];"equal";-LOG(ABS([.G70]-[.J70])/MAX(ABS([.G70]);ABS([.J70]));10))) -> equal | N70: Kurata2002,A1
B71: k_f_TC | C71: - | D71: - | E71: tc.k | F71: 1/(mM s) | G71: 88800 | H71: 88800 | I71: 88800 | J71: 88800 | K71: of:=IF(OR(ISTEXT([.G71]);ISTEXT([.H71]));"";IF([.G71]=[.H71];"equal";-LOG(ABS([.G71]-[.H71])/MAX(ABS([.G71]);ABS([.H71]));10))) -> equal | L71: of:=IF(OR(ISTEXT([.H71]);ISTEXT([.I71]));"";IF([.H71]=[.I71];"equal";-LOG(ABS([.H71]-[.I71])/MAX(ABS([.H71]);ABS([.I71]));10))) -> equal | M71: of:=IF(OR(ISTEXT([.G71]);ISTEXT([.J71]));"";IF([.G71]=[.J71];"equal";-LOG(ABS([.G71]-[.J71])/MAX(ABS([.G71]);ABS([.J71]));10))) -> equal | N71: Kurata2002,A1
B72: k_f_TMC | C72: - | D72: - | E72: tmc.k | F72: 1/(mM s) | G72: 227700 | H72: 222700 | I72: 227700 | J72: 227700 | K72: of:=IF(OR(ISTEXT([.G72]);ISTEXT([.H72]));"";IF([.G72]=[.H72];"equal";-LOG(ABS([.G72]-[.H72])/MAX(ABS([.G72]);ABS([.H72]));10))) -> 1.65839302627912 | L72: of:=IF(OR(ISTEXT([.H72]);ISTEXT([.I72]));"";IF([.H72]=[.I72];"equal";-LOG(ABS([.H72]-[.I72])/MAX(ABS([.H72]);ABS([.I72]));10))) -> 1.65839302627912 | M72: of:=IF(OR(ISTEXT([.G72]);ISTEXT([.J72]));"";IF([.G72]=[.J72];"equal";-LOG(ABS([.G72]-[.J72])/MAX(ABS([.G72]);ABS([.J72]));10))) -> equal | N72: Kurata2002,A1
B73: k_f_TMM | C73: - | D73: - | E73: tmm.k | F73: 1/(mM s) | G73: 2277 | H73: 2277 | I73: 2277 | J73: 2277 | K73: of:=IF(OR(ISTEXT([.G73]);ISTEXT([.H73]));"";IF([.G73]=[.H73];"equal";-LOG(ABS([.G73]-[.H73])/MAX(ABS([.G73]);ABS([.H73]));10))) -> equal | L73: of:=IF(OR(ISTEXT([.H73]);ISTEXT([.I73]));"";IF([.H73]=[.I73];"equal";-LOG(ABS([.H73]-[.I73])/MAX(ABS([.H73]);ABS([.I73]));10))) -> equal | M73: of:=IF(OR(ISTEXT([.G73]);ISTEXT([.J73]));"";IF([.G73]=[.J73];"equal";-LOG(ABS([.G73]-[.J73])/MAX(ABS([.G73]);ABS([.J73]));10))) -> equal | N73: Kurata2002,A1
B74: k_f_SL | C74: - | D74: - | E74: sl.kb | F74: 1/(mM s) | G74: 0.115 | H74: 0.115 | I74: of:=0.001*115 -> 0.115 | J74: 0.115 | K74: of:=IF(OR(ISTEXT([.G74]);ISTEXT([.H74]));"";IF([.G74]=[.H74];"equal";-LOG(ABS([.G74]-[.H74])/MAX(ABS([.G74]);ABS([.H74]));10))) -> equal | L74: of:=IF(OR(ISTEXT([.H74]);ISTEXT([.I74]));"";IF([.H74]=[.I74];"equal";-LOG(ABS([.H74]-[.I74])/MAX(ABS([.H74]);ABS([.I74]));10))) -> equal | M74: of:=IF(OR(ISTEXT([.G74]);ISTEXT([.J74]));"";IF([.G74]=[.J74];"equal";-LOG(ABS([.G74]-[.J74])/MAX(ABS([.G74]);ABS([.J74]));10))) -> equal | N74: Inada2009,S12
B75: SL_tot | C75: - | D75: - | E75: cm_sl.c_tot | F75: mM | G75: - | H75: of:=31 / 1.2 -> 25.8333333333333 | I75: of:=0.031/1.2 -> 0.0258333333333333 | J75: of:=0.031/1.2 -> 0.0258333333333333 | K75: of:=IF(OR(ISTEXT([.G75]);ISTEXT([.H75]));"";IF([.G75]=[.H75];"equal";-LOG(ABS([.G75]-[.H75])/MAX(ABS([.G75]);ABS([.H75]));10))) ->  | L75: of:=IF(OR(ISTEXT([.H75]);ISTEXT([.I75]));"";IF([.H75]=[.I75];"equal";-LOG(ABS([.H75]-[.I75])/MAX(ABS([.H75]);ABS([.I75]));10))) -> 0.000434511774017692 | M75: of:=IF(OR(ISTEXT([.G75]);ISTEXT([.J75]));"";IF([.G75]=[.J75];"equal";-LOG(ABS([.G75]-[.J75])/MAX(ABS([.G75]);ABS([.J75]));10))) ->  | N75: - | O75: neither in Inada2009 nor Kurata2002, C++ has probably wrong order of magnitude
B76: [CM]_tot | C76: - | D76: - | E76: cm.c_tot | F76: mM | G76: 0.045 | H76: 0.045 | I76: 0.045 | J76: 0.045 | K76: of:=IF(OR(ISTEXT([.G76]);ISTEXT([.H76]));"";IF([.G76]=[.H76];"equal";-LOG(ABS([.G76]-[.H76])/MAX(ABS([.G76]);ABS([.H76]));10))) -> equal | L76: of:=IF(OR(ISTEXT([.H76]);ISTEXT([.I76]));"";IF([.H76]=[.I76];"equal";-LOG(ABS([.H76]-[.I76])/MAX(ABS([.H76]);ABS([.I76]));10))) -> equal | M76: of:=IF(OR(ISTEXT([.G76]);ISTEXT([.J76]));"";IF([.G76]=[.J76];"equal";-LOG(ABS([.G76]-[.J76])/MAX(ABS([.G76]);ABS([.J76]));10))) -> equal | N76: Kurata2002,A1
B77: [CQ]_tot | C77: - | D77: - | E77: cq.c_tot | F77: mM | G77: 10 | H77: 10 | I77: 10 | J77: 10 | K77: of:=IF(OR(ISTEXT([.G77]);ISTEXT([.H77]));"";IF([.G77]=[.H77];"equal";-LOG(ABS([.G77]-[.H77])/MAX(ABS([.G77]);ABS([.H77]));10))) -> equal | L77: of:=IF(OR(ISTEXT([.H77]);ISTEXT([.I77]));"";IF([.H77]=[.I77];"equal";-LOG(ABS([.H77]-[.I77])/MAX(ABS([.H77]);ABS([.I77]));10))) -> equal | M77: of:=IF(OR(ISTEXT([.G77]);ISTEXT([.J77]));"";IF([.G77]=[.J77];"equal";-LOG(ABS([.G77]-[.J77])/MAX(ABS([.G77]);ABS([.J77]));10))) -> equal | N77: Kurata2002,A1
B78: [TC]_tot | C78: - | D78: - | E78: tc.c_tot | F78: mM | G78: 0.031 | H78: 0.031 | I78: 0.031 | J78: 0.031 | K78: of:=IF(OR(ISTEXT([.G78]);ISTEXT([.H78]));"";IF([.G78]=[.H78];"equal";-LOG(ABS([.G78]-[.H78])/MAX(ABS([.G78]);ABS([.H78]));10))) -> equal | L78: of:=IF(OR(ISTEXT([.H78]);ISTEXT([.I78]));"";IF([.H78]=[.I78];"equal";-LOG(ABS([.H78]-[.I78])/MAX(ABS([.H78]);ABS([.I78]));10))) -> equal | M78: of:=IF(OR(ISTEXT([.G78]);ISTEXT([.J78]));"";IF([.G78]=[.J78];"equal";-LOG(ABS([.G78]-[.J78])/MAX(ABS([.G78]);ABS([.J78]));10))) -> equal | N78: Kurata2002,A1
B79: [TMC]_tot | C79: - | D79: - | E79: tmc.c_tot | F79: mM | G79: 0.062 | H79: 0.062 | I79: 0.062 | J79: 0.062 | K79: of:=IF(OR(ISTEXT([.G79]);ISTEXT([.H79]));"";IF([.G79]=[.H79];"equal";-LOG(ABS([.G79]-[.H79])/MAX(ABS([.G79]);ABS([.H79]));10))) -> equal | L79: of:=IF(OR(ISTEXT([.H79]);ISTEXT([.I79]));"";IF([.H79]=[.I79];"equal";-LOG(ABS([.H79]-[.I79])/MAX(ABS([.H79]);ABS([.I79]));10))) -> equal | M79: of:=IF(OR(ISTEXT([.G79]);ISTEXT([.J79]));"";IF([.G79]=[.J79];"equal";-LOG(ABS([.G79]-[.J79])/MAX(ABS([.G79]);ABS([.J79]));10))) -> equal | N79: Kurata2002,A1
B80: [Mg2+]_i | C80: - | D80: - | E80: mg.c_const | F80: mM | G80: 2.5 | H80: 2.5 | I80: 2.5 | J80: 2.5 | K80: of:=IF(OR(ISTEXT([.G80]);ISTEXT([.H80]));"";IF([.G80]=[.H80];"equal";-LOG(ABS([.G80]-[.H80])/MAX(ABS([.G80]);ABS([.H80]));10))) -> equal | L80: of:=IF(OR(ISTEXT([.H80]);ISTEXT([.I80]));"";IF([.H80]=[.I80];"equal";-LOG(ABS([.H80]-[.I80])/MAX(ABS([.H80]);ABS([.I80]));10))) -> equal | M80: of:=IF(OR(ISTEXT([.G80]);ISTEXT([.J80]));"";IF([.G80]=[.J80];"equal";-LOG(ABS([.G80]-[.J80])/MAX(ABS([.G80]);ABS([.J80]));10))) -> equal | N80: Kurata2002,A1
B81: K_rel | C81: - | D81: - | E81: jsr_sub.ka | F81: mM | G81: 0.0012 | H81: 0.0012 | I81: 0.0012 | J81: 0.0012 | K81: of:=IF(OR(ISTEXT([.G81]);ISTEXT([.H81]));"";IF([.G81]=[.H81];"equal";-LOG(ABS([.G81]-[.H81])/MAX(ABS([.G81]);ABS([.H81]));10))) -> equal | L81: of:=IF(OR(ISTEXT([.H81]);ISTEXT([.I81]));"";IF([.H81]=[.I81];"equal";-LOG(ABS([.H81]-[.I81])/MAX(ABS([.H81]);ABS([.I81]));10))) -> equal | M81: of:=IF(OR(ISTEXT([.G81]);ISTEXT([.J81]));"";IF([.G81]=[.J81];"equal";-LOG(ABS([.G81]-[.J81])/MAX(ABS([.G81]);ABS([.J81]));10))) -> equal | N81: Kurata2002,A1
B82: K_up | C82: - | D82: K_up | E82: cyto_nsr.k | F82: mM | G82: 0.0006 | H82: 0.0006 | I82: 0.0006 | J82: 0.0006 | K82: of:=IF(OR(ISTEXT([.G82]);ISTEXT([.H82]));"";IF([.G82]=[.H82];"equal";-LOG(ABS([.G82]-[.H82])/MAX(ABS([.G82]);ABS([.H82]));10))) -> equal | L82: of:=IF(OR(ISTEXT([.H82]);ISTEXT([.I82]));"";IF([.H82]=[.I82];"equal";-LOG(ABS([.H82]-[.I82])/MAX(ABS([.H82]);ABS([.I82]));10))) -> equal | M82: of:=IF(OR(ISTEXT([.G82]);ISTEXT([.J82]));"";IF([.G82]=[.J82];"equal";-LOG(ABS([.G82]-[.J82])/MAX(ABS([.G82]);ABS([.J82]));10))) -> equal | N82: Kurata2002,A1
B83: P_rel | C83: p_rel | D83: P_rel | E83: jsr_sub.p | F83: 1/s | G83: 5000 | H83: 1805.6 | I83: 1805.6 | J83: 1805.6 | K83: of:=IF(OR(ISTEXT([.G83]);ISTEXT([.H83]));"";IF([.G83]=[.H83];"equal";-LOG(ABS([.G83]-[.H83])/MAX(ABS([.G83]);ABS([.H83]));10))) -> 0.194580707149738 | L83: of:=IF(OR(ISTEXT([.H83]);ISTEXT([.I83]));"";IF([.H83]=[.I83];"equal";-LOG(ABS([.H83]-[.I83])/MAX(ABS([.H83]);ABS([.I83]));10))) -> equal | M83: of:=IF(OR(ISTEXT([.G83]);ISTEXT([.J83]));"";IF([.G83]=[.J83];"equal";-LOG(ABS([.G83]-[.J83])/MAX(ABS([.G83]);ABS([.J83]));10))) -> 0.194580707149738 | N83: Kurata2002,A1
B84: P_up | C84: p_up | D84: - | E84: cyto_nsr.p | F84: mM/s | G84: 5 | H84: 5 | I84: 5 | J84: 5 | K84: of:=IF(OR(ISTEXT([.G84]);ISTEXT([.H84]));"";IF([.G84]=[.H84];"equal";-LOG(ABS([.G84]-[.H84])/MAX(ABS([.G84]);ABS([.H84]));10))) -> equal | L84: of:=IF(OR(ISTEXT([.H84]);ISTEXT([.I84]));"";IF([.H84]=[.I84];"equal";-LOG(ABS([.H84]-[.I84])/MAX(ABS([.H84]);ABS([.I84]));10))) -> equal | M84: of:=IF(OR(ISTEXT([.G84]);ISTEXT([.J84]));"";IF([.G84]=[.J84];"equal";-LOG(ABS([.G84]-[.J84])/MAX(ABS([.G84]);ABS([.J84]));10))) -> equal | N84: Kurata2002,A1 | O84: C++ code contains p_up = 0.012, but this variable is never used
B85: tau_diff,Ca | C85: - | D85: - | E85: sub_cyto.tau | F85: s | G85: 0.00004 | H85: 0.00004 | I85: 0.00004 | J85: 0.00004 | K85: of:=IF(OR(ISTEXT([.G85]);ISTEXT([.H85]));"";IF([.G85]=[.H85];"equal";-LOG(ABS([.G85]-[.H85])/MAX(ABS([.G85]);ABS([.H85]));10))) -> equal | L85: of:=IF(OR(ISTEXT([.H85]);ISTEXT([.I85]));"";IF([.H85]=[.I85];"equal";-LOG(ABS([.H85]-[.I85])/MAX(ABS([.H85]);ABS([.I85]));10))) -> equal | M85: of:=IF(OR(ISTEXT([.G85]);ISTEXT([.J85]));"";IF([.G85]=[.J85];"equal";-LOG(ABS([.G85]-[.J85])/MAX(ABS([.G85]);ABS([.J85]));10))) -> equal | N85: Kurata2002,A1
B86: tau_tr | C86: - | D86: tau_tr | E86: nsr_jsr.tau | F86: s | G86: 0.06 | H86: 0.06 | I86: 0.06 | J86: 0.06 | K86: of:=IF(OR(ISTEXT([.G86]);ISTEXT([.H86]));"";IF([.G86]=[.H86];"equal";-LOG(ABS([.G86]-[.H86])/MAX(ABS([.G86]);ABS([.H86]));10))) -> equal | L86: of:=IF(OR(ISTEXT([.H86]);ISTEXT([.I86]));"";IF([.H86]=[.I86];"equal";-LOG(ABS([.H86]-[.I86])/MAX(ABS([.H86]);ABS([.I86]));10))) -> equal | M86: of:=IF(OR(ISTEXT([.G86]);ISTEXT([.J86]));"";IF([.G86]=[.J86];"equal";-LOG(ABS([.G86]-[.J86])/MAX(ABS([.G86]);ABS([.J86]));10))) -> equal | N86: Kurata2002,A1

Sheet: Parameters (N)
A1: Part | B1: Name (paper) | C1: Name (C++) | D1: Name (CellML) | E1: Name (InaMo) | F1: Unit | G1: Value in paper | H1: Value in C++ | I1: Value in CellML | J1: Value in InaMo | K1: Paper = C++ | L1: C++ = CellML | M1: InaMo = CellML | N1: Paper source
A2: Cell | B2: [Na+]_o | C2: na_out | D2: Nao | E2: na_ex | F2: mM | G2: 140 | H2: 140 | I2: 140 | J2: 140 | K2: of:=IF(OR(ISTEXT([.G2]);ISTEXT([.H2]));"";IF([.G2]=[.H2];"equal";-LOG(ABS([.G2]-[.H2])/MAX(ABS([.G2]);ABS([.H2]));10))) -> equal | L2: of:=IF(OR(ISTEXT([.H2]);ISTEXT([.I2]));"";IF([.H2]=[.I2];"equal";-LOG(ABS([.H2]-[.I2])/MAX(ABS([.H2]);ABS([.I2]));10))) -> equal | M2: of:=IF(OR(ISTEXT([.G2]);ISTEXT([.J2]));"";IF([.G2]=[.J2];"equal";-LOG(ABS([.G2]-[.J2])/MAX(ABS([.G2]);ABS([.J2]));10))) -> equal | N2: Inada2009,S15 | O2: C++ code measures in M instead of mM | R2: of:=COUNTIF([.K2:.K86];"<1")&"/"&(COUNTA([.K2:.K86])-COUNTBLANK([.K2:.K86])) -> 2/70 | S2: of:=COUNTIF([.L2:.L86];"<1")&"/"&(COUNTA([.L2:.L86])-COUNTBLANK([.L2:.L86])) -> 5/76
B3: [Ca2+]_o | C3: ca_out | D3: Cao | E3: ca_ex | F3: mM | G3: 2 | H3: 2 | I3: 2 | J3: 2 | K3: of:=IF(OR(ISTEXT([.G3]);ISTEXT([.H3]));"";IF([.G3]=[.H3];"equal";-LOG(ABS([.G3]-[.H3])/MAX(ABS([.G3]);ABS([.H3]));10))) -> equal | L3: of:=IF(OR(ISTEXT([.H3]);ISTEXT([.I3]));"";IF([.H3]=[.I3];"equal";-LOG(ABS([.H3]-[.I3])/MAX(ABS([.H3]);ABS([.I3]));10))) -> equal | M3: of:=IF(OR(ISTEXT([.G3]);ISTEXT([.J3]));"";IF([.G3]=[.J3];"equal";-LOG(ABS([.G3]-[.J3])/MAX(ABS([.G3]);ABS([.J3]));10))) -> equal | N3: Inada2009,S15
B4: [K+]_o | C4: k_out | D4: Ko | E4: k_ex | F4: mM | G4: 5.4 | H4: 5.4 | I4: 5.4 | J4: 5.4 | K4: of:=IF(OR(ISTEXT([.G4]);ISTEXT([.H4]));"";IF([.G4]=[.H4];"equal";-LOG(ABS([.G4]-[.H4])/MAX(ABS([.G4]);ABS([.H4]));10))) -> equal | L4: of:=IF(OR(ISTEXT([.H4]);ISTEXT([.I4]));"";IF([.H4]=[.I4];"equal";-LOG(ABS([.H4]-[.I4])/MAX(ABS([.H4]);ABS([.I4]));10))) -> equal | M4: of:=IF(OR(ISTEXT([.G4]);ISTEXT([.J4]));"";IF([.G4]=[.J4];"equal";-LOG(ABS([.G4]-[.J4])/MAX(ABS([.G4]);ABS([.J4]));10))) -> equal | N4: Inada2009,S15
B5: [Na+]_i | C5: na_in | D5: Nai | E5: na_in | F5: mM | G5: 8 | H5: 8 | I5: 8 | J5: 8 | K5: of:=IF(OR(ISTEXT([.G5]);ISTEXT([.H5]));"";IF([.G5]=[.H5];"equal";-LOG(ABS([.G5]-[.H5])/MAX(ABS([.G5]);ABS([.H5]));10))) -> equal | L5: of:=IF(OR(ISTEXT([.H5]);ISTEXT([.I5]));"";IF([.H5]=[.I5];"equal";-LOG(ABS([.H5]-[.I5])/MAX(ABS([.H5]);ABS([.I5]));10))) -> equal | M5: of:=IF(OR(ISTEXT([.G5]);ISTEXT([.J5]));"";IF([.G5]=[.J5];"equal";-LOG(ABS([.G5]-[.J5])/MAX(ABS([.G5]);ABS([.J5]));10))) -> equal | N5: Inada2009,S15
B6: [K+]_i | C6: k_in | D6: Ki | E6: k_in | F6: mM | G6: 140 | H6: 140 | I6: 140 | J6: 140 | K6: of:=IF(OR(ISTEXT([.G6]);ISTEXT([.H6]));"";IF([.G6]=[.H6];"equal";-LOG(ABS([.G6]-[.H6])/MAX(ABS([.G6]);ABS([.H6]));10))) -> equal | L6: of:=IF(OR(ISTEXT([.H6]);ISTEXT([.I6]));"";IF([.H6]=[.I6];"equal";-LOG(ABS([.H6]-[.I6])/MAX(ABS([.H6]);ABS([.I6]));10))) -> equal | M6: of:=IF(OR(ISTEXT([.G6]);ISTEXT([.J6]));"";IF([.G6]=[.J6];"equal";-LOG(ABS([.G6]-[.J6])/MAX(ABS([.G6]);ABS([.J6]));10))) -> equal | N6: Inada2009,S15
B7: [Ca2+]_i | C7: ca_in | D7: Cai | E7: ca_sub | F7: mM | G7: 0.0001 | H7: 0.00036327 | J7: 0.0001 | K7: of:=IF(OR(ISTEXT([.G7]);ISTEXT([.H7]));"";IF([.G7]=[.H7];"equal";-LOG(ABS([.G7]-[.H7])/MAX(ABS([.G7]);ABS([.H7]));10))) -> 0.139828160477741 | L7: of:=IF(OR(ISTEXT([.H7]);ISTEXT([.I7]));"";IF([.H7]=[.I7];"equal";-LOG(ABS([.H7]-[.I7])/MAX(ABS([.H7]);ABS([.I7]));10))) -> -0 | M7: of:=IF(OR(ISTEXT([.G7]);ISTEXT([.J7]));"";IF([.G7]=[.J7];"equal";-LOG(ABS([.G7]-[.J7])/MAX(ABS([.G7]);ABS([.J7]));10))) -> equal | N7: Inada2009,Sup-p3 | O7: only used if [Ca2+]_i is assumed to be constant (no CaHandling)
B8: - | C8: ach | D8: ACh | E8: ach | F8: mM | G8: - | H8: - | I8: 0 | J8: 0 | K8: of:=IF(OR(ISTEXT([.G8]);ISTEXT([.H8]));"";IF([.G8]=[.H8];"equal";-LOG(ABS([.G8]-[.H8])/MAX(ABS([.G8]);ABS([.H8]));10))) ->  | L8: of:=IF(OR(ISTEXT([.H8]);ISTEXT([.I8]));"";IF([.H8]=[.I8];"equal";-LOG(ABS([.H8]-[.I8])/MAX(ABS([.H8]);ABS([.I8]));10))) ->  | M8: of:=IF(OR(ISTEXT([.G8]);ISTEXT([.J8]));"";IF([.G8]=[.J8];"equal";-LOG(ABS([.G8]-[.J8])/MAX(ABS([.G8]);ABS([.J8]));10))) ->  | N8: - | O8: not given in C++, seems to be disabled in CellML (always 0)
B9: - | C9: stim_start | D9: stim_start | E9: - | F9: s | G9: - | H9: - | I9: - | J9: - | K9: of:=IF(OR(ISTEXT([.G9]);ISTEXT([.H9]));"";IF([.G9]=[.H9];"equal";-LOG(ABS([.G9]-[.H9])/MAX(ABS([.G9]);ABS([.H9]));10))) ->  | L9: of:=IF(OR(ISTEXT([.H9]);ISTEXT([.I9]));"";IF([.H9]=[.I9];"equal";-LOG(ABS([.H9]-[.I9])/MAX(ABS([.H9]);ABS([.I9]));10))) ->  | M9: of:=IF(OR(ISTEXT([.G9]);ISTEXT([.J9]));"";IF([.G9]=[.J9];"equal";-LOG(ABS([.G9]-[.J9])/MAX(ABS([.G9]);ABS([.J9]));10))) ->  | N9: -
B10: - | C10: stim_end | D10: stim_end | E10: - | F10: s | G10: - | H10: - | I10: - | J10: - | K10: of:=IF(OR(ISTEXT([.G10]);ISTEXT([.H10]));"";IF([.G10]=[.H10];"equal";-LOG(ABS([.G10]-[.H10])/MAX(ABS([.G10]);ABS([.H10]));10))) ->  | L10: of:=IF(OR(ISTEXT([.H10]);ISTEXT([.I10]));"";IF([.H10]=[.I10];"equal";-LOG(ABS([.H10]-[.I10])/MAX(ABS([.H10]);ABS([.I10]));10))) ->  | M10: of:=IF(OR(ISTEXT([.G10]);ISTEXT([.J10]));"";IF([.G10]=[.J10];"equal";-LOG(ABS([.G10]-[.J10])/MAX(ABS([.G10]);ABS([.J10]));10))) ->  | N10: -
B11: - | C11: stim_period | D11: stim_period | E11: - | F11: s | G11: - | H11: - | I11: - | J11: - | K11: of:=IF(OR(ISTEXT([.G11]);ISTEXT([.H11]));"";IF([.G11]=[.H11];"equal";-LOG(ABS([.G11]-[.H11])/MAX(ABS([.G11]);ABS([.H11]));10))) ->  | L11: of:=IF(OR(ISTEXT([.H11]);ISTEXT([.I11]));"";IF([.H11]=[.I11];"equal";-LOG(ABS([.H11]-[.I11])/MAX(ABS([.H11]);ABS([.I11]));10))) ->  | M11: of:=IF(OR(ISTEXT([.G11]);ISTEXT([.J11]));"";IF([.G11]=[.J11];"equal";-LOG(ABS([.G11]-[.J11])/MAX(ABS([.G11]);ABS([.J11]));10))) ->  | N11: -
B12: - | C12: stim_duration | D12: stim_duration | E12: - | F12: s | G12: - | H12: - | I12: - | J12: - | K12: of:=IF(OR(ISTEXT([.G12]);ISTEXT([.H12]));"";IF([.G12]=[.H12];"equal";-LOG(ABS([.G12]-[.H12])/MAX(ABS([.G12]);ABS([.H12]));10))) ->  | L12: of:=IF(OR(ISTEXT([.H12]);ISTEXT([.I12]));"";IF([.H12]=[.I12];"equal";-LOG(ABS([.H12]-[.I12])/MAX(ABS([.H12]);ABS([.I12]));10))) ->  | M12: of:=IF(OR(ISTEXT([.G12]);ISTEXT([.J12]));"";IF([.G12]=[.J12];"equal";-LOG(ABS([.G12]-[.J12])/MAX(ABS([.G12]);ABS([.J12]));10))) ->  | N12: -
B13: - | C13: i_stim | D13: stim_amplitude | E13: - | F13: A | G13: - | H13: -0.000000005 | I13: - | J13: - | K13: of:=IF(OR(ISTEXT([.G13]);ISTEXT([.H13]));"";IF([.G13]=[.H13];"equal";-LOG(ABS([.G13]-[.H13])/MAX(ABS([.G13]);ABS([.H13]));10))) ->  | L13: of:=IF(OR(ISTEXT([.H13]);ISTEXT([.I13]));"";IF([.H13]=[.I13];"equal";-LOG(ABS([.H13]-[.I13])/MAX(ABS([.H13]);ABS([.I13]));10))) ->  | M13: of:=IF(OR(ISTEXT([.G13]);ISTEXT([.J13]));"";IF([.G13]=[.J13];"equal";-LOG(ABS([.G13]-[.J13])/MAX(ABS([.G13]);ABS([.J13]));10))) ->  | N13: - | O13: C++ uses different values for 1D model and single-cell
B14: C_m | C14: cm | D14: C_m | E14: l2.c | F14: F | G14: 0.000000000029 | H14: 0.000000000029 | I14: 0.00000000004 | J14: 0.000000000029 | K14: of:=IF(OR(ISTEXT([.G14]);ISTEXT([.H14]));"";IF([.G14]=[.H14];"equal";-LOG(ABS([.G14]-[.H14])/MAX(ABS([.G14]);ABS([.H14]));10))) -> equal | L14: of:=IF(OR(ISTEXT([.H14]);ISTEXT([.I14]));"";IF([.H14]=[.I14];"equal";-LOG(ABS([.H14]-[.I14])/MAX(ABS([.H14]);ABS([.I14]));10))) -> 0.560667306169737 | M14: of:=IF(OR(ISTEXT([.G14]);ISTEXT([.J14]));"";IF([.G14]=[.J14];"equal";-LOG(ABS([.G14]-[.J14])/MAX(ABS([.G14]);ABS([.J14]));10))) -> equal | N14: Inada2009,S15 | O14: CellML swapped C_m of N and NH cell?
B15: T | C15: T | D15: T | E15: temp | F15: K | G15: 310 | H15: 310.15 | I15: 310 | J15: 310 | K15: of:=IF(OR(ISTEXT([.G15]);ISTEXT([.H15]));"";IF([.G15]=[.H15];"equal";-LOG(ABS([.G15]-[.H15])/MAX(ABS([.G15]);ABS([.H15]));10))) -> 3.31548052644537 | L15: of:=IF(OR(ISTEXT([.H15]);ISTEXT([.I15]));"";IF([.H15]=[.I15];"equal";-LOG(ABS([.H15]-[.I15])/MAX(ABS([.H15]);ABS([.I15]));10))) -> 3.31548052644537 | M15: of:=IF(OR(ISTEXT([.G15]);ISTEXT([.J15]));"";IF([.G15]=[.J15];"equal";-LOG(ABS([.G15]-[.J15])/MAX(ABS([.G15]);ABS([.J15]));10))) -> equal | N15: Inada2009,S1
B16: E_K | C16: rev_k | D16: E_K | E16: v_k | F16: V | G16: of:=8.31446261815324 * [.G15] / 96485.33212 * LOG([.G4]/[.G6]) -> -0.0377661201386988 | H16: of:=8.31446261815324 * [.H15] / 96485.33212 * LOG([.H4]/[.H6]) -> -0.0377843940677982 | I16: of:=8.31446261815324 * [.I15] / 96485.33212 * LOG([.I4]/[.I6]) -> -0.0377661201386988 | J16: of:=8.31446261815324 * [.J15] / 96485.33212 * LOG([.J4]/[.J6]) -> -0.0377661201386988 | K16: of:=IF(OR(ISTEXT([.G16]);ISTEXT([.H16]));"";IF([.G16]=[.H16];"equal";-LOG(ABS([.G16]-[.H16])/MAX(ABS([.G16]);ABS([.H16]));10))) -> 3.31548052644541 | L16: of:=IF(OR(ISTEXT([.H16]);ISTEXT([.I16]));"";IF([.H16]=[.I16];"equal";-LOG(ABS([.H16]-[.I16])/MAX(ABS([.H16]);ABS([.I16]));10))) -> 3.31548052644541 | M16: of:=IF(OR(ISTEXT([.G16]);ISTEXT([.J16]));"";IF([.G16]=[.J16];"equal";-LOG(ABS([.G16]-[.J16])/MAX(ABS([.G16]);ABS([.J16]));10))) -> equal | N16: calculated with Nernst, but not given
A17: I_Na | B17: g_Na | C17: - | D17: - | E17: - | F17: S | G17: 0 | H17: 0 | I17: 0 | J17: - | K17: of:=IF(OR(ISTEXT([.G17]);ISTEXT([.H17]));"";IF([.G17]=[.H17];"equal";-LOG(ABS([.G17]-[.H17])/MAX(ABS([.G17]);ABS([.H17]));10))) -> equal | L17: of:=IF(OR(ISTEXT([.H17]);ISTEXT([.I17]));"";IF([.H17]=[.I17];"equal";-LOG(ABS([.H17]-[.I17])/MAX(ABS([.H17]);ABS([.I17]));10))) -> equal | M17: of:=IF(OR(ISTEXT([.G17]);ISTEXT([.J17]));"";IF([.G17]=[.J17];"equal";-LOG(ABS([.G17]-[.J17])/MAX(ABS([.G17]);ABS([.J17]));10))) ->  | N17: Inada2009,S15
B18: - | C18: g_na | D18: g_Na | E18: na_p | F18: m³/(s * m²) | G18: of:=[.G17]/[.G2] * 8.31446261815324 * [.G15] / (96485.33212 * 96485.33212) -> 0 | H18: of:=[.H17]/[.H2] * 8.31446261815324 * [.H15] / (96485.33212 * 96485.33212) -> 0 | I18: of:=[.I17]/[.I2] * 8.31446261815324 * [.I15] / (96485.33212 * 96485.33212) -> 0 | J18: - | K18: of:=IF(OR(ISTEXT([.G18]);ISTEXT([.H18]));"";IF([.G18]=[.H18];"equal";-LOG(ABS([.G18]-[.H18])/MAX(ABS([.G18]);ABS([.H18]));10))) -> equal | L18: of:=IF(OR(ISTEXT([.H18]);ISTEXT([.I18]));"";IF([.H18]=[.I18];"equal";-LOG(ABS([.H18]-[.I18])/MAX(ABS([.H18]);ABS([.I18]));10))) -> equal | M18: of:=IF(OR(ISTEXT([.G18]);ISTEXT([.J18]));"";IF([.G18]=[.J18];"equal";-LOG(ABS([.G18]-[.J18])/MAX(ABS([.G18]);ABS([.J18]));10))) ->  | N18: calculated from g_Na via p_from_g
B19: - | C19: NEGLIGIBLE_SMALL | D19: delta_m | E19: - | F19: V | G19: - | H19: 0.000001 | I19: 0.00000001 | J19: 0.000001 | K19: of:=IF(OR(ISTEXT([.G19]);ISTEXT([.H19]));"";IF([.G19]=[.H19];"equal";-LOG(ABS([.G19]-[.H19])/MAX(ABS([.G19]);ABS([.H19]));10))) ->  | L19: of:=IF(OR(ISTEXT([.H19]);ISTEXT([.I19]));"";IF([.H19]=[.I19];"equal";-LOG(ABS([.H19]-[.I19])/MAX(ABS([.H19]);ABS([.I19]));10))) -> 0.00436480540245004 | M19: of:=IF(OR(ISTEXT([.G19]);ISTEXT([.J19]));"";IF([.G19]=[.J19];"equal";-LOG(ABS([.G19]-[.J19])/MAX(ABS([.G19]);ABS([.J19]));10))) ->  | N19: - | O19: delta when discontinuity handling is turned on, not in paper
A20: I_Ca,L | B20: g_Ca,L | C20: g_l | D20: g_CaL | E20: g_max | F20: S | G20: 0.000000009 | H20: 0.000000009 | I20: 0.000000009 | J20: 0.000000009 | K20: of:=IF(OR(ISTEXT([.G20]);ISTEXT([.H20]));"";IF([.G20]=[.H20];"equal";-LOG(ABS([.G20]-[.H20])/MAX(ABS([.G20]);ABS([.H20]));10))) -> equal | L20: of:=IF(OR(ISTEXT([.H20]);ISTEXT([.I20]));"";IF([.H20]=[.I20];"equal";-LOG(ABS([.H20]-[.I20])/MAX(ABS([.H20]);ABS([.I20]));10))) -> equal | M20: of:=IF(OR(ISTEXT([.G20]);ISTEXT([.J20]));"";IF([.G20]=[.J20];"equal";-LOG(ABS([.G20]-[.J20])/MAX(ABS([.G20]);ABS([.J20]));10))) -> equal | N20: Inada2009,S15
B21: E_Ca,L | C21: rev_l | D21: E_CaL | E21: v_eq | F21: V | G21: 0.0621 | H21: 0.062 | I21: 0.062 | J21: 0.0621 | K21: of:=IF(OR(ISTEXT([.G21]);ISTEXT([.H21]));"";IF([.G21]=[.H21];"equal";-LOG(ABS([.G21]-[.H21])/MAX(ABS([.G21]);ABS([.H21]));10))) -> 2.79309160017657 | L21: of:=IF(OR(ISTEXT([.H21]);ISTEXT([.I21]));"";IF([.H21]=[.I21];"equal";-LOG(ABS([.H21]-[.I21])/MAX(ABS([.H21]);ABS([.I21]));10))) -> equal | M21: of:=IF(OR(ISTEXT([.G21]);ISTEXT([.J21]));"";IF([.G21]=[.J21];"equal";-LOG(ABS([.G21]-[.J21])/MAX(ABS([.G21]);ABS([.J21]));10))) -> equal | N21: Inada2009,S15 | O21: 6.2 instead of 6.21 seems more like typo than meaningful change
B22: - | C22: act_shift | D22: act_shift | E22: - | F22: V | G22: -0.015 | H22: -0.015 | I22: -0.015 | J22: -0.015 | K22: of:=IF(OR(ISTEXT([.G22]);ISTEXT([.H22]));"";IF([.G22]=[.H22];"equal";-LOG(ABS([.G22]-[.H22])/MAX(ABS([.G22]);ABS([.H22]));10))) -> equal | L22: of:=IF(OR(ISTEXT([.H22]);ISTEXT([.I22]));"";IF([.H22]=[.I22];"equal";-LOG(ABS([.H22]-[.I22])/MAX(ABS([.H22]);ABS([.I22]));10))) -> equal | M22: of:=IF(OR(ISTEXT([.G22]);ISTEXT([.J22]));"";IF([.G22]=[.J22];"equal";-LOG(ABS([.G22]-[.J22])/MAX(ABS([.G22]);ABS([.J22]));10))) -> equal | N22: Inada2009,S4 | O22: Paper does not have parameter but changes formula
B23: - | C23: slope_factor_act | D23: slope_factor_act | E23: - | F23: V | G23: -0.005 | H23: -0.005 | I23: -0.005 | J23: -0.005 | K23: of:=IF(OR(ISTEXT([.G23]);ISTEXT([.H23]));"";IF([.G23]=[.H23];"equal";-LOG(ABS([.G23]-[.H23])/MAX(ABS([.G23]);ABS([.H23]));10))) -> equal | L23: of:=IF(OR(ISTEXT([.H23]);ISTEXT([.I23]));"";IF([.H23]=[.I23];"equal";-LOG(ABS([.H23]-[.I23])/MAX(ABS([.H23]);ABS([.I23]));10))) -> equal | M23: of:=IF(OR(ISTEXT([.G23]);ISTEXT([.J23]));"";IF([.G23]=[.J23];"equal";-LOG(ABS([.G23]-[.J23])/MAX(ABS([.G23]);ABS([.J23]));10))) -> equal | N23: Inada2009,S4 | O23: Paper does not have parameter but changes formula
B24: - | C24: inact_shift | D24: inact_shift (f) | E24: - | F24: V | G24: -0.005 | H24: -0.005 | I24: -0.005 | J24: -0.005 | K24: of:=IF(OR(ISTEXT([.G24]);ISTEXT([.H24]));"";IF([.G24]=[.H24];"equal";-LOG(ABS([.G24]-[.H24])/MAX(ABS([.G24]);ABS([.H24]));10))) -> equal | L24: of:=IF(OR(ISTEXT([.H24]);ISTEXT([.I24]));"";IF([.H24]=[.I24];"equal";-LOG(ABS([.H24]-[.I24])/MAX(ABS([.H24]);ABS([.I24]));10))) -> equal | M24: of:=IF(OR(ISTEXT([.G24]);ISTEXT([.J24]));"";IF([.G24]=[.J24];"equal";-LOG(ABS([.G24]-[.J24])/MAX(ABS([.G24]);ABS([.J24]));10))) -> equal | N24: Inada2009,S4 | O24: Paper has -29mV, CellML and C++ use -24mV – 5mV
B25: - | C25: - | D25: inact_shift (f2) | E25: - | F25: V | G25: -0.005 | H25: -0.005 | I25: -0.005 | J25: -0.005 | K25: of:=IF(OR(ISTEXT([.G25]);ISTEXT([.H25]));"";IF([.G25]=[.H25];"equal";-LOG(ABS([.G25]-[.H25])/MAX(ABS([.G25]);ABS([.H25]));10))) -> equal | L25: of:=IF(OR(ISTEXT([.H25]);ISTEXT([.I25]));"";IF([.H25]=[.I25];"equal";-LOG(ABS([.H25]-[.I25])/MAX(ABS([.H25]);ABS([.I25]));10))) -> equal | M25: of:=IF(OR(ISTEXT([.G25]);ISTEXT([.J25]));"";IF([.G25]=[.J25];"equal";-LOG(ABS([.G25]-[.J25])/MAX(ABS([.G25]);ABS([.J25]));10))) -> equal | N25: Inada2009,S4 | O25: Paper has -29mV, CellML and C++ use -24mV – 5mV
B26: - | C26: ach_l | D26: i_ACh | E26: k_ach | F26: A | G26: - | H26: - | I26: - | J26: - | K26: of:=IF(OR(ISTEXT([.G26]);ISTEXT([.H26]));"";IF([.G26]=[.H26];"equal";-LOG(ABS([.G26]-[.H26])/MAX(ABS([.G26]);ABS([.H26]));10))) ->  | L26: of:=IF(OR(ISTEXT([.H26]);ISTEXT([.I26]));"";IF([.H26]=[.I26];"equal";-LOG(ABS([.H26]-[.I26])/MAX(ABS([.H26]);ABS([.I26]));10))) ->  | M26: of:=IF(OR(ISTEXT([.G26]);ISTEXT([.J26]));"";IF([.G26]=[.J26];"equal";-LOG(ABS([.G26]-[.J26])/MAX(ABS([.G26]);ABS([.J26]));10))) ->  | N26: - | O26: CellML uses current here, but naming and use in C++ suggests that this is supposed to be a parameter
A27: I_to | B27: g_to | C27: g_to | D27: g_to | E27: g_max | F27: S | G27: 0 | H27: 0 | I27: 0 | J27: - | K27: of:=IF(OR(ISTEXT([.G27]);ISTEXT([.H27]));"";IF([.G27]=[.H27];"equal";-LOG(ABS([.G27]-[.H27])/MAX(ABS([.G27]);ABS([.H27]));10))) -> equal | L27: of:=IF(OR(ISTEXT([.H27]);ISTEXT([.I27]));"";IF([.H27]=[.I27];"equal";-LOG(ABS([.H27]-[.I27])/MAX(ABS([.H27]);ABS([.I27]));10))) -> equal | M27: of:=IF(OR(ISTEXT([.G27]);ISTEXT([.J27]));"";IF([.G27]=[.J27];"equal";-LOG(ABS([.G27]-[.J27])/MAX(ABS([.G27]);ABS([.J27]));10))) ->  | N27: Inada2009,S15
A28: I_K,r | B28: g_K,r | C28: g_kr | D28: g_Kr | E28: g_max | F28: S | G28: 0.0000000035 | H28: 0.0000000035 | I28: 0.0000000035 | J28: 0.0000000035 | K28: of:=IF(OR(ISTEXT([.G28]);ISTEXT([.H28]));"";IF([.G28]=[.H28];"equal";-LOG(ABS([.G28]-[.H28])/MAX(ABS([.G28]);ABS([.H28]));10))) -> equal | L28: of:=IF(OR(ISTEXT([.H28]);ISTEXT([.I28]));"";IF([.H28]=[.I28];"equal";-LOG(ABS([.H28]-[.I28])/MAX(ABS([.H28]);ABS([.I28]));10))) -> equal | M28: of:=IF(OR(ISTEXT([.G28]);ISTEXT([.J28]));"";IF([.G28]=[.J28];"equal";-LOG(ABS([.G28]-[.J28])/MAX(ABS([.G28]);ABS([.J28]));10))) -> equal | N28: Inada2009,S15
A29: I_f | B29: g_f | C29: g_f | D29: g_f | E29: g_f | F29: S | G29: 0.000000001 | H29: 0.000000001 | I29: 0.000000001 | J29: 0.000000001 | K29: of:=IF(OR(ISTEXT([.G29]);ISTEXT([.H29]));"";IF([.G29]=[.H29];"equal";-LOG(ABS([.G29]-[.H29])/MAX(ABS([.G29]);ABS([.H29]));10))) -> equal | L29: of:=IF(OR(ISTEXT([.H29]);ISTEXT([.I29]));"";IF([.H29]=[.I29];"equal";-LOG(ABS([.H29]-[.I29])/MAX(ABS([.H29]);ABS([.I29]));10))) -> equal | M29: of:=IF(OR(ISTEXT([.G29]);ISTEXT([.J29]));"";IF([.G29]=[.J29];"equal";-LOG(ABS([.G29]-[.J29])/MAX(ABS([.G29]);ABS([.J29]));10))) -> equal | N29: Inada2009,S15
B30: - | C30: - | D30: - | E30: v_eq | F30: V | G30: -0.03 | H30: -0.03 | I30: -0.03 | J30: - | K30: of:=IF(OR(ISTEXT([.G30]);ISTEXT([.H30]));"";IF([.G30]=[.H30];"equal";-LOG(ABS([.G30]-[.H30])/MAX(ABS([.G30]);ABS([.H30]));10))) -> equal | L30: of:=IF(OR(ISTEXT([.H30]);ISTEXT([.I30]));"";IF([.H30]=[.I30];"equal";-LOG(ABS([.H30]-[.I30])/MAX(ABS([.H30]);ABS([.I30]));10))) -> equal | M30: of:=IF(OR(ISTEXT([.G30]);ISTEXT([.J30]));"";IF([.G30]=[.J30];"equal";-LOG(ABS([.G30]-[.J30])/MAX(ABS([.G30]);ABS([.J30]));10))) ->  | N30: Inada2009,S7 | O30: inlined in CellML
A31: I_st | B31: g_st | C31: g_st | D31: g_st | E31: g_st | F31: S | G31: 0.0000000001 | H31: 0.0000000001 | I31: 0.0000000001 | J31: 0.0000000001 | K31: of:=IF(OR(ISTEXT([.G31]);ISTEXT([.H31]));"";IF([.G31]=[.H31];"equal";-LOG(ABS([.G31]-[.H31])/MAX(ABS([.G31]);ABS([.H31]));10))) -> equal | L31: of:=IF(OR(ISTEXT([.H31]);ISTEXT([.I31]));"";IF([.H31]=[.I31];"equal";-LOG(ABS([.H31]-[.I31])/MAX(ABS([.H31]);ABS([.I31]));10))) -> equal | M31: of:=IF(OR(ISTEXT([.G31]);ISTEXT([.J31]));"";IF([.G31]=[.J31];"equal";-LOG(ABS([.G31]-[.J31])/MAX(ABS([.G31]);ABS([.J31]));10))) -> equal | N31: Inada2009,S15
B32: E_st | C32: rev_st | D32: E_st | E32: E_st | F32: V | G32: 0.0374 | H32: 0.0374 | I32: -0.0374 | J32: 0.0374 | K32: of:=IF(OR(ISTEXT([.G32]);ISTEXT([.H32]));"";IF([.G32]=[.H32];"equal";-LOG(ABS([.G32]-[.H32])/MAX(ABS([.G32]);ABS([.H32]));10))) -> equal | L32: of:=IF(OR(ISTEXT([.H32]);ISTEXT([.I32]));"";IF([.H32]=[.I32];"equal";-LOG(ABS([.H32]-[.I32])/MAX(ABS([.H32]);ABS([.I32]));10))) -> -0.301029995663981 | M32: of:=IF(OR(ISTEXT([.G32]);ISTEXT([.J32]));"";IF([.G32]=[.J32];"equal";-LOG(ABS([.G32]-[.J32])/MAX(ABS([.G32]);ABS([.J32]));10))) -> equal | N32: Kurata2002,A1 | O32: CellML seems to have wrong sign
A33: I_K,1 | B33: g_K,1 | C33: g_k1 | D33: g_K1 | E33: g_max | F33: S | G33: 0 | H33: 0 | I33: 0 | J33: - | K33: of:=IF(OR(ISTEXT([.G33]);ISTEXT([.H33]));"";IF([.G33]=[.H33];"equal";-LOG(ABS([.G33]-[.H33])/MAX(ABS([.G33]);ABS([.H33]));10))) -> equal | L33: of:=IF(OR(ISTEXT([.H33]);ISTEXT([.I33]));"";IF([.H33]=[.I33];"equal";-LOG(ABS([.H33]-[.I33])/MAX(ABS([.H33]);ABS([.I33]));10))) -> equal | M33: of:=IF(OR(ISTEXT([.G33]);ISTEXT([.J33]));"";IF([.G33]=[.J33];"equal";-LOG(ABS([.G33]-[.J33])/MAX(ABS([.G33]);ABS([.J33]));10))) ->  | N33: Inada2009,S15
A34: I_b | B34: g_b | C34: g_b | D34: g_b | E34: g_max | F34: S | G34: 0.0000000012 | H34: 0.0000000012 | I34: 0.0000000012 | J34: 0.0000000012 | K34: of:=IF(OR(ISTEXT([.G34]);ISTEXT([.H34]));"";IF([.G34]=[.H34];"equal";-LOG(ABS([.G34]-[.H34])/MAX(ABS([.G34]);ABS([.H34]));10))) -> equal | L34: of:=IF(OR(ISTEXT([.H34]);ISTEXT([.I34]));"";IF([.H34]=[.I34];"equal";-LOG(ABS([.H34]-[.I34])/MAX(ABS([.H34]);ABS([.I34]));10))) -> equal | M34: of:=IF(OR(ISTEXT([.G34]);ISTEXT([.J34]));"";IF([.G34]=[.J34];"equal";-LOG(ABS([.G34]-[.J34])/MAX(ABS([.G34]);ABS([.J34]));10))) -> equal | N34: Inada2009,S15
B35: E_b | C35: rev_b | D35: E_b | E35: v_eq | F35: V | G35: -0.0225 | H35: -0.0225 | I35: -0.0225 | J35: -0.0225 | K35: of:=IF(OR(ISTEXT([.G35]);ISTEXT([.H35]));"";IF([.G35]=[.H35];"equal";-LOG(ABS([.G35]-[.H35])/MAX(ABS([.G35]);ABS([.H35]));10))) -> equal | L35: of:=IF(OR(ISTEXT([.H35]);ISTEXT([.I35]));"";IF([.H35]=[.I35];"equal";-LOG(ABS([.H35]-[.I35])/MAX(ABS([.H35]);ABS([.I35]));10))) -> equal | M35: of:=IF(OR(ISTEXT([.G35]);ISTEXT([.J35]));"";IF([.G35]=[.J35];"equal";-LOG(ABS([.G35]-[.J35])/MAX(ABS([.G35]);ABS([.J35]));10))) -> equal | N35: Inada2009,S15
A36: I_p | B36: I_p,max | C36: p_max | D36: I_p | E36: i_max | F36: A | G36: 0.000000000143 | H36: of:=0.00000000007134 * 2 -> 0.00000000014268 | I36: 0.00000000014269 | J36: 0.000000000143 | K36: of:=IF(OR(ISTEXT([.G36]);ISTEXT([.H36]));"";IF([.G36]=[.H36];"equal";-LOG(ABS([.G36]-[.H36])/MAX(ABS([.G36]);ABS([.H36]));10))) -> 2.65018605914515 | L36: of:=IF(OR(ISTEXT([.H36]);ISTEXT([.I36]));"";IF([.H36]=[.I36];"equal";-LOG(ABS([.H36]-[.I36])/MAX(ABS([.H36]);ABS([.I36]));10))) -> 4.15439353795664 | M36: of:=IF(OR(ISTEXT([.G36]);ISTEXT([.J36]));"";IF([.G36]=[.J36];"equal";-LOG(ABS([.G36]-[.J36])/MAX(ABS([.G36]);ABS([.J36]));10))) -> equal | N36: Inada2009,S15
B37: K_m,Na | C37: - | D37: - | E37: k_m_Na | F37: mM | G37: 5.64 | H37: 5.64 | I37: 5.64 | J37: 5.64 | K37: of:=IF(OR(ISTEXT([.G37]);ISTEXT([.H37]));"";IF([.G37]=[.H37];"equal";-LOG(ABS([.G37]-[.H37])/MAX(ABS([.G37]);ABS([.H37]));10))) -> equal | L37: of:=IF(OR(ISTEXT([.H37]);ISTEXT([.I37]));"";IF([.H37]=[.I37];"equal";-LOG(ABS([.H37]-[.I37])/MAX(ABS([.H37]);ABS([.I37]));10))) -> equal | M37: of:=IF(OR(ISTEXT([.G37]);ISTEXT([.J37]));"";IF([.G37]=[.J37];"equal";-LOG(ABS([.G37]-[.J37])/MAX(ABS([.G37]);ABS([.J37]));10))) -> equal | N37: Zhang2000,Table 10 | O37: Demir1994 gives 5.46, but Zhang2000 gives 5.64
B38: K_m,K | C38: - | D38: - | E38: k_m_K | F38: mM | G38: 0.621 | H38: 0.621 | I38: 0.621 | J38: 0.621 | K38: of:=IF(OR(ISTEXT([.G38]);ISTEXT([.H38]));"";IF([.G38]=[.H38];"equal";-LOG(ABS([.G38]-[.H38])/MAX(ABS([.G38]);ABS([.H38]));10))) -> equal | L38: of:=IF(OR(ISTEXT([.H38]);ISTEXT([.I38]));"";IF([.H38]=[.I38];"equal";-LOG(ABS([.H38]-[.I38])/MAX(ABS([.H38]);ABS([.I38]));10))) -> equal | M38: of:=IF(OR(ISTEXT([.G38]);ISTEXT([.J38]));"";IF([.G38]=[.J38];"equal";-LOG(ABS([.G38]-[.J38])/MAX(ABS([.G38]);ABS([.J38]));10))) -> equal | N38: Zhang2000,Table 10
A39: I_NaCa | B39: k_NaCa | C39: k_naca | D39: kNaCa | E39: k_NaCa | F39: A | G39: 0.00000000214 | H39: of:=0.0000000011832 * 1.8125 -> 0.00000000214455 | I39: 0.00000000214455 | J39: 0.00000000214 | K39: of:=IF(OR(ISTEXT([.G39]);ISTEXT([.H39]));"";IF([.G39]=[.H39];"equal";-LOG(ABS([.G39]-[.H39])/MAX(ABS([.G39]);ABS([.H39]));10))) -> 2.67332477957476 | L39: of:=IF(OR(ISTEXT([.H39]);ISTEXT([.I39]));"";IF([.H39]=[.I39];"equal";-LOG(ABS([.H39]-[.I39])/MAX(ABS([.H39]);ABS([.I39]));10))) -> equal | M39: of:=IF(OR(ISTEXT([.G39]);ISTEXT([.J39]));"";IF([.G39]=[.J39];"equal";-LOG(ABS([.G39]-[.J39])/MAX(ABS([.G39]);ABS([.J39]));10))) -> equal | N39: Inada2009,S15
B40: Qci | C40: - | D40: Qci | E40: q_ci | F40: 1 | G40: 0.1369 | H40: 0.1369 | I40: 0.1369 | J40: 0.1369 | K40: of:=IF(OR(ISTEXT([.G40]);ISTEXT([.H40]));"";IF([.G40]=[.H40];"equal";-LOG(ABS([.G40]-[.H40])/MAX(ABS([.G40]);ABS([.H40]));10))) -> equal | L40: of:=IF(OR(ISTEXT([.H40]);ISTEXT([.I40]));"";IF([.H40]=[.I40];"equal";-LOG(ABS([.H40]-[.I40])/MAX(ABS([.H40]);ABS([.I40]));10))) -> equal | M40: of:=IF(OR(ISTEXT([.G40]);ISTEXT([.J40]));"";IF([.G40]=[.J40];"equal";-LOG(ABS([.G40]-[.J40])/MAX(ABS([.G40]);ABS([.J40]));10))) -> equal | N40: Dokos1996,p271
B41: Qn | C41: - | D41: Qn | E41: q_n | F41: 1 | G41: 0.4315 | H41: 0.4315 | I41: 0.4315 | J41: 0.4315 | K41: of:=IF(OR(ISTEXT([.G41]);ISTEXT([.H41]));"";IF([.G41]=[.H41];"equal";-LOG(ABS([.G41]-[.H41])/MAX(ABS([.G41]);ABS([.H41]));10))) -> equal | L41: of:=IF(OR(ISTEXT([.H41]);ISTEXT([.I41]));"";IF([.H41]=[.I41];"equal";-LOG(ABS([.H41]-[.I41])/MAX(ABS([.H41]);ABS([.I41]));10))) -> equal | M41: of:=IF(OR(ISTEXT([.G41]);ISTEXT([.J41]));"";IF([.G41]=[.J41];"equal";-LOG(ABS([.G41]-[.J41])/MAX(ABS([.G41]);ABS([.J41]));10))) -> equal | N41: Dokos1996,p271
B42: Qco | C42: - | D42: Qco | E42: q_co | F42: 1 | G42: 0 | H42: 0 | I42: 0 | J42: 0 | K42: of:=IF(OR(ISTEXT([.G42]);ISTEXT([.H42]));"";IF([.G42]=[.H42];"equal";-LOG(ABS([.G42]-[.H42])/MAX(ABS([.G42]);ABS([.H42]));10))) -> equal | L42: of:=IF(OR(ISTEXT([.H42]);ISTEXT([.I42]));"";IF([.H42]=[.I42];"equal";-LOG(ABS([.H42]-[.I42])/MAX(ABS([.H42]);ABS([.I42]));10))) -> equal | M42: of:=IF(OR(ISTEXT([.G42]);ISTEXT([.J42]));"";IF([.G42]=[.J42];"equal";-LOG(ABS([.G42]-[.J42])/MAX(ABS([.G42]);ABS([.J42]));10))) -> equal | N42: Dokos1996,p271
B43: Kci | C43: - | D43: Kci | E43: k_c_i | F43: mM | G43: 0.0207 | H43: 0.0207 | I43: 0.0207 | J43: 0.0207 | K43: of:=IF(OR(ISTEXT([.G43]);ISTEXT([.H43]));"";IF([.G43]=[.H43];"equal";-LOG(ABS([.G43]-[.H43])/MAX(ABS([.G43]);ABS([.H43]));10))) -> equal | L43: of:=IF(OR(ISTEXT([.H43]);ISTEXT([.I43]));"";IF([.H43]=[.I43];"equal";-LOG(ABS([.H43]-[.I43])/MAX(ABS([.H43]);ABS([.I43]));10))) -> equal | M43: of:=IF(OR(ISTEXT([.G43]);ISTEXT([.J43]));"";IF([.G43]=[.J43];"equal";-LOG(ABS([.G43]-[.J43])/MAX(ABS([.G43]);ABS([.J43]));10))) -> equal | N43: Dokos1996,p271
B44: K1ni | C44: - | D44: K1ni | E44: k_1n_i | F44: mM | G44: 395.3 | H44: 395.3 | I44: 395.3 | J44: 395.3 | K44: of:=IF(OR(ISTEXT([.G44]);ISTEXT([.H44]));"";IF([.G44]=[.H44];"equal";-LOG(ABS([.G44]-[.H44])/MAX(ABS([.G44]);ABS([.H44]));10))) -> equal | L44: of:=IF(OR(ISTEXT([.H44]);ISTEXT([.I44]));"";IF([.H44]=[.I44];"equal";-LOG(ABS([.H44]-[.I44])/MAX(ABS([.H44]);ABS([.I44]));10))) -> equal | M44: of:=IF(OR(ISTEXT([.G44]);ISTEXT([.J44]));"";IF([.G44]=[.J44];"equal";-LOG(ABS([.G44]-[.J44])/MAX(ABS([.G44]);ABS([.J44]));10))) -> equal | N44: Dokos1996,p271
B45: K2ni | C45: - | D45: K2ni | E45: k_2n_i | F45: mM | G45: 2.289 | H45: 2.289 | I45: 2.289 | J45: 2.289 | K45: of:=IF(OR(ISTEXT([.G45]);ISTEXT([.H45]));"";IF([.G45]=[.H45];"equal";-LOG(ABS([.G45]-[.H45])/MAX(ABS([.G45]);ABS([.H45]));10))) -> equal | L45: of:=IF(OR(ISTEXT([.H45]);ISTEXT([.I45]));"";IF([.H45]=[.I45];"equal";-LOG(ABS([.H45]-[.I45])/MAX(ABS([.H45]);ABS([.I45]));10))) -> equal | M45: of:=IF(OR(ISTEXT([.G45]);ISTEXT([.J45]));"";IF([.G45]=[.J45];"equal";-LOG(ABS([.G45]-[.J45])/MAX(ABS([.G45]);ABS([.J45]));10))) -> equal | N45: Dokos1996,p271
B46: K3ni | C46: - | D46: K3ni | E46: k_3n_i | F46: mM | G46: 26.44 | H46: 26.44 | I46: 26.44 | J46: 26.44 | K46: of:=IF(OR(ISTEXT([.G46]);ISTEXT([.H46]));"";IF([.G46]=[.H46];"equal";-LOG(ABS([.G46]-[.H46])/MAX(ABS([.G46]);ABS([.H46]));10))) -> equal | L46: of:=IF(OR(ISTEXT([.H46]);ISTEXT([.I46]));"";IF([.H46]=[.I46];"equal";-LOG(ABS([.H46]-[.I46])/MAX(ABS([.H46]);ABS([.I46]));10))) -> equal | M46: of:=IF(OR(ISTEXT([.G46]);ISTEXT([.J46]));"";IF([.G46]=[.J46];"equal";-LOG(ABS([.G46]-[.J46])/MAX(ABS([.G46]);ABS([.J46]));10))) -> equal | N46: Dokos1996,p271
B47: Kcni | C47: - | D47: Kcni | E47: k_cn_i | F47: mM | G47: 26.44 | H47: 26.44 | I47: 26.44 | J47: 26.44 | K47: of:=IF(OR(ISTEXT([.G47]);ISTEXT([.H47]));"";IF([.G47]=[.H47];"equal";-LOG(ABS([.G47]-[.H47])/MAX(ABS([.G47]);ABS([.H47]));10))) -> equal | L47: of:=IF(OR(ISTEXT([.H47]);ISTEXT([.I47]));"";IF([.H47]=[.I47];"equal";-LOG(ABS([.H47]-[.I47])/MAX(ABS([.H47]);ABS([.I47]));10))) -> equal | M47: of:=IF(OR(ISTEXT([.G47]);ISTEXT([.J47]));"";IF([.G47]=[.J47];"equal";-LOG(ABS([.G47]-[.J47])/MAX(ABS([.G47]);ABS([.J47]));10))) -> equal | N47: Dokos1996,p271
B48: K3no | C48: - | D48: K3no | E48: k_3n_o | F48: mM | G48: 4.663 | H48: 4.663 | I48: 4.663 | J48: 4.663 | K48: of:=IF(OR(ISTEXT([.G48]);ISTEXT([.H48]));"";IF([.G48]=[.H48];"equal";-LOG(ABS([.G48]-[.H48])/MAX(ABS([.G48]);ABS([.H48]));10))) -> equal | L48: of:=IF(OR(ISTEXT([.H48]);ISTEXT([.I48]));"";IF([.H48]=[.I48];"equal";-LOG(ABS([.H48]-[.I48])/MAX(ABS([.H48]);ABS([.I48]));10))) -> equal | M48: of:=IF(OR(ISTEXT([.G48]);ISTEXT([.J48]));"";IF([.G48]=[.J48];"equal";-LOG(ABS([.G48]-[.J48])/MAX(ABS([.G48]);ABS([.J48]));10))) -> equal | N48: Dokos1996,p271
B49: K1no | C49: - | D49: K1no | E49: k_1n_o | F49: mM | G49: 1628 | H49: 1628 | I49: 1628 | J49: 1628 | K49: of:=IF(OR(ISTEXT([.G49]);ISTEXT([.H49]));"";IF([.G49]=[.H49];"equal";-LOG(ABS([.G49]-[.H49])/MAX(ABS([.G49]);ABS([.H49]));10))) -> equal | L49: of:=IF(OR(ISTEXT([.H49]);ISTEXT([.I49]));"";IF([.H49]=[.I49];"equal";-LOG(ABS([.H49]-[.I49])/MAX(ABS([.H49]);ABS([.I49]));10))) -> equal | M49: of:=IF(OR(ISTEXT([.G49]);ISTEXT([.J49]));"";IF([.G49]=[.J49];"equal";-LOG(ABS([.G49]-[.J49])/MAX(ABS([.G49]);ABS([.J49]));10))) -> equal | N49: Dokos1996,p271
B50: K2no | C50: - | D50: K2no | E50: k_2n_o | F50: mM | G50: 561.4 | H50: 561.4 | I50: 561.4 | J50: 561.4 | K50: of:=IF(OR(ISTEXT([.G50]);ISTEXT([.H50]));"";IF([.G50]=[.H50];"equal";-LOG(ABS([.G50]-[.H50])/MAX(ABS([.G50]);ABS([.H50]));10))) -> equal | L50: of:=IF(OR(ISTEXT([.H50]);ISTEXT([.I50]));"";IF([.H50]=[.I50];"equal";-LOG(ABS([.H50]-[.I50])/MAX(ABS([.H50]);ABS([.I50]));10))) -> equal | M50: of:=IF(OR(ISTEXT([.G50]);ISTEXT([.J50]));"";IF([.G50]=[.J50];"equal";-LOG(ABS([.G50]-[.J50])/MAX(ABS([.G50]);ABS([.J50]));10))) -> equal | N50: Dokos1996,p271
B51: Kco | C51: - | D51: Kco | E51: k_c_o | F51: mM | G51: 3.663 | H51: 3.663 | I51: 3.663 | J51: 3.663 | K51: of:=IF(OR(ISTEXT([.G51]);ISTEXT([.H51]));"";IF([.G51]=[.H51];"equal";-LOG(ABS([.G51]-[.H51])/MAX(ABS([.G51]);ABS([.H51]));10))) -> equal | L51: of:=IF(OR(ISTEXT([.H51]);ISTEXT([.I51]));"";IF([.H51]=[.I51];"equal";-LOG(ABS([.H51]-[.I51])/MAX(ABS([.H51]);ABS([.I51]));10))) -> equal | M51: of:=IF(OR(ISTEXT([.G51]);ISTEXT([.J51]));"";IF([.G51]=[.J51];"equal";-LOG(ABS([.G51]-[.J51])/MAX(ABS([.G51]);ABS([.J51]));10))) -> equal | N51: Dokos1996,p271
A52: I_Ach | B52: - | C52: g_ach_max | D52: g_ACh_max | E52: g_max | F52: S | G52: - | H52: 0.0000000198 | I52: 0.0000000198 | J52: - | K52: of:=IF(OR(ISTEXT([.G52]);ISTEXT([.H52]));"";IF([.G52]=[.H52];"equal";-LOG(ABS([.G52]-[.H52])/MAX(ABS([.G52]);ABS([.H52]));10))) ->  | L52: of:=IF(OR(ISTEXT([.H52]);ISTEXT([.I52]));"";IF([.H52]=[.I52];"equal";-LOG(ABS([.H52]-[.I52])/MAX(ABS([.H52]);ABS([.I52]));10))) -> equal | M52: of:=IF(OR(ISTEXT([.G52]);ISTEXT([.J52]));"";IF([.G52]=[.J52];"equal";-LOG(ABS([.G52]-[.J52])/MAX(ABS([.G52]);ABS([.J52]));10))) ->  | N52: - | O52: not in paper
B53: - | C53: k_ach | D53: K_ACh | E53: k_ach | F53: mM | G53: - | H53: 0.00035 | I53: 0.00035 | J53: - | K53: of:=IF(OR(ISTEXT([.G53]);ISTEXT([.H53]));"";IF([.G53]=[.H53];"equal";-LOG(ABS([.G53]-[.H53])/MAX(ABS([.G53]);ABS([.H53]));10))) ->  | L53: of:=IF(OR(ISTEXT([.H53]);ISTEXT([.I53]));"";IF([.H53]=[.I53];"equal";-LOG(ABS([.H53]-[.I53])/MAX(ABS([.H53]);ABS([.I53]));10))) -> equal | M53: of:=IF(OR(ISTEXT([.G53]);ISTEXT([.J53]));"";IF([.G53]=[.J53];"equal";-LOG(ABS([.G53]-[.J53])/MAX(ABS([.G53]);ABS([.J53]));10))) ->  | N53: - | O53: not in paper
B54: - | C54: inact_fast.n.start | D54: achf | E54: inact_fast.n.start | F54: 1 | G54: - | H54: - | I54: 0.55056 | J54: - | K54: of:=IF(OR(ISTEXT([.G54]);ISTEXT([.H54]));"";IF([.G54]=[.H54];"equal";-LOG(ABS([.G54]-[.H54])/MAX(ABS([.G54]);ABS([.H54]));10))) ->  | L54: of:=IF(OR(ISTEXT([.H54]);ISTEXT([.I54]));"";IF([.H54]=[.I54];"equal";-LOG(ABS([.H54]-[.I54])/MAX(ABS([.H54]);ABS([.I54]));10))) ->  | M54: of:=IF(OR(ISTEXT([.G54]);ISTEXT([.J54]));"";IF([.G54]=[.J54];"equal";-LOG(ABS([.G54]-[.J54])/MAX(ABS([.G54]);ABS([.J54]));10))) ->  | N54: - | O54: not in paper
B55: - | C55: alpha_achf | D55: alpha_achf | E55: - | F55: 1/s | G55: - | H55: 73.1 | I55: 73.1 | J55: 73.1 | K55: of:=IF(OR(ISTEXT([.G55]);ISTEXT([.H55]));"";IF([.G55]=[.H55];"equal";-LOG(ABS([.G55]-[.H55])/MAX(ABS([.G55]);ABS([.H55]));10))) ->  | L55: of:=IF(OR(ISTEXT([.H55]);ISTEXT([.I55]));"";IF([.H55]=[.I55];"equal";-LOG(ABS([.H55]-[.I55])/MAX(ABS([.H55]);ABS([.I55]));10))) -> equal | M55: of:=IF(OR(ISTEXT([.G55]);ISTEXT([.J55]));"";IF([.G55]=[.J55];"equal";-LOG(ABS([.G55]-[.J55])/MAX(ABS([.G55]);ABS([.J55]));10))) ->  | N55: - | O55: not in paper
B56: - | C56: alpha_achs | D56: alpha_achs | E56: - | F56: 1/s | G56: - | H56: 3.7 | I56: 3.7 | J56: 3.7 | K56: of:=IF(OR(ISTEXT([.G56]);ISTEXT([.H56]));"";IF([.G56]=[.H56];"equal";-LOG(ABS([.G56]-[.H56])/MAX(ABS([.G56]);ABS([.H56]));10))) ->  | L56: of:=IF(OR(ISTEXT([.H56]);ISTEXT([.I56]));"";IF([.H56]=[.I56];"equal";-LOG(ABS([.H56]-[.I56])/MAX(ABS([.H56]);ABS([.I56]));10))) -> equal | M56: of:=IF(OR(ISTEXT([.G56]);ISTEXT([.J56]));"";IF([.G56]=[.J56];"equal";-LOG(ABS([.G56]-[.J56])/MAX(ABS([.G56]);ABS([.J56]));10))) ->  | N56: - | O56: not in paper
B57: - | C57: inact_slow.n.start | D57: achs | E57: inact_slow.n.start | F57: 1 | G57: - | H57: - | I57: 0.567277 | J57: - | K57: of:=IF(OR(ISTEXT([.G57]);ISTEXT([.H57]));"";IF([.G57]=[.H57];"equal";-LOG(ABS([.G57]-[.H57])/MAX(ABS([.G57]);ABS([.H57]));10))) ->  | L57: of:=IF(OR(ISTEXT([.H57]);ISTEXT([.I57]));"";IF([.H57]=[.I57];"equal";-LOG(ABS([.H57]-[.I57])/MAX(ABS([.H57]);ABS([.I57]));10))) ->  | M57: of:=IF(OR(ISTEXT([.G57]);ISTEXT([.J57]));"";IF([.G57]=[.J57];"equal";-LOG(ABS([.G57]-[.J57])/MAX(ABS([.G57]);ABS([.J57]));10))) ->  | N57: - | O57: not in paper
A58: CaHandling | B58: V_cell | C58: vol_cell | D58: V_cell | E58: v_cell | F58: m³ | G58: 3.5E-015 | H58: of:= 1/1000 * (([.$H14] - 0.00000000002) / 0.000000000045 * (0.000000000007147123 - 0.00000000000219911) + 0.00000000000219911) -> 3.1887126E-015 | I58: of:=3.18872E-015 -> 3.18872E-015 | J58: of:= 1/1000 * (([.$J14] - 0.00000000002) / 0.000000000045 * (0.000000000007147123 - 0.00000000000219911) + 0.00000000000219911) -> 3.1887126E-015 | K58: of:=IF(OR(ISTEXT([.G58]);ISTEXT([.H58]));"";IF([.G58]=[.H58];"equal";-LOG(ABS([.G58]-[.H58])/MAX(ABS([.G58]);ABS([.H58]));10))) -> 1.05090650227752 | L58: of:=IF(OR(ISTEXT([.H58]);ISTEXT([.I58]));"";IF([.H58]=[.I58];"equal";-LOG(ABS([.H58]-[.I58])/MAX(ABS([.H58]);ABS([.I58]));10))) -> 5.63438466600122 | M58: of:=IF(OR(ISTEXT([.G58]);ISTEXT([.J58]));"";IF([.G58]=[.J58];"equal";-LOG(ABS([.G58]-[.J58])/MAX(ABS([.G58]);ABS([.J58]));10))) -> 1.05090650227752 | N58: Kurata2002,A1 | O58: C++ code uses function based on C_m that is not given in paper
B59: V_i | C59: vol_i | D59: v_cyto | E59: v_cyto | F59: m³ | G59: of:=0.46*[.G58]-[.G60] -> 1.575E-015 | H59: of:=0.46*[.H58]-[.H60] -> 1.43492067E-015 | I59: of:=0.46*[.I58]-[.I60] -> 1.434924E-015 | J59: of:=0.46*[.J58]-[.J60] -> 1.43492067E-015 | K59: of:=IF(OR(ISTEXT([.G59]);ISTEXT([.H59]));"";IF([.G59]=[.H59];"equal";-LOG(ABS([.G59]-[.H59])/MAX(ABS([.G59]);ABS([.H59]));10))) -> 1.05090650227752 | L59: of:=IF(OR(ISTEXT([.H59]);ISTEXT([.I59]));"";IF([.H59]=[.I59];"equal";-LOG(ABS([.H59]-[.I59])/MAX(ABS([.H59]);ABS([.I59]));10))) -> 5.63438466596779 | M59: of:=IF(OR(ISTEXT([.G59]);ISTEXT([.J59]));"";IF([.G59]=[.J59];"equal";-LOG(ABS([.G59]-[.J59])/MAX(ABS([.G59]);ABS([.J59]));10))) -> 1.05090650227752 | N59: Kurata2002,A1
B60: V_sub | C60: vol_sub | D60: v_sub | E60: v_sub | F60: m³ | G60: of:=0.01*[.G58] -> 3.5E-017 | H60: of:=0.01*[.H58] -> 3.1887126E-017 | I60: of:=0.01*[.I58] -> 3.18872E-017 | J60: of:=0.01*[.J58] -> 3.1887126E-017 | K60: of:=IF(OR(ISTEXT([.G60]);ISTEXT([.H60]));"";IF([.G60]=[.H60];"equal";-LOG(ABS([.G60]-[.H60])/MAX(ABS([.G60]);ABS([.H60]));10))) -> 1.05090650227752 | L60: of:=IF(OR(ISTEXT([.H60]);ISTEXT([.I60]));"";IF([.H60]=[.I60];"equal";-LOG(ABS([.H60]-[.I60])/MAX(ABS([.H60]);ABS([.I60]));10))) -> 5.63438466600556 | M60: of:=IF(OR(ISTEXT([.G60]);ISTEXT([.J60]));"";IF([.G60]=[.J60];"equal";-LOG(ABS([.G60]-[.J60])/MAX(ABS([.G60]);ABS([.J60]));10))) -> 1.05090650227752 | N60: Kurata2002,A1
B61: V_rel | C61: vol_rel | D61: v_jsr/v_rel | E61: v_jsr | F61: m³ | G61: of:=0.0012*[.G58] -> 4.2E-018 | H61: of:=0.0012*[.H58] -> 3.82645512E-018 | I61: of:=0.0012*[.I58] -> 3.826464E-018 | J61: of:=0.0012*[.J58] -> 3.82645512E-018 | K61: of:=IF(OR(ISTEXT([.G61]);ISTEXT([.H61]));"";IF([.G61]=[.H61];"equal";-LOG(ABS([.G61]-[.H61])/MAX(ABS([.G61]);ABS([.H61]));10))) -> 1.05090650227752 | L61: of:=IF(OR(ISTEXT([.H61]);ISTEXT([.I61]));"";IF([.H61]=[.I61];"equal";-LOG(ABS([.H61]-[.I61])/MAX(ABS([.H61]);ABS([.I61]));10))) -> 5.63438466599049 | M61: of:=IF(OR(ISTEXT([.G61]);ISTEXT([.J61]));"";IF([.G61]=[.J61];"equal";-LOG(ABS([.G61]-[.J61])/MAX(ABS([.G61]);ABS([.J61]));10))) -> 1.05090650227752 | N61: Kurata2002,A1
B62: V_up | C62: vol_up | D62: v_nsr/v_up | E62: v_nsr | F62: m³ | G62: of:=0.0116*[.G58] -> 4.06E-017 | H62: of:=0.0116*[.H58] -> 3.698906616E-017 | I62: of:=0.0116*[.I58] -> 3.6989152E-017 | J62: of:=0.0116*[.J58] -> 3.698906616E-017 | K62: of:=IF(OR(ISTEXT([.G62]);ISTEXT([.H62]));"";IF([.G62]=[.H62];"equal";-LOG(ABS([.G62]-[.H62])/MAX(ABS([.G62]);ABS([.H62]));10))) -> 1.05090650227752 | L62: of:=IF(OR(ISTEXT([.H62]);ISTEXT([.I62]));"";IF([.H62]=[.I62];"equal";-LOG(ABS([.H62]-[.I62])/MAX(ABS([.H62]);ABS([.I62]));10))) -> 5.63438466602427 | M62: of:=IF(OR(ISTEXT([.G62]);ISTEXT([.J62]));"";IF([.G62]=[.J62];"equal";-LOG(ABS([.G62]-[.J62])/MAX(ABS([.G62]);ABS([.J62]));10))) -> 1.05090650227752 | N62: Kurata2002,A1
B63: k_b_CM | C63: - | D63: - | E63: BufferCM.kb | F63: 1/s | G63: 542 | H63: 542 | I63: 542 | J63: 542 | K63: of:=IF(OR(ISTEXT([.G63]);ISTEXT([.H63]));"";IF([.G63]=[.H63];"equal";-LOG(ABS([.G63]-[.H63])/MAX(ABS([.G63]);ABS([.H63]));10))) -> equal | L63: of:=IF(OR(ISTEXT([.H63]);ISTEXT([.I63]));"";IF([.H63]=[.I63];"equal";-LOG(ABS([.H63]-[.I63])/MAX(ABS([.H63]);ABS([.I63]));10))) -> equal | M63: of:=IF(OR(ISTEXT([.G63]);ISTEXT([.J63]));"";IF([.G63]=[.J63];"equal";-LOG(ABS([.G63]-[.J63])/MAX(ABS([.G63]);ABS([.J63]));10))) -> equal | N63: Kurata2002,A1
B64: k_b_CQ | C64: - | D64: - | E64: cq.kb | F64: 1/s | G64: 445 | H64: 445 | I64: 445 | J64: 445 | K64: of:=IF(OR(ISTEXT([.G64]);ISTEXT([.H64]));"";IF([.G64]=[.H64];"equal";-LOG(ABS([.G64]-[.H64])/MAX(ABS([.G64]);ABS([.H64]));10))) -> equal | L64: of:=IF(OR(ISTEXT([.H64]);ISTEXT([.I64]));"";IF([.H64]=[.I64];"equal";-LOG(ABS([.H64]-[.I64])/MAX(ABS([.H64]);ABS([.I64]));10))) -> equal | M64: of:=IF(OR(ISTEXT([.G64]);ISTEXT([.J64]));"";IF([.G64]=[.J64];"equal";-LOG(ABS([.G64]-[.J64])/MAX(ABS([.G64]);ABS([.J64]));10))) -> equal | N64: Kurata2002,A1
B65: k_b_TC | C65: - | D65: - | E65: tc.kb | F65: 1/s | G65: 446 | H65: 446 | I65: 446 | J65: 446 | K65: of:=IF(OR(ISTEXT([.G65]);ISTEXT([.H65]));"";IF([.G65]=[.H65];"equal";-LOG(ABS([.G65]-[.H65])/MAX(ABS([.G65]);ABS([.H65]));10))) -> equal | L65: of:=IF(OR(ISTEXT([.H65]);ISTEXT([.I65]));"";IF([.H65]=[.I65];"equal";-LOG(ABS([.H65]-[.I65])/MAX(ABS([.H65]);ABS([.I65]));10))) -> equal | M65: of:=IF(OR(ISTEXT([.G65]);ISTEXT([.J65]));"";IF([.G65]=[.J65];"equal";-LOG(ABS([.G65]-[.J65])/MAX(ABS([.G65]);ABS([.J65]));10))) -> equal | N65: Kurata2002,A1
B66: k_b_TMC | C66: - | D66: - | E66: tmc.kb | F66: 1/s | G66: 7.51 | H66: 7.51 | I66: 7.51 | J66: 7.51 | K66: of:=IF(OR(ISTEXT([.G66]);ISTEXT([.H66]));"";IF([.G66]=[.H66];"equal";-LOG(ABS([.G66]-[.H66])/MAX(ABS([.G66]);ABS([.H66]));10))) -> equal | L66: of:=IF(OR(ISTEXT([.H66]);ISTEXT([.I66]));"";IF([.H66]=[.I66];"equal";-LOG(ABS([.H66]-[.I66])/MAX(ABS([.H66]);ABS([.I66]));10))) -> equal | M66: of:=IF(OR(ISTEXT([.G66]);ISTEXT([.J66]));"";IF([.G66]=[.J66];"equal";-LOG(ABS([.G66]-[.J66])/MAX(ABS([.G66]);ABS([.J66]));10))) -> equal | N66: Kurata2002,A1
B67: k_b_TMM | C67: - | D67: - | E67: tmm.kb | F67: 1/s | G67: 751 | H67: 751 | I67: 751 | J67: 751 | K67: of:=IF(OR(ISTEXT([.G67]);ISTEXT([.H67]));"";IF([.G67]=[.H67];"equal";-LOG(ABS([.G67]-[.H67])/MAX(ABS([.G67]);ABS([.H67]));10))) -> equal | L67: of:=IF(OR(ISTEXT([.H67]);ISTEXT([.I67]));"";IF([.H67]=[.I67];"equal";-LOG(ABS([.H67]-[.I67])/MAX(ABS([.H67]);ABS([.I67]));10))) -> equal | M67: of:=IF(OR(ISTEXT([.G67]);ISTEXT([.J67]));"";IF([.G67]=[.J67];"equal";-LOG(ABS([.G67]-[.J67])/MAX(ABS([.G67]);ABS([.J67]));10))) -> equal | N67: Kurata2002,A1
B68: k_b_SL | C68: - | D68: - | E68: sl.kb | F68: 1/s | G68: 1 | H68: 1 | I68: 1 | J68: 1 | K68: of:=IF(OR(ISTEXT([.G68]);ISTEXT([.H68]));"";IF([.G68]=[.H68];"equal";-LOG(ABS([.G68]-[.H68])/MAX(ABS([.G68]);ABS([.H68]));10))) -> equal | L68: of:=IF(OR(ISTEXT([.H68]);ISTEXT([.I68]));"";IF([.H68]=[.I68];"equal";-LOG(ABS([.H68]-[.I68])/MAX(ABS([.H68]);ABS([.I68]));10))) -> equal | M68: of:=IF(OR(ISTEXT([.G68]);ISTEXT([.J68]));"";IF([.G68]=[.J68];"equal";-LOG(ABS([.G68]-[.J68])/MAX(ABS([.G68]);ABS([.J68]));10))) -> equal | N68: Inada2009,S12 | O68: diff_f_csl is multiplied by 0.001 after definition
B69: k_f_CM | C69: - | D69: - | E69: BufferCM.k | F69: 1/(mM s) | G69: 227700 | H69: 227700 | I69: 227700 | J69: 227700 | K69: of:=IF(OR(ISTEXT([.G69]);ISTEXT([.H69]));"";IF([.G69]=[.H69];"equal";-LOG(ABS([.G69]-[.H69])/MAX(ABS([.G69]);ABS([.H69]));10))) -> equal | L69: of:=IF(OR(ISTEXT([.H69]);ISTEXT([.I69]));"";IF([.H69]=[.I69];"equal";-LOG(ABS([.H69]-[.I69])/MAX(ABS([.H69]);ABS([.I69]));10))) -> equal | M69: of:=IF(OR(ISTEXT([.G69]);ISTEXT([.J69]));"";IF([.G69]=[.J69];"equal";-LOG(ABS([.G69]-[.J69])/MAX(ABS([.G69]);ABS([.J69]));10))) -> equal | N69: Kurata2002,A1
B70: k_f_CQ | C70: - | D70: - | E70: cq.k | F70: 1/(mM s) | G70: 534 | H70: 534 | I70: 543 | J70: 534 | K70: of:=IF(OR(ISTEXT([.G70]);ISTEXT([.H70]));"";IF([.G70]=[.H70];"equal";-LOG(ABS([.G70]-[.H70])/MAX(ABS([.G70]);ABS([.H70]));10))) -> equal | L70: of:=IF(OR(ISTEXT([.H70]);ISTEXT([.I70]));"";IF([.H70]=[.I70];"equal";-LOG(ABS([.H70]-[.I70])/MAX(ABS([.H70]);ABS([.I70]));10))) -> 1.78055732014952 | M70: of:=IF(OR(ISTEXT([.G70]);ISTEXT([.J70]));"";IF([.G70]=[.J70];"equal";-LOG(ABS([.G70]-[.J70])/MAX(ABS([.G70]);ABS([.J70]));10))) -> equal | N70: Kurata2002,A1
B71: k_f_TC | C71: - | D71: - | E71: tc.k | F71: 1/(mM s) | G71: 88800 | H71: 88800 | I71: 88800 | J71: 88800 | K71: of:=IF(OR(ISTEXT([.G71]);ISTEXT([.H71]));"";IF([.G71]=[.H71];"equal";-LOG(ABS([.G71]-[.H71])/MAX(ABS([.G71]);ABS([.H71]));10))) -> equal | L71: of:=IF(OR(ISTEXT([.H71]);ISTEXT([.I71]));"";IF([.H71]=[.I71];"equal";-LOG(ABS([.H71]-[.I71])/MAX(ABS([.H71]);ABS([.I71]));10))) -> equal | M71: of:=IF(OR(ISTEXT([.G71]);ISTEXT([.J71]));"";IF([.G71]=[.J71];"equal";-LOG(ABS([.G71]-[.J71])/MAX(ABS([.G71]);ABS([.J71]));10))) -> equal | N71: Kurata2002,A1
B72: k_f_TMC | C72: - | D72: - | E72: tmc.k | F72: 1/(mM s) | G72: 227700 | H72: 222700 | I72: 227700 | J72: 227700 | K72: of:=IF(OR(ISTEXT([.G72]);ISTEXT([.H72]));"";IF([.G72]=[.H72];"equal";-LOG(ABS([.G72]-[.H72])/MAX(ABS([.G72]);ABS([.H72]));10))) -> 1.65839302627912 | L72: of:=IF(OR(ISTEXT([.H72]);ISTEXT([.I72]));"";IF([.H72]=[.I72];"equal";-LOG(ABS([.H72]-[.I72])/MAX(ABS([.H72]);ABS([.I72]));10))) -> 1.65839302627912 | M72: of:=IF(OR(ISTEXT([.G72]);ISTEXT([.J72]));"";IF([.G72]=[.J72];"equal";-LOG(ABS([.G72]-[.J72])/MAX(ABS([.G72]);ABS([.J72]));10))) -> equal | N72: Kurata2002,A1
B73: k_f_TMM | C73: - | D73: - | E73: tmm.k | F73: 1/(mM s) | G73: 2277 | H73: 2277 | I73: 2277 | J73: 2277 | K73: of:=IF(OR(ISTEXT([.G73]);ISTEXT([.H73]));"";IF([.G73]=[.H73];"equal";-LOG(ABS([.G73]-[.H73])/MAX(ABS([.G73]);ABS([.H73]));10))) -> equal | L73: of:=IF(OR(ISTEXT([.H73]);ISTEXT([.I73]));"";IF([.H73]=[.I73];"equal";-LOG(ABS([.H73]-[.I73])/MAX(ABS([.H73]);ABS([.I73]));10))) -> equal | M73: of:=IF(OR(ISTEXT([.G73]);ISTEXT([.J73]));"";IF([.G73]=[.J73];"equal";-LOG(ABS([.G73]-[.J73])/MAX(ABS([.G73]);ABS([.J73]));10))) -> equal | N73: Kurata2002,A1
B74: k_f_SL | C74: - | D74: - | E74: sl.kb | F74: 1/(mM s) | G74: 0.115 | H74: 0.115 | I74: of:=0.001*115 -> 0.115 | J74: 0.115 | K74: of:=IF(OR(ISTEXT([.G74]);ISTEXT([.H74]));"";IF([.G74]=[.H74];"equal";-LOG(ABS([.G74]-[.H74])/MAX(ABS([.G74]);ABS([.H74]));10))) -> equal | L74: of:=IF(OR(ISTEXT([.H74]);ISTEXT([.I74]));"";IF([.H74]=[.I74];"equal";-LOG(ABS([.H74]-[.I74])/MAX(ABS([.H74]);ABS([.I74]));10))) -> equal | M74: of:=IF(OR(ISTEXT([.G74]);ISTEXT([.J74]));"";IF([.G74]=[.J74];"equal";-LOG(ABS([.G74]-[.J74])/MAX(ABS([.G74]);ABS([.J74]));10))) -> equal | N74: Inada2009,S12
B75: SL_tot | C75: - | D75: - | E75: cm_sl.c_tot | F75: mM | G75: - | H75: of:=31 / 1.2 -> 25.8333333333333 | I75: of:=0.031/1.2 -> 0.0258333333333333 | J75: of:=0.031/1.2 -> 0.0258333333333333 | K75: of:=IF(OR(ISTEXT([.G75]);ISTEXT([.H75]));"";IF([.G75]=[.H75];"equal";-LOG(ABS([.G75]-[.H75])/MAX(ABS([.G75]);ABS([.H75]));10))) ->  | L75: of:=IF(OR(ISTEXT([.H75]);ISTEXT([.I75]));"";IF([.H75]=[.I75];"equal";-LOG(ABS([.H75]-[.I75])/MAX(ABS([.H75]);ABS([.I75]));10))) -> 0.000434511774017692 | M75: of:=IF(OR(ISTEXT([.G75]);ISTEXT([.J75]));"";IF([.G75]=[.J75];"equal";-LOG(ABS([.G75]-[.J75])/MAX(ABS([.G75]);ABS([.J75]));10))) ->  | N75: - | O75: neither in Inada2009 nor Kurata2002, C++ has probably wrong order of magnitude
B76: [CM]_tot | C76: - | D76: - | E76: cm.c_tot | F76: mM | G76: 0.045 | H76: 0.045 | I76: 0.045 | J76: 0.045 | K76: of:=IF(OR(ISTEXT([.G76]);ISTEXT([.H76]));"";IF([.G76]=[.H76];"equal";-LOG(ABS([.G76]-[.H76])/MAX(ABS([.G76]);ABS([.H76]));10))) -> equal | L76: of:=IF(OR(ISTEXT([.H76]);ISTEXT([.I76]));"";IF([.H76]=[.I76];"equal";-LOG(ABS([.H76]-[.I76])/MAX(ABS([.H76]);ABS([.I76]));10))) -> equal | M76: of:=IF(OR(ISTEXT([.G76]);ISTEXT([.J76]));"";IF([.G76]=[.J76];"equal";-LOG(ABS([.G76]-[.J76])/MAX(ABS([.G76]);ABS([.J76]));10))) -> equal | N76: Kurata2002,A1
B77: [CQ]_tot | C77: - | D77: - | E77: cq.c_tot | F77: mM | G77: 10 | H77: 10 | I77: 10 | J77: 10 | K77: of:=IF(OR(ISTEXT([.G77]);ISTEXT([.H77]));"";IF([.G77]=[.H77];"equal";-LOG(ABS([.G77]-[.H77])/MAX(ABS([.G77]);ABS([.H77]));10))) -> equal | L77: of:=IF(OR(ISTEXT([.H77]);ISTEXT([.I77]));"";IF([.H77]=[.I77];"equal";-LOG(ABS([.H77]-[.I77])/MAX(ABS([.H77]);ABS([.I77]));10))) -> equal | M77: of:=IF(OR(ISTEXT([.G77]);ISTEXT([.J77]));"";IF([.G77]=[.J77];"equal";-LOG(ABS([.G77]-[.J77])/MAX(ABS([.G77]);ABS([.J77]));10))) -> equal | N77: Kurata2002,A1
B78: [TC]_tot | C78: - | D78: - | E78: tc.c_tot | F78: mM | G78: 0.031 | H78: 0.031 | I78: 0.031 | J78: 0.031 | K78: of:=IF(OR(ISTEXT([.G78]);ISTEXT([.H78]));"";IF([.G78]=[.H78];"equal";-LOG(ABS([.G78]-[.H78])/MAX(ABS([.G78]);ABS([.H78]));10))) -> equal | L78: of:=IF(OR(ISTEXT([.H78]);ISTEXT([.I78]));"";IF([.H78]=[.I78];"equal";-LOG(ABS([.H78]-[.I78])/MAX(ABS([.H78]);ABS([.I78]));10))) -> equal | M78: of:=IF(OR(ISTEXT([.G78]);ISTEXT([.J78]));"";IF([.G78]=[.J78];"equal";-LOG(ABS([.G78]-[.J78])/MAX(ABS([.G78]);ABS([.J78]));10))) -> equal | N78: Kurata2002,A1
B79: [TMC]_tot | C79: - | D79: - | E79: tmc.c_tot | F79: mM | G79: 0.062 | H79: 0.062 | I79: 0.062 | J79: 0.062 | K79: of:=IF(OR(ISTEXT([.G79]);ISTEXT([.H79]));"";IF([.G79]=[.H79];"equal";-LOG(ABS([.G79]-[.H79])/MAX(ABS([.G79]);ABS([.H79]));10))) -> equal | L79: of:=IF(OR(ISTEXT([.H79]);ISTEXT([.I79]));"";IF([.H79]=[.I79];"equal";-LOG(ABS([.H79]-[.I79])/MAX(ABS([.H79]);ABS([.I79]));10))) -> equal | M79: of:=IF(OR(ISTEXT([.G79]);ISTEXT([.J79]));"";IF([.G79]=[.J79];"equal";-LOG(ABS([.G79]-[.J79])/MAX(ABS([.G79]);ABS([.J79]));10))) -> equal | N79: Kurata2002,A1
B80: [Mg2+]_i | C80: - | D80: - | E80: mg.c_const | F80: mM | G80: 2.5 | H80: 2.5 | I80: 2.5 | J80: 2.5 | K80: of:=IF(OR(ISTEXT([.G80]);ISTEXT([.H80]));"";IF([.G80]=[.H80];"equal";-LOG(ABS([.G80]-[.H80])/MAX(ABS([.G80]);ABS([.H80]));10))) -> equal | L80: of:=IF(OR(ISTEXT([.H80]);ISTEXT([.I80]));"";IF([.H80]=[.I80];"equal";-LOG(ABS([.H80]-[.I80])/MAX(ABS([.H80]);ABS([.I80]));10))) -> equal | M80: of:=IF(OR(ISTEXT([.G80]);ISTEXT([.J80]));"";IF([.G80]=[.J80];"equal";-LOG(ABS([.G80]-[.J80])/MAX(ABS([.G80]);ABS([.J80]));10))) -> equal | N80: Kurata2002,A1
B81: K_rel | C81: - | D81: - | E81: jsr_sub.ka | F81: mM | G81: 0.0012 | H81: 0.0012 | I81: 0.0012 | J81: 0.0012 | K81: of:=IF(OR(ISTEXT([.G81]);ISTEXT([.H81]));"";IF([.G81]=[.H81];"equal";-LOG(ABS([.G81]-[.H81])/MAX(ABS([.G81]);ABS([.H81]));10))) -> equal | L81: of:=IF(OR(ISTEXT([.H81]);ISTEXT([.I81]));"";IF([.H81]=[.I81];"equal";-LOG(ABS([.H81]-[.I81])/MAX(ABS([.H81]);ABS([.I81]));10))) -> equal | M81: of:=IF(OR(ISTEXT([.G81]);ISTEXT([.J81]));"";IF([.G81]=[.J81];"equal";-LOG(ABS([.G81]-[.J81])/MAX(ABS([.G81]);ABS([.J81]));10))) -> equal | N81: Kurata2002,A1
B82: K_up | C82: - | D82: K_up | E82: cyto_nsr.k | F82: mM | G82: 0.0006 | H82: 0.0006 | I82: 0.0006 | J82: 0.0006 | K82: of:=IF(OR(ISTEXT([.G82]);ISTEXT([.H82]));"";IF([.G82]=[.H82];"equal";-LOG(ABS([.G82]-[.H82])/MAX(ABS([.G82]);ABS([.H82]));10))) -> equal | L82: of:=IF(OR(ISTEXT([.H82]);ISTEXT([.I82]));"";IF([.H82]=[.I82];"equal";-LOG(ABS([.H82]-[.I82])/MAX(ABS([.H82]);ABS([.I82]));10))) -> equal | M82: of:=IF(OR(ISTEXT([.G82]);ISTEXT([.J82]));"";IF([.G82]=[.J82];"equal";-LOG(ABS([.G82]-[.J82])/MAX(ABS([.G82]);ABS([.J82]));10))) -> equal | N82: Kurata2002,A1
B83: P_rel | C83: p_rel | D83: P_rel | E83: jsr_sub.p | F83: 1/s | G83: 5000 | H83: 1500 | I83: 1500 | J83: 1500 | K83: of:=IF(OR(ISTEXT([.G83]);ISTEXT([.H83]));"";IF([.G83]=[.H83];"equal";-LOG(ABS([.G83]-[.H83])/MAX(ABS([.G83]);ABS([.H83]));10))) -> 0.154901959985743 | L83: of:=IF(OR(ISTEXT([.H83]);ISTEXT([.I83]));"";IF([.H83]=[.I83];"equal";-LOG(ABS([.H83]-[.I83])/MAX(ABS([.H83]);ABS([.I83]));10))) -> equal | M83: of:=IF(OR(ISTEXT([.G83]);ISTEXT([.J83]));"";IF([.G83]=[.J83];"equal";-LOG(ABS([.G83]-[.J83])/MAX(ABS([.G83]);ABS([.J83]));10))) -> 0.154901959985743 | N83: Kurata2002,A1
B84: P_up | C84: p_up | D84: - | E84: cyto_nsr.p | F84: mM/s | G84: 5 | H84: 5 | I84: 5 | J84: 5 | K84: of:=IF(OR(ISTEXT([.G84]);ISTEXT([.H84]));"";IF([.G84]=[.H84];"equal";-LOG(ABS([.G84]-[.H84])/MAX(ABS([.G84]);ABS([.H84]));10))) -> equal | L84: of:=IF(OR(ISTEXT([.H84]);ISTEXT([.I84]));"";IF([.H84]=[.I84];"equal";-LOG(ABS([.H84]-[.I84])/MAX(ABS([.H84]);ABS([.I84]));10))) -> equal | M84: of:=IF(OR(ISTEXT([.G84]);ISTEXT([.J84]));"";IF([.G84]=[.J84];"equal";-LOG(ABS([.G84]-[.J84])/MAX(ABS([.G84]);ABS([.J84]));10))) -> equal | N84: Kurata2002,A1 | O84: C++ code contains p_up = 0.012, but this variable is never used
B85: tau_diff,Ca | C85: - | D85: - | E85: sub_cyto.tau | F85: s | G85: 0.00004 | H85: 0.00004 | I85: 0.00004 | J85: 0.00004 | K85: of:=IF(OR(ISTEXT([.G85]);ISTEXT([.H85]));"";IF([.G85]=[.H85];"equal";-LOG(ABS([.G85]-[.H85])/MAX(ABS([.G85]);ABS([.H85]));10))) -> equal | L85: of:=IF(OR(ISTEXT([.H85]);ISTEXT([.I85]));"";IF([.H85]=[.I85];"equal";-LOG(ABS([.H85]-[.I85])/MAX(ABS([.H85]);ABS([.I85]));10))) -> equal | M85: of:=IF(OR(ISTEXT([.G85]);ISTEXT([.J85]));"";IF([.G85]=[.J85];"equal";-LOG(ABS([.G85]-[.J85])/MAX(ABS([.G85]);ABS([.J85]));10))) -> equal | N85: Kurata2002,A1
B86: tau_tr | C86: - | D86: tau_tr | E86: nsr_jsr.tau | F86: s | G86: 0.06 | H86: 0.06 | I86: 0.06 | J86: 0.06 | K86: of:=IF(OR(ISTEXT([.G86]);ISTEXT([.H86]));"";IF([.G86]=[.H86];"equal";-LOG(ABS([.G86]-[.H86])/MAX(ABS([.G86]);ABS([.H86]));10))) -> equal | L86: of:=IF(OR(ISTEXT([.H86]);ISTEXT([.I86]));"";IF([.H86]=[.I86];"equal";-LOG(ABS([.H86]-[.I86])/MAX(ABS([.H86]);ABS([.I86]));10))) -> equal | M86: of:=IF(OR(ISTEXT([.G86]);ISTEXT([.J86]));"";IF([.G86]=[.J86];"equal";-LOG(ABS([.G86]-[.J86])/MAX(ABS([.G86]);ABS([.J86]));10))) -> equal | N86: Kurata2002,A1

Sheet: Parameters (NH)
A1: Part | B1: Name (paper) | C1: Name (C++) | D1: Name (CellML) | E1: Name (InaMo) | F1: Unit | G1: Value in paper | H1: Value in C++ | I1: Value in CellML | J1: Value in InaMo | K1: Paper = C++ | L1: C++ = CellML | M1: InaMo = CellML | N1: Paper source
A2: Cell | B2: [Na+]_o | C2: na_out | D2: Nao | E2: na_ex | F2: mM | G2: 140 | H2: 140 | I2: 140 | J2: 140 | K2: of:=IF(OR(ISTEXT([.G2]);ISTEXT([.H2]));"";IF([.G2]=[.H2];"equal";-LOG(ABS([.G2]-[.H2])/MAX(ABS([.G2]);ABS([.H2]));10))) -> equal | L2: of:=IF(OR(ISTEXT([.H2]);ISTEXT([.I2]));"";IF([.H2]=[.I2];"equal";-LOG(ABS([.H2]-[.I2])/MAX(ABS([.H2]);ABS([.I2]));10))) -> equal | M2: of:=IF(OR(ISTEXT([.G2]);ISTEXT([.J2]));"";IF([.G2]=[.J2];"equal";-LOG(ABS([.G2]-[.J2])/MAX(ABS([.G2]);ABS([.J2]));10))) -> equal | N2: Inada2009,S15 | O2: C++ code measures in M instead of mM | R2: of:=COUNTIF([.K2:.K86];"<1")&"/"&(COUNTA([.K2:.K86])-COUNTBLANK([.K2:.K86])) -> 8/69 | S2: of:=COUNTIF([.L2:.L86];"<1")&"/"&(COUNTA([.L2:.L86])-COUNTBLANK([.L2:.L86])) -> 4/76
B3: [Ca2+]_o | C3: ca_out | D3: Cao | E3: ca_ex | F3: mM | G3: 2 | H3: 2 | I3: 2 | J3: 2 | K3: of:=IF(OR(ISTEXT([.G3]);ISTEXT([.H3]));"";IF([.G3]=[.H3];"equal";-LOG(ABS([.G3]-[.H3])/MAX(ABS([.G3]);ABS([.H3]));10))) -> equal | L3: of:=IF(OR(ISTEXT([.H3]);ISTEXT([.I3]));"";IF([.H3]=[.I3];"equal";-LOG(ABS([.H3]-[.I3])/MAX(ABS([.H3]);ABS([.I3]));10))) -> equal | M3: of:=IF(OR(ISTEXT([.G3]);ISTEXT([.J3]));"";IF([.G3]=[.J3];"equal";-LOG(ABS([.G3]-[.J3])/MAX(ABS([.G3]);ABS([.J3]));10))) -> equal | N3: Inada2009,S15
B4: [K+]_o | C4: k_out | D4: Ko | E4: k_ex | F4: mM | G4: 5.4 | H4: 5.4 | I4: 5.4 | J4: 5.4 | K4: of:=IF(OR(ISTEXT([.G4]);ISTEXT([.H4]));"";IF([.G4]=[.H4];"equal";-LOG(ABS([.G4]-[.H4])/MAX(ABS([.G4]);ABS([.H4]));10))) -> equal | L4: of:=IF(OR(ISTEXT([.H4]);ISTEXT([.I4]));"";IF([.H4]=[.I4];"equal";-LOG(ABS([.H4]-[.I4])/MAX(ABS([.H4]);ABS([.I4]));10))) -> equal | M4: of:=IF(OR(ISTEXT([.G4]);ISTEXT([.J4]));"";IF([.G4]=[.J4];"equal";-LOG(ABS([.G4]-[.J4])/MAX(ABS([.G4]);ABS([.J4]));10))) -> equal | N4: Inada2009,S15
B5: [Na+]_i | C5: na_in | D5: Nai | E5: na_in | F5: mM | G5: 8 | H5: 8 | I5: 8 | J5: 8 | K5: of:=IF(OR(ISTEXT([.G5]);ISTEXT([.H5]));"";IF([.G5]=[.H5];"equal";-LOG(ABS([.G5]-[.H5])/MAX(ABS([.G5]);ABS([.H5]));10))) -> equal | L5: of:=IF(OR(ISTEXT([.H5]);ISTEXT([.I5]));"";IF([.H5]=[.I5];"equal";-LOG(ABS([.H5]-[.I5])/MAX(ABS([.H5]);ABS([.I5]));10))) -> equal | M5: of:=IF(OR(ISTEXT([.G5]);ISTEXT([.J5]));"";IF([.G5]=[.J5];"equal";-LOG(ABS([.G5]-[.J5])/MAX(ABS([.G5]);ABS([.J5]));10))) -> equal | N5: Inada2009,S15
B6: [K+]_i | C6: k_in | D6: Ki | E6: k_in | F6: mM | G6: 140 | H6: 140 | I6: 140 | J6: 140 | K6: of:=IF(OR(ISTEXT([.G6]);ISTEXT([.H6]));"";IF([.G6]=[.H6];"equal";-LOG(ABS([.G6]-[.H6])/MAX(ABS([.G6]);ABS([.H6]));10))) -> equal | L6: of:=IF(OR(ISTEXT([.H6]);ISTEXT([.I6]));"";IF([.H6]=[.I6];"equal";-LOG(ABS([.H6]-[.I6])/MAX(ABS([.H6]);ABS([.I6]));10))) -> equal | M6: of:=IF(OR(ISTEXT([.G6]);ISTEXT([.J6]));"";IF([.G6]=[.J6];"equal";-LOG(ABS([.G6]-[.J6])/MAX(ABS([.G6]);ABS([.J6]));10))) -> equal | N6: Inada2009,S15
B7: [Ca2+]_i | C7: ca_in | D7: Cai | E7: ca_sub | F7: mM | G7: 0.0001 | H7: 0.00013399 | I7: - | J7: 0.0001 | K7: of:=IF(OR(ISTEXT([.G7]);ISTEXT([.H7]));"";IF([.G7]=[.H7];"equal";-LOG(ABS([.G7]-[.H7])/MAX(ABS([.G7]);ABS([.H7]));10))) -> 0.595721222536395 | L7: of:=IF(OR(ISTEXT([.H7]);ISTEXT([.I7]));"";IF([.H7]=[.I7];"equal";-LOG(ABS([.H7]-[.I7])/MAX(ABS([.H7]);ABS([.I7]));10))) ->  | M7: of:=IF(OR(ISTEXT([.G7]);ISTEXT([.J7]));"";IF([.G7]=[.J7];"equal";-LOG(ABS([.G7]-[.J7])/MAX(ABS([.G7]);ABS([.J7]));10))) -> equal | N7: Inada2009,Sup-p3 | O7: only used if [Ca2+]_i is assumed to be constant (no CaHandling)
B8: - | C8: ach | D8: ACh | E8: ach | F8: mM | G8: - | H8: - | I8: 0 | J8: 0 | K8: of:=IF(OR(ISTEXT([.G8]);ISTEXT([.H8]));"";IF([.G8]=[.H8];"equal";-LOG(ABS([.G8]-[.H8])/MAX(ABS([.G8]);ABS([.H8]));10))) ->  | L8: of:=IF(OR(ISTEXT([.H8]);ISTEXT([.I8]));"";IF([.H8]=[.I8];"equal";-LOG(ABS([.H8]-[.I8])/MAX(ABS([.H8]);ABS([.I8]));10))) ->  | M8: of:=IF(OR(ISTEXT([.G8]);ISTEXT([.J8]));"";IF([.G8]=[.J8];"equal";-LOG(ABS([.G8]-[.J8])/MAX(ABS([.G8]);ABS([.J8]));10))) ->  | N8: - | O8: not given in C++, seems to be disabled in CellML (always 0)
B9: - | C9: stim_start | D9: stim_start | E9: - | F9: s | G9: - | H9: - | I9: 0.1 | J9: - | K9: of:=IF(OR(ISTEXT([.G9]);ISTEXT([.H9]));"";IF([.G9]=[.H9];"equal";-LOG(ABS([.G9]-[.H9])/MAX(ABS([.G9]);ABS([.H9]));10))) ->  | L9: of:=IF(OR(ISTEXT([.H9]);ISTEXT([.I9]));"";IF([.H9]=[.I9];"equal";-LOG(ABS([.H9]-[.I9])/MAX(ABS([.H9]);ABS([.I9]));10))) ->  | M9: of:=IF(OR(ISTEXT([.G9]);ISTEXT([.J9]));"";IF([.G9]=[.J9];"equal";-LOG(ABS([.G9]-[.J9])/MAX(ABS([.G9]);ABS([.J9]));10))) ->  | N9: -
B10: - | C10: stim_end | D10: stim_end | E10: - | F10: s | G10: - | H10: - | I10: 99999 | J10: - | K10: of:=IF(OR(ISTEXT([.G10]);ISTEXT([.H10]));"";IF([.G10]=[.H10];"equal";-LOG(ABS([.G10]-[.H10])/MAX(ABS([.G10]);ABS([.H10]));10))) ->  | L10: of:=IF(OR(ISTEXT([.H10]);ISTEXT([.I10]));"";IF([.H10]=[.I10];"equal";-LOG(ABS([.H10]-[.I10])/MAX(ABS([.H10]);ABS([.I10]));10))) ->  | M10: of:=IF(OR(ISTEXT([.G10]);ISTEXT([.J10]));"";IF([.G10]=[.J10];"equal";-LOG(ABS([.G10]-[.J10])/MAX(ABS([.G10]);ABS([.J10]));10))) ->  | N10: -
B11: - | C11: stim_period | D11: stim_period | E11: - | F11: s | G11: - | H11: - | I11: 1 | J11: - | K11: of:=IF(OR(ISTEXT([.G11]);ISTEXT([.H11]));"";IF([.G11]=[.H11];"equal";-LOG(ABS([.G11]-[.H11])/MAX(ABS([.G11]);ABS([.H11]));10))) ->  | L11: of:=IF(OR(ISTEXT([.H11]);ISTEXT([.I11]));"";IF([.H11]=[.I11];"equal";-LOG(ABS([.H11]-[.I11])/MAX(ABS([.H11]);ABS([.I11]));10))) ->  | M11: of:=IF(OR(ISTEXT([.G11]);ISTEXT([.J11]));"";IF([.G11]=[.J11];"equal";-LOG(ABS([.G11]-[.J11])/MAX(ABS([.G11]);ABS([.J11]));10))) ->  | N11: -
B12: - | C12: stim_duration | D12: stim_duration | E12: - | F12: s | G12: - | H12: - | I12: 0.001 | J12: - | K12: of:=IF(OR(ISTEXT([.G12]);ISTEXT([.H12]));"";IF([.G12]=[.H12];"equal";-LOG(ABS([.G12]-[.H12])/MAX(ABS([.G12]);ABS([.H12]));10))) ->  | L12: of:=IF(OR(ISTEXT([.H12]);ISTEXT([.I12]));"";IF([.H12]=[.I12];"equal";-LOG(ABS([.H12]-[.I12])/MAX(ABS([.H12]);ABS([.I12]));10))) ->  | M12: of:=IF(OR(ISTEXT([.G12]);ISTEXT([.J12]));"";IF([.G12]=[.J12];"equal";-LOG(ABS([.G12]-[.J12])/MAX(ABS([.G12]);ABS([.J12]));10))) ->  | N12: -
B13: - | C13: i_stim | D13: stim_amplitude | E13: - | F13: A | G13: - | H13: -0.00000000744 | I13: -0.000000002 | J13: - | K13: of:=IF(OR(ISTEXT([.G13]);ISTEXT([.H13]));"";IF([.G13]=[.H13];"equal";-LOG(ABS([.G13]-[.H13])/MAX(ABS([.G13]);ABS([.H13]));10))) ->  | L13: of:=IF(OR(ISTEXT([.H13]);ISTEXT([.I13]));"";IF([.H13]=[.I13];"equal";-LOG(ABS([.H13]-[.I13])/MAX(ABS([.H13]);ABS([.I13]));10))) -> 0.135974035847699 | M13: of:=IF(OR(ISTEXT([.G13]);ISTEXT([.J13]));"";IF([.G13]=[.J13];"equal";-LOG(ABS([.G13]-[.J13])/MAX(ABS([.G13]);ABS([.J13]));10))) ->  | N13: - | O13: C++ uses different values for 1D model and single-cell
B14: C_m | C14: cm | D14: C_m | E14: l2.c | F14: F | G14: 0.00000000004 | H14: 0.00000000004 | I14: 0.000029 | J14: 0.00000000004 | K14: of:=IF(OR(ISTEXT([.G14]);ISTEXT([.H14]));"";IF([.G14]=[.H14];"equal";-LOG(ABS([.G14]-[.H14])/MAX(ABS([.G14]);ABS([.H14]));10))) -> equal | L14: of:=IF(OR(ISTEXT([.H14]);ISTEXT([.I14]));"";IF([.H14]=[.I14];"equal";-LOG(ABS([.H14]-[.I14])/MAX(ABS([.H14]);ABS([.I14]));10))) -> 0.000000599027284713652 | M14: of:=IF(OR(ISTEXT([.G14]);ISTEXT([.J14]));"";IF([.G14]=[.J14];"equal";-LOG(ABS([.G14]-[.J14])/MAX(ABS([.G14]);ABS([.J14]));10))) -> equal | N14: Inada2009,S15 | O14: CellML swapped C_m values of N and NH cell?
B15: T | C15: T | D15: T | E15: temp | F15: K | G15: 310 | H15: 310.15 | I15: 310 | J15: 310 | K15: of:=IF(OR(ISTEXT([.G15]);ISTEXT([.H15]));"";IF([.G15]=[.H15];"equal";-LOG(ABS([.G15]-[.H15])/MAX(ABS([.G15]);ABS([.H15]));10))) -> 3.31548052644537 | L15: of:=IF(OR(ISTEXT([.H15]);ISTEXT([.I15]));"";IF([.H15]=[.I15];"equal";-LOG(ABS([.H15]-[.I15])/MAX(ABS([.H15]);ABS([.I15]));10))) -> 3.31548052644537 | M15: of:=IF(OR(ISTEXT([.G15]);ISTEXT([.J15]));"";IF([.G15]=[.J15];"equal";-LOG(ABS([.G15]-[.J15])/MAX(ABS([.G15]);ABS([.J15]));10))) -> equal | N15: Inada2009,S1
B16: E_K | C16: rev_k | D16: E_K | E16: v_k | F16: V | G16: of:=8.31446261815324 * [.G15] / 96485.33212 * LOG([.G4]/[.G6]) -> -0.0377661201386988 | H16: of:=8.31446261815324 * [.H15] / 96485.33212 * LOG([.H4]/[.H6]) -> -0.0377843940677982 | I16: of:=8.31446261815324 * [.I15] / 96485.33212 * LOG([.I4]/[.I6]) -> -0.0377661201386988 | J16: of:=8.31446261815324 * [.J15] / 96485.33212 * LOG([.J4]/[.J6]) -> -0.0377661201386988 | K16: of:=IF(OR(ISTEXT([.G16]);ISTEXT([.H16]));"";IF([.G16]=[.H16];"equal";-LOG(ABS([.G16]-[.H16])/MAX(ABS([.G16]);ABS([.H16]));10))) -> 3.31548052644541 | L16: of:=IF(OR(ISTEXT([.H16]);ISTEXT([.I16]));"";IF([.H16]=[.I16];"equal";-LOG(ABS([.H16]-[.I16])/MAX(ABS([.H16]);ABS([.I16]));10))) -> 3.31548052644541 | M16: of:=IF(OR(ISTEXT([.G16]);ISTEXT([.J16]));"";IF([.G16]=[.J16];"equal";-LOG(ABS([.G16]-[.J16])/MAX(ABS([.G16]);ABS([.J16]));10))) -> equal | N16: calculated with Nernst, but not given
A17: I_Na | B17: g_Na | C17: - | D17: - | E17: - | F17: S | G17: 0.000000253 | H17: of:=[.H18] * [.H2] / 8.31446261815324 / [.H15] * (96485.33212 * 96485.33212) -> 0.00000025270548106024 | I17: of:=[.I18] * [.I2] / 8.31446261815324 / [.I15] * (96485.33212 * 96485.33212) -> 0.000000252827757905915 | J17: 0.000000253 | K17: of:=IF(OR(ISTEXT([.G17]);ISTEXT([.H17]));"";IF([.G17]=[.H17];"equal";-LOG(ABS([.G17]-[.H17])/MAX(ABS([.G17]);ABS([.H17]));10))) -> 2.93400729278736 | L17: of:=IF(OR(ISTEXT([.H17]);ISTEXT([.I17]));"";IF([.H17]=[.I17];"equal";-LOG(ABS([.H17]-[.I17])/MAX(ABS([.H17]);ABS([.I17]));10))) -> 3.3154805264454 | M17: of:=IF(OR(ISTEXT([.G17]);ISTEXT([.J17]));"";IF([.G17]=[.J17];"equal";-LOG(ABS([.G17]-[.J17])/MAX(ABS([.G17]);ABS([.J17]));10))) -> equal | N17: Inada2009,S15 | O17: CellML and C++ give value for P_Na but misleadingly call variable g_Na, paper gives g_Na instead
B18: - | C18: g_na | D18: g_Na | E18: na_p | F18: m³/s | G18: of:=[.G17]/[.G2] * 8.31446261815324 * [.G15] / (96485.33212 * 96485.33212) -> 5.00340631296801E-016 | H18: 5E-016 | I18: 5E-016 | J18: of:=[.J17]/[.J2] * 8.31446261815324 * [.J15] / (96485.33212 * 96485.33212) -> 5.00340631296801E-016 | K18: of:=IF(OR(ISTEXT([.G18]);ISTEXT([.H18]));"";IF([.G18]=[.H18];"equal";-LOG(ABS([.G18]-[.H18])/MAX(ABS([.G18]);ABS([.H18]));10))) -> 3.16698122426156 | L18: of:=IF(OR(ISTEXT([.H18]);ISTEXT([.I18]));"";IF([.H18]=[.I18];"equal";-LOG(ABS([.H18]-[.I18])/MAX(ABS([.H18]);ABS([.I18]));10))) -> equal | M18: of:=IF(OR(ISTEXT([.G18]);ISTEXT([.J18]));"";IF([.G18]=[.J18];"equal";-LOG(ABS([.G18]-[.J18])/MAX(ABS([.G18]);ABS([.J18]));10))) -> equal | N18: calculated from g_Na via p_from_g
B19: - | C19: NEGLIGIBLE_SMALL | D19: delta_m | E19: - | F19: V | G19: - | H19: 0.000001 | I19: 0.00000001 | J19: 0.000001 | K19: of:=IF(OR(ISTEXT([.G19]);ISTEXT([.H19]));"";IF([.G19]=[.H19];"equal";-LOG(ABS([.G19]-[.H19])/MAX(ABS([.G19]);ABS([.H19]));10))) ->  | L19: of:=IF(OR(ISTEXT([.H19]);ISTEXT([.I19]));"";IF([.H19]=[.I19];"equal";-LOG(ABS([.H19]-[.I19])/MAX(ABS([.H19]);ABS([.I19]));10))) -> 0.00436480540245004 | M19: of:=IF(OR(ISTEXT([.G19]);ISTEXT([.J19]));"";IF([.G19]=[.J19];"equal";-LOG(ABS([.G19]-[.J19])/MAX(ABS([.G19]);ABS([.J19]));10))) ->  | N19: - | O19: delta when discontinuity handling is turned on, not in paper
A20: I_Ca,L | B20: g_Ca,L | C20: g_l | D20: g_CaL | E20: g_max | F20: S | G20: 0.000000021 | H20: 0.000000021 | I20: 0.000000021 | J20: 0.000000021 | K20: of:=IF(OR(ISTEXT([.G20]);ISTEXT([.H20]));"";IF([.G20]=[.H20];"equal";-LOG(ABS([.G20]-[.H20])/MAX(ABS([.G20]);ABS([.H20]));10))) -> equal | L20: of:=IF(OR(ISTEXT([.H20]);ISTEXT([.I20]));"";IF([.H20]=[.I20];"equal";-LOG(ABS([.H20]-[.I20])/MAX(ABS([.H20]);ABS([.I20]));10))) -> equal | M20: of:=IF(OR(ISTEXT([.G20]);ISTEXT([.J20]));"";IF([.G20]=[.J20];"equal";-LOG(ABS([.G20]-[.J20])/MAX(ABS([.G20]);ABS([.J20]));10))) -> equal | N20: Inada2009,S15
B21: E_Ca,L | C21: rev_l | D21: E_CaL | E21: v_eq | F21: V | G21: 0.0621 | H21: 0.0621 | I21: 0.0621 | J21: 0.0621 | K21: of:=IF(OR(ISTEXT([.G21]);ISTEXT([.H21]));"";IF([.G21]=[.H21];"equal";-LOG(ABS([.G21]-[.H21])/MAX(ABS([.G21]);ABS([.H21]));10))) -> equal | L21: of:=IF(OR(ISTEXT([.H21]);ISTEXT([.I21]));"";IF([.H21]=[.I21];"equal";-LOG(ABS([.H21]-[.I21])/MAX(ABS([.H21]);ABS([.I21]));10))) -> equal | M21: of:=IF(OR(ISTEXT([.G21]);ISTEXT([.J21]));"";IF([.G21]=[.J21];"equal";-LOG(ABS([.G21]-[.J21])/MAX(ABS([.G21]);ABS([.J21]));10))) -> equal | N21: Inada2009,S15
B22: - | C22: act_shift | D22: act_shift | E22: - | F22: V | G22: 0 | H22: 0 | I22: 0 | J22: 0 | K22: of:=IF(OR(ISTEXT([.G22]);ISTEXT([.H22]));"";IF([.G22]=[.H22];"equal";-LOG(ABS([.G22]-[.H22])/MAX(ABS([.G22]);ABS([.H22]));10))) -> equal | L22: of:=IF(OR(ISTEXT([.H22]);ISTEXT([.I22]));"";IF([.H22]=[.I22];"equal";-LOG(ABS([.H22]-[.I22])/MAX(ABS([.H22]);ABS([.I22]));10))) -> equal | M22: of:=IF(OR(ISTEXT([.G22]);ISTEXT([.J22]));"";IF([.G22]=[.J22];"equal";-LOG(ABS([.G22]-[.J22])/MAX(ABS([.G22]);ABS([.J22]));10))) -> equal | N22: Inada2009,S4 | O22: Paper does not have parameter but changes formula
B23: - | C23: slope_factor_act | D23: slope_factor_act | E23: - | F23: V | G23: -0.00661 | H23: -0.00661 | I23: -0.00661 | J23: -0.00661 | K23: of:=IF(OR(ISTEXT([.G23]);ISTEXT([.H23]));"";IF([.G23]=[.H23];"equal";-LOG(ABS([.G23]-[.H23])/MAX(ABS([.G23]);ABS([.H23]));10))) -> equal | L23: of:=IF(OR(ISTEXT([.H23]);ISTEXT([.I23]));"";IF([.H23]=[.I23];"equal";-LOG(ABS([.H23]-[.I23])/MAX(ABS([.H23]);ABS([.I23]));10))) -> equal | M23: of:=IF(OR(ISTEXT([.G23]);ISTEXT([.J23]));"";IF([.G23]=[.J23];"equal";-LOG(ABS([.G23]-[.J23])/MAX(ABS([.G23]);ABS([.J23]));10))) -> equal | N23: Inada2009,S4 | O23: Paper does not have parameter but changes formula
B24: - | C24: inact_shift | D24: inact_shift (f) | E24: - | F24: V | G24: -0.005 | H24: -0.005 | I24: -0.005 | J24: -0.005 | K24: of:=IF(OR(ISTEXT([.G24]);ISTEXT([.H24]));"";IF([.G24]=[.H24];"equal";-LOG(ABS([.G24]-[.H24])/MAX(ABS([.G24]);ABS([.H24]));10))) -> equal | L24: of:=IF(OR(ISTEXT([.H24]);ISTEXT([.I24]));"";IF([.H24]=[.I24];"equal";-LOG(ABS([.H24]-[.I24])/MAX(ABS([.H24]);ABS([.I24]));10))) -> equal | M24: of:=IF(OR(ISTEXT([.G24]);ISTEXT([.J24]));"";IF([.G24]=[.J24];"equal";-LOG(ABS([.G24]-[.J24])/MAX(ABS([.G24]);ABS([.J24]));10))) -> equal | N24: Inada2009,S4 | O24: Paper has -29mV, CellML and C++ use -24mV – 5mV
B25: - | C25: - | D25: inact_shift (f2) | E25: - | F25: V | G25: -0.005 | H25: -0.005 | I25: -0.005 | J25: -0.005 | K25: of:=IF(OR(ISTEXT([.G25]);ISTEXT([.H25]));"";IF([.G25]=[.H25];"equal";-LOG(ABS([.G25]-[.H25])/MAX(ABS([.G25]);ABS([.H25]));10))) -> equal | L25: of:=IF(OR(ISTEXT([.H25]);ISTEXT([.I25]));"";IF([.H25]=[.I25];"equal";-LOG(ABS([.H25]-[.I25])/MAX(ABS([.H25]);ABS([.I25]));10))) -> equal | M25: of:=IF(OR(ISTEXT([.G25]);ISTEXT([.J25]));"";IF([.G25]=[.J25];"equal";-LOG(ABS([.G25]-[.J25])/MAX(ABS([.G25]);ABS([.J25]));10))) -> equal | N25: Inada2009,S4 | O25: Paper has -29mV, CellML and C++ use -24mV – 5mV
B26: - | C26: ach_l | D26: i_ACh | E26: k_ach | F26: A | G26: - | H26: - | I26: - | J26: - | K26: of:=IF(OR(ISTEXT([.G26]);ISTEXT([.H26]));"";IF([.G26]=[.H26];"equal";-LOG(ABS([.G26]-[.H26])/MAX(ABS([.G26]);ABS([.H26]));10))) ->  | L26: of:=IF(OR(ISTEXT([.H26]);ISTEXT([.I26]));"";IF([.H26]=[.I26];"equal";-LOG(ABS([.H26]-[.I26])/MAX(ABS([.H26]);ABS([.I26]));10))) ->  | M26: of:=IF(OR(ISTEXT([.G26]);ISTEXT([.J26]));"";IF([.G26]=[.J26];"equal";-LOG(ABS([.G26]-[.J26])/MAX(ABS([.G26]);ABS([.J26]));10))) ->  | N26: - | O26: CellML uses current here, but naming and use in C++ suggests that this is supposed to be a parameter
A27: I_to | B27: g_to | C27: g_to | D27: g_to | E27: g_max | F27: S | G27: 0.000000014 | H27: 0.000000014 | I27: 0.000000014 | J27: 0.000000014 | K27: of:=IF(OR(ISTEXT([.G27]);ISTEXT([.H27]));"";IF([.G27]=[.H27];"equal";-LOG(ABS([.G27]-[.H27])/MAX(ABS([.G27]);ABS([.H27]));10))) -> equal | L27: of:=IF(OR(ISTEXT([.H27]);ISTEXT([.I27]));"";IF([.H27]=[.I27];"equal";-LOG(ABS([.H27]-[.I27])/MAX(ABS([.H27]);ABS([.I27]));10))) -> equal | M27: of:=IF(OR(ISTEXT([.G27]);ISTEXT([.J27]));"";IF([.G27]=[.J27];"equal";-LOG(ABS([.G27]-[.J27])/MAX(ABS([.G27]);ABS([.J27]));10))) -> equal | N27: Inada2009,S15
A28: I_K,r | B28: g_K,r | C28: g_kr | D28: g_Kr | E28: g_max | F28: S | G28: 0.000000002 | H28: 0.000000002 | I28: 0.000000002 | J28: 0.000000002 | K28: of:=IF(OR(ISTEXT([.G28]);ISTEXT([.H28]));"";IF([.G28]=[.H28];"equal";-LOG(ABS([.G28]-[.H28])/MAX(ABS([.G28]);ABS([.H28]));10))) -> equal | L28: of:=IF(OR(ISTEXT([.H28]);ISTEXT([.I28]));"";IF([.H28]=[.I28];"equal";-LOG(ABS([.H28]-[.I28])/MAX(ABS([.H28]);ABS([.I28]));10))) -> equal | M28: of:=IF(OR(ISTEXT([.G28]);ISTEXT([.J28]));"";IF([.G28]=[.J28];"equal";-LOG(ABS([.G28]-[.J28])/MAX(ABS([.G28]);ABS([.J28]));10))) -> equal | N28: Inada2009,S15
A29: I_f | B29: g_f | C29: g_f | D29: g_f | E29: g_f | F29: S | G29: 0 | H29: 0 | I29: 0 | J29: - | K29: of:=IF(OR(ISTEXT([.G29]);ISTEXT([.H29]));"";IF([.G29]=[.H29];"equal";-LOG(ABS([.G29]-[.H29])/MAX(ABS([.G29]);ABS([.H29]));10))) -> equal | L29: of:=IF(OR(ISTEXT([.H29]);ISTEXT([.I29]));"";IF([.H29]=[.I29];"equal";-LOG(ABS([.H29]-[.I29])/MAX(ABS([.H29]);ABS([.I29]));10))) -> equal | M29: of:=IF(OR(ISTEXT([.G29]);ISTEXT([.J29]));"";IF([.G29]=[.J29];"equal";-LOG(ABS([.G29]-[.J29])/MAX(ABS([.G29]);ABS([.J29]));10))) ->  | N29: Inada2009,S15
B30: - | C30: - | D30: - | E30: v_eq | F30: V | G30: - | H30: -0.03 | I30: -0.03 | J30: - | K30: of:=IF(OR(ISTEXT([.G30]);ISTEXT([.H30]));"";IF([.G30]=[.H30];"equal";-LOG(ABS([.G30]-[.H30])/MAX(ABS([.G30]);ABS([.H30]));10))) ->  | L30: of:=IF(OR(ISTEXT([.H30]);ISTEXT([.I30]));"";IF([.H30]=[.I30];"equal";-LOG(ABS([.H30]-[.I30])/MAX(ABS([.H30]);ABS([.I30]));10))) -> equal | M30: of:=IF(OR(ISTEXT([.G30]);ISTEXT([.J30]));"";IF([.G30]=[.J30];"equal";-LOG(ABS([.G30]-[.J30])/MAX(ABS([.G30]);ABS([.J30]));10))) ->  | N30: Inada2009,S7 | O30: inlined in CellML
A31: I_st | B31: g_st | C31: g_st | D31: g_st | E31: g_st | F31: S | G31: 0 | H31: 0 | I31: 0 | J31: - | K31: of:=IF(OR(ISTEXT([.G31]);ISTEXT([.H31]));"";IF([.G31]=[.H31];"equal";-LOG(ABS([.G31]-[.H31])/MAX(ABS([.G31]);ABS([.H31]));10))) -> equal | L31: of:=IF(OR(ISTEXT([.H31]);ISTEXT([.I31]));"";IF([.H31]=[.I31];"equal";-LOG(ABS([.H31]-[.I31])/MAX(ABS([.H31]);ABS([.I31]));10))) -> equal | M31: of:=IF(OR(ISTEXT([.G31]);ISTEXT([.J31]));"";IF([.G31]=[.J31];"equal";-LOG(ABS([.G31]-[.J31])/MAX(ABS([.G31]);ABS([.J31]));10))) ->  | N31: Inada2009,S15
B32: E_st | C32: rev_st | D32: E_st | E32: E_st | F32: V | G32: 0.0374 | H32: -0.0374 | I32: -0.0374 | J32: - | K32: of:=IF(OR(ISTEXT([.G32]);ISTEXT([.H32]));"";IF([.G32]=[.H32];"equal";-LOG(ABS([.G32]-[.H32])/MAX(ABS([.G32]);ABS([.H32]));10))) -> -0.301029995663981 | L32: of:=IF(OR(ISTEXT([.H32]);ISTEXT([.I32]));"";IF([.H32]=[.I32];"equal";-LOG(ABS([.H32]-[.I32])/MAX(ABS([.H32]);ABS([.I32]));10))) -> equal | M32: of:=IF(OR(ISTEXT([.G32]);ISTEXT([.J32]));"";IF([.G32]=[.J32];"equal";-LOG(ABS([.G32]-[.J32])/MAX(ABS([.G32]);ABS([.J32]));10))) ->  | N32: Kurata2002,A1 | O32: C++ has wrong sign that was transmitted to CellML
A33: I_K,1 | B33: g_K,1 | C33: g_k1 | D33: g_K1 | E33: g_max | F33: S | G33: 0.000000015 | H33: 0.000000015 | I33: 0.000000015 | J33: 0.000000015 | K33: of:=IF(OR(ISTEXT([.G33]);ISTEXT([.H33]));"";IF([.G33]=[.H33];"equal";-LOG(ABS([.G33]-[.H33])/MAX(ABS([.G33]);ABS([.H33]));10))) -> equal | L33: of:=IF(OR(ISTEXT([.H33]);ISTEXT([.I33]));"";IF([.H33]=[.I33];"equal";-LOG(ABS([.H33]-[.I33])/MAX(ABS([.H33]);ABS([.I33]));10))) -> equal | M33: of:=IF(OR(ISTEXT([.G33]);ISTEXT([.J33]));"";IF([.G33]=[.J33];"equal";-LOG(ABS([.G33]-[.J33])/MAX(ABS([.G33]);ABS([.J33]));10))) -> equal | N33: Inada2009,S15
A34: I_b | B34: g_b | C34: g_b | D34: g_b | E34: g_max | F34: S | G34: 0.000000002 | H34: 0.000000002 | I34: 0.000000002 | J34: 0.000000002 | K34: of:=IF(OR(ISTEXT([.G34]);ISTEXT([.H34]));"";IF([.G34]=[.H34];"equal";-LOG(ABS([.G34]-[.H34])/MAX(ABS([.G34]);ABS([.H34]));10))) -> equal | L34: of:=IF(OR(ISTEXT([.H34]);ISTEXT([.I34]));"";IF([.H34]=[.I34];"equal";-LOG(ABS([.H34]-[.I34])/MAX(ABS([.H34]);ABS([.I34]));10))) -> equal | M34: of:=IF(OR(ISTEXT([.G34]);ISTEXT([.J34]));"";IF([.G34]=[.J34];"equal";-LOG(ABS([.G34]-[.J34])/MAX(ABS([.G34]);ABS([.J34]));10))) -> equal | N34: Inada2009,S15
B35: E_b | C35: rev_b | D35: E_b | E35: v_eq | F35: V | G35: -0.04 | H35: -0.04 | I35: -0.04 | J35: -0.04 | K35: of:=IF(OR(ISTEXT([.G35]);ISTEXT([.H35]));"";IF([.G35]=[.H35];"equal";-LOG(ABS([.G35]-[.H35])/MAX(ABS([.G35]);ABS([.H35]));10))) -> equal | L35: of:=IF(OR(ISTEXT([.H35]);ISTEXT([.I35]));"";IF([.H35]=[.I35];"equal";-LOG(ABS([.H35]-[.I35])/MAX(ABS([.H35]);ABS([.I35]));10))) -> equal | M35: of:=IF(OR(ISTEXT([.G35]);ISTEXT([.J35]));"";IF([.G35]=[.J35];"equal";-LOG(ABS([.G35]-[.J35])/MAX(ABS([.G35]);ABS([.J35]));10))) -> equal | N35: Inada2009,S15
A36: I_p | B36: I_p,max | C36: p_max | D36: I_p | E36: i_max | F36: A | G36: 0.000000000197 | H36: of:=0.0000000000984 * 2 -> 0.0000000001968 | I36: 0.0000000001968 | J36: 0.000000000197 | K36: of:=IF(OR(ISTEXT([.G36]);ISTEXT([.H36]));"";IF([.G36]=[.H36];"equal";-LOG(ABS([.G36]-[.H36])/MAX(ABS([.G36]);ABS([.H36]));10))) -> 2.99343623049765 | L36: of:=IF(OR(ISTEXT([.H36]);ISTEXT([.I36]));"";IF([.H36]=[.I36];"equal";-LOG(ABS([.H36]-[.I36])/MAX(ABS([.H36]);ABS([.I36]));10))) -> equal | M36: of:=IF(OR(ISTEXT([.G36]);ISTEXT([.J36]));"";IF([.G36]=[.J36];"equal";-LOG(ABS([.G36]-[.J36])/MAX(ABS([.G36]);ABS([.J36]));10))) -> equal | N36: Inada2009,S15
B37: K_m,Na | C37: - | D37: - | E37: k_m_Na | F37: mM | G37: 5.64 | H37: 5.64 | I37: 5.64 | J37: 5.64 | K37: of:=IF(OR(ISTEXT([.G37]);ISTEXT([.H37]));"";IF([.G37]=[.H37];"equal";-LOG(ABS([.G37]-[.H37])/MAX(ABS([.G37]);ABS([.H37]));10))) -> equal | L37: of:=IF(OR(ISTEXT([.H37]);ISTEXT([.I37]));"";IF([.H37]=[.I37];"equal";-LOG(ABS([.H37]-[.I37])/MAX(ABS([.H37]);ABS([.I37]));10))) -> equal | M37: of:=IF(OR(ISTEXT([.G37]);ISTEXT([.J37]));"";IF([.G37]=[.J37];"equal";-LOG(ABS([.G37]-[.J37])/MAX(ABS([.G37]);ABS([.J37]));10))) -> equal | N37: Zhang2000,Table 10 | O37: Demir1994 gives 5.46, but Zhang2000 gives 5.64
B38: K_m,K | C38: - | D38: - | E38: k_m_K | F38: mM | G38: 0.621 | H38: 0.621 | I38: 0.621 | J38: 0.621 | K38: of:=IF(OR(ISTEXT([.G38]);ISTEXT([.H38]));"";IF([.G38]=[.H38];"equal";-LOG(ABS([.G38]-[.H38])/MAX(ABS([.G38]);ABS([.H38]));10))) -> equal | L38: of:=IF(OR(ISTEXT([.H38]);ISTEXT([.I38]));"";IF([.H38]=[.I38];"equal";-LOG(ABS([.H38]-[.I38])/MAX(ABS([.H38]);ABS([.I38]));10))) -> equal | M38: of:=IF(OR(ISTEXT([.G38]);ISTEXT([.J38]));"";IF([.G38]=[.J38];"equal";-LOG(ABS([.G38]-[.J38])/MAX(ABS([.G38]);ABS([.J38]));10))) -> equal | N38: Zhang2000,Table 10
A39: I_NaCa | B39: k_NaCa | C39: k_naca | D39: kNaCa | E39: k_NaCa | F39: A | G39: 0.00000000592 | H39: of:=0.0000000011832 * 5 -> 0.000000005916 | I39: 0.000000005916 | J39: 0.00000000592 | K39: of:=IF(OR(ISTEXT([.G39]);ISTEXT([.H39]));"";IF([.G39]=[.H39];"equal";-LOG(ABS([.G39]-[.H39])/MAX(ABS([.G39]);ABS([.H39]));10))) -> 3.17026171539491 | L39: of:=IF(OR(ISTEXT([.H39]);ISTEXT([.I39]));"";IF([.H39]=[.I39];"equal";-LOG(ABS([.H39]-[.I39])/MAX(ABS([.H39]);ABS([.I39]));10))) -> equal | M39: of:=IF(OR(ISTEXT([.G39]);ISTEXT([.J39]));"";IF([.G39]=[.J39];"equal";-LOG(ABS([.G39]-[.J39])/MAX(ABS([.G39]);ABS([.J39]));10))) -> equal | N39: Inada2009,S15
B40: Qci | C40: - | D40: Qci | E40: q_ci | F40: 1 | G40: 0.1369 | H40: 0.1369 | I40: 0.1369 | J40: 0.1369 | K40: of:=IF(OR(ISTEXT([.G40]);ISTEXT([.H40]));"";IF([.G40]=[.H40];"equal";-LOG(ABS([.G40]-[.H40])/MAX(ABS([.G40]);ABS([.H40]));10))) -> equal | L40: of:=IF(OR(ISTEXT([.H40]);ISTEXT([.I40]));"";IF([.H40]=[.I40];"equal";-LOG(ABS([.H40]-[.I40])/MAX(ABS([.H40]);ABS([.I40]));10))) -> equal | M40: of:=IF(OR(ISTEXT([.G40]);ISTEXT([.J40]));"";IF([.G40]=[.J40];"equal";-LOG(ABS([.G40]-[.J40])/MAX(ABS([.G40]);ABS([.J40]));10))) -> equal | N40: Dokos1996,p271
B41: Qn | C41: - | D41: Qn | E41: q_n | F41: 1 | G41: 0.4315 | H41: 0.4315 | I41: 0.4315 | J41: 0.4315 | K41: of:=IF(OR(ISTEXT([.G41]);ISTEXT([.H41]));"";IF([.G41]=[.H41];"equal";-LOG(ABS([.G41]-[.H41])/MAX(ABS([.G41]);ABS([.H41]));10))) -> equal | L41: of:=IF(OR(ISTEXT([.H41]);ISTEXT([.I41]));"";IF([.H41]=[.I41];"equal";-LOG(ABS([.H41]-[.I41])/MAX(ABS([.H41]);ABS([.I41]));10))) -> equal | M41: of:=IF(OR(ISTEXT([.G41]);ISTEXT([.J41]));"";IF([.G41]=[.J41];"equal";-LOG(ABS([.G41]-[.J41])/MAX(ABS([.G41]);ABS([.J41]));10))) -> equal | N41: Dokos1996,p271
B42: Qco | C42: - | D42: Qco | E42: q_co | F42: 1 | G42: 0 | H42: 0 | I42: 0 | J42: 0 | K42: of:=IF(OR(ISTEXT([.G42]);ISTEXT([.H42]));"";IF([.G42]=[.H42];"equal";-LOG(ABS([.G42]-[.H42])/MAX(ABS([.G42]);ABS([.H42]));10))) -> equal | L42: of:=IF(OR(ISTEXT([.H42]);ISTEXT([.I42]));"";IF([.H42]=[.I42];"equal";-LOG(ABS([.H42]-[.I42])/MAX(ABS([.H42]);ABS([.I42]));10))) -> equal | M42: of:=IF(OR(ISTEXT([.G42]);ISTEXT([.J42]));"";IF([.G42]=[.J42];"equal";-LOG(ABS([.G42]-[.J42])/MAX(ABS([.G42]);ABS([.J42]));10))) -> equal | N42: Dokos1996,p271
B43: Kci | C43: - | D43: Kci | E43: k_c_i | F43: mM | G43: 0.0207 | H43: 0.0207 | I43: 0.0207 | J43: 0.0207 | K43: of:=IF(OR(ISTEXT([.G43]);ISTEXT([.H43]));"";IF([.G43]=[.H43];"equal";-LOG(ABS([.G43]-[.H43])/MAX(ABS([.G43]);ABS([.H43]));10))) -> equal | L43: of:=IF(OR(ISTEXT([.H43]);ISTEXT([.I43]));"";IF([.H43]=[.I43];"equal";-LOG(ABS([.H43]-[.I43])/MAX(ABS([.H43]);ABS([.I43]));10))) -> equal | M43: of:=IF(OR(ISTEXT([.G43]);ISTEXT([.J43]));"";IF([.G43]=[.J43];"equal";-LOG(ABS([.G43]-[.J43])/MAX(ABS([.G43]);ABS([.J43]));10))) -> equal | N43: Dokos1996,p271
B44: K1ni | C44: - | D44: K1ni | E44: k_1n_i | F44: mM | G44: 395.3 | H44: 395.3 | I44: 395.3 | J44: 395.3 | K44: of:=IF(OR(ISTEXT([.G44]);ISTEXT([.H44]));"";IF([.G44]=[.H44];"equal";-LOG(ABS([.G44]-[.H44])/MAX(ABS([.G44]);ABS([.H44]));10))) -> equal | L44: of:=IF(OR(ISTEXT([.H44]);ISTEXT([.I44]));"";IF([.H44]=[.I44];"equal";-LOG(ABS([.H44]-[.I44])/MAX(ABS([.H44]);ABS([.I44]));10))) -> equal | M44: of:=IF(OR(ISTEXT([.G44]);ISTEXT([.J44]));"";IF([.G44]=[.J44];"equal";-LOG(ABS([.G44]-[.J44])/MAX(ABS([.G44]);ABS([.J44]));10))) -> equal | N44: Dokos1996,p271
B45: K2ni | C45: - | D45: K2ni | E45: k_2n_i | F45: mM | G45: 2.289 | H45: 2.289 | I45: 2.289 | J45: 2.289 | K45: of:=IF(OR(ISTEXT([.G45]);ISTEXT([.H45]));"";IF([.G45]=[.H45];"equal";-LOG(ABS([.G45]-[.H45])/MAX(ABS([.G45]);ABS([.H45]));10))) -> equal | L45: of:=IF(OR(ISTEXT([.H45]);ISTEXT([.I45]));"";IF([.H45]=[.I45];"equal";-LOG(ABS([.H45]-[.I45])/MAX(ABS([.H45]);ABS([.I45]));10))) -> equal | M45: of:=IF(OR(ISTEXT([.G45]);ISTEXT([.J45]));"";IF([.G45]=[.J45];"equal";-LOG(ABS([.G45]-[.J45])/MAX(ABS([.G45]);ABS([.J45]));10))) -> equal | N45: Dokos1996,p271
B46: K3ni | C46: - | D46: K3ni | E46: k_3n_i | F46: mM | G46: 26.44 | H46: 26.44 | I46: 26.44 | J46: 26.44 | K46: of:=IF(OR(ISTEXT([.G46]);ISTEXT([.H46]));"";IF([.G46]=[.H46];"equal";-LOG(ABS([.G46]-[.H46])/MAX(ABS([.G46]);ABS([.H46]));10))) -> equal | L46: of:=IF(OR(ISTEXT([.H46]);ISTEXT([.I46]));"";IF([.H46]=[.I46];"equal";-LOG(ABS([.H46]-[.I46])/MAX(ABS([.H46]);ABS([.I46]));10))) -> equal | M46: of:=IF(OR(ISTEXT([.G46]);ISTEXT([.J46]));"";IF([.G46]=[.J46];"equal";-LOG(ABS([.G46]-[.J46])/MAX(ABS([.G46]);ABS([.J46]));10))) -> equal | N46: Dokos1996,p271
B47: Kcni | C47: - | D47: Kcni | E47: k_cn_i | F47: mM | G47: 26.44 | H47: 26.44 | I47: 26.44 | J47: 26.44 | K47: of:=IF(OR(ISTEXT([.G47]);ISTEXT([.H47]));"";IF([.G47]=[.H47];"equal";-LOG(ABS([.G47]-[.H47])/MAX(ABS([.G47]);ABS([.H47]));10))) -> equal | L47: of:=IF(OR(ISTEXT([.H47]);ISTEXT([.I47]));"";IF([.H47]=[.I47];"equal";-LOG(ABS([.H47]-[.I47])/MAX(ABS([.H47]);ABS([.I47]));10))) -> equal | M47: of:=IF(OR(ISTEXT([.G47]);ISTEXT([.J47]));"";IF([.G47]=[.J47];"equal";-LOG(ABS([.G47]-[.J47])/MAX(ABS([.G47]);ABS([.J47]));10))) -> equal | N47: Dokos1996,p271
B48: K3no | C48: - | D48: K3no | E48: k_3n_o | F48: mM | G48: 4.663 | H48: 4.663 | I48: 4.663 | J48: 4.663 | K48: of:=IF(OR(ISTEXT([.G48]);ISTEXT([.H48]));"";IF([.G48]=[.H48];"equal";-LOG(ABS([.G48]-[.H48])/MAX(ABS([.G48]);ABS([.H48]));10))) -> equal | L48: of:=IF(OR(ISTEXT([.H48]);ISTEXT([.I48]));"";IF([.H48]=[.I48];"equal";-LOG(ABS([.H48]-[.I48])/MAX(ABS([.H48]);ABS([.I48]));10))) -> equal | M48: of:=IF(OR(ISTEXT([.G48]);ISTEXT([.J48]));"";IF([.G48]=[.J48];"equal";-LOG(ABS([.G48]-[.J48])/MAX(ABS([.G48]);ABS([.J48]));10))) -> equal | N48: Dokos1996,p271
B49: K1no | C49: - | D49: K1no | E49: k_1n_o | F49: mM | G49: 1628 | H49: 1628 | I49: 1628 | J49: 1628 | K49: of:=IF(OR(ISTEXT([.G49]);ISTEXT([.H49]));"";IF([.G49]=[.H49];"equal";-LOG(ABS([.G49]-[.H49])/MAX(ABS([.G49]);ABS([.H49]));10))) -> equal | L49: of:=IF(OR(ISTEXT([.H49]);ISTEXT([.I49]));"";IF([.H49]=[.I49];"equal";-LOG(ABS([.H49]-[.I49])/MAX(ABS([.H49]);ABS([.I49]));10))) -> equal | M49: of:=IF(OR(ISTEXT([.G49]);ISTEXT([.J49]));"";IF([.G49]=[.J49];"equal";-LOG(ABS([.G49]-[.J49])/MAX(ABS([.G49]);ABS([.J49]));10))) -> equal | N49: Dokos1996,p271
B50: K2no | C50: - | D50: K2no | E50: k_2n_o | F50: mM | G50: 561.4 | H50: 561.4 | I50: 561.4 | J50: 561.4 | K50: of:=IF(OR(ISTEXT([.G50]);ISTEXT([.H50]));"";IF([.G50]=[.H50];"equal";-LOG(ABS([.G50]-[.H50])/MAX(ABS([.G50]);ABS([.H50]));10))) -> equal | L50: of:=IF(OR(ISTEXT([.H50]);ISTEXT([.I50]));"";IF([.H50]=[.I50];"equal";-LOG(ABS([.H50]-[.I50])/MAX(ABS([.H50]);ABS([.I50]));10))) -> equal | M50: of:=IF(OR(ISTEXT([.G50]);ISTEXT([.J50]));"";IF([.G50]=[.J50];"equal";-LOG(ABS([.G50]-[.J50])/MAX(ABS([.G50]);ABS([.J50]));10))) -> equal | N50: Dokos1996,p271
B51: Kco | C51: - | D51: Kco | E51: k_c_o | F51: mM | G51: 3.663 | H51: 3.663 | I51: 3.663 | J51: 3.663 | K51: of:=IF(OR(ISTEXT([.G51]);ISTEXT([.H51]));"";IF([.G51]=[.H51];"equal";-LOG(ABS([.G51]-[.H51])/MAX(ABS([.G51]);ABS([.H51]));10))) -> equal | L51: of:=IF(OR(ISTEXT([.H51]);ISTEXT([.I51]));"";IF([.H51]=[.I51];"equal";-LOG(ABS([.H51]-[.I51])/MAX(ABS([.H51]);ABS([.I51]));10))) -> equal | M51: of:=IF(OR(ISTEXT([.G51]);ISTEXT([.J51]));"";IF([.G51]=[.J51];"equal";-LOG(ABS([.G51]-[.J51])/MAX(ABS([.G51]);ABS([.J51]));10))) -> equal | N51: Dokos1996,p271
A52: I_Ach | B52: - | C52: g_ach_max | D52: g_ACh_max | E52: g_max | F52: S | G52: - | H52: 0.0000000198 | I52: 0.0000000198 | J52: - | K52: of:=IF(OR(ISTEXT([.G52]);ISTEXT([.H52]));"";IF([.G52]=[.H52];"equal";-LOG(ABS([.G52]-[.H52])/MAX(ABS([.G52]);ABS([.H52]));10))) ->  | L52: of:=IF(OR(ISTEXT([.H52]);ISTEXT([.I52]));"";IF([.H52]=[.I52];"equal";-LOG(ABS([.H52]-[.I52])/MAX(ABS([.H52]);ABS([.I52]));10))) -> equal | M52: of:=IF(OR(ISTEXT([.G52]);ISTEXT([.J52]));"";IF([.G52]=[.J52];"equal";-LOG(ABS([.G52]-[.J52])/MAX(ABS([.G52]);ABS([.J52]));10))) ->  | N52: - | O52: not in paper
B53: - | C53: k_ach | D53: K_ACh | E53: k_ach | F53: mM | G53: - | H53: 0.00035 | I53: 0.00035 | J53: - | K53: of:=IF(OR(ISTEXT([.G53]);ISTEXT([.H53]));"";IF([.G53]=[.H53];"equal";-LOG(ABS([.G53]-[.H53])/MAX(ABS([.G53]);ABS([.H53]));10))) ->  | L53: of:=IF(OR(ISTEXT([.H53]);ISTEXT([.I53]));"";IF([.H53]=[.I53];"equal";-LOG(ABS([.H53]-[.I53])/MAX(ABS([.H53]);ABS([.I53]));10))) -> equal | M53: of:=IF(OR(ISTEXT([.G53]);ISTEXT([.J53]));"";IF([.G53]=[.J53];"equal";-LOG(ABS([.G53]-[.J53])/MAX(ABS([.G53]);ABS([.J53]));10))) ->  | N53: - | O53: not in paper
B54: - | C54: inact_fast.n.start | D54: achf | E54: inact_fast.n.start | F54: 1 | G54: - | H54: - | I54: 0.742428 | J54: - | K54: of:=IF(OR(ISTEXT([.G54]);ISTEXT([.H54]));"";IF([.G54]=[.H54];"equal";-LOG(ABS([.G54]-[.H54])/MAX(ABS([.G54]);ABS([.H54]));10))) ->  | L54: of:=IF(OR(ISTEXT([.H54]);ISTEXT([.I54]));"";IF([.H54]=[.I54];"equal";-LOG(ABS([.H54]-[.I54])/MAX(ABS([.H54]);ABS([.I54]));10))) ->  | M54: of:=IF(OR(ISTEXT([.G54]);ISTEXT([.J54]));"";IF([.G54]=[.J54];"equal";-LOG(ABS([.G54]-[.J54])/MAX(ABS([.G54]);ABS([.J54]));10))) ->  | N54: - | O54: not in paper
B55: - | C55: alpha_achf | D55: alpha_achf | E55: - | F55: 1/s | G55: - | H55: 73.1 | I55: 73.1 | J55: 73.1 | K55: of:=IF(OR(ISTEXT([.G55]);ISTEXT([.H55]));"";IF([.G55]=[.H55];"equal";-LOG(ABS([.G55]-[.H55])/MAX(ABS([.G55]);ABS([.H55]));10))) ->  | L55: of:=IF(OR(ISTEXT([.H55]);ISTEXT([.I55]));"";IF([.H55]=[.I55];"equal";-LOG(ABS([.H55]-[.I55])/MAX(ABS([.H55]);ABS([.I55]));10))) -> equal | M55: of:=IF(OR(ISTEXT([.G55]);ISTEXT([.J55]));"";IF([.G55]=[.J55];"equal";-LOG(ABS([.G55]-[.J55])/MAX(ABS([.G55]);ABS([.J55]));10))) ->  | N55: - | O55: not in paper
B56: - | C56: alpha_achs | D56: alpha_achs | E56: - | F56: 1/s | G56: - | H56: 3.7 | I56: 3.7 | J56: 3.7 | K56: of:=IF(OR(ISTEXT([.G56]);ISTEXT([.H56]));"";IF([.G56]=[.H56];"equal";-LOG(ABS([.G56]-[.H56])/MAX(ABS([.G56]);ABS([.H56]));10))) ->  | L56: of:=IF(OR(ISTEXT([.H56]);ISTEXT([.I56]));"";IF([.H56]=[.I56];"equal";-LOG(ABS([.H56]-[.I56])/MAX(ABS([.H56]);ABS([.I56]));10))) -> equal | M56: of:=IF(OR(ISTEXT([.G56]);ISTEXT([.J56]));"";IF([.G56]=[.J56];"equal";-LOG(ABS([.G56]-[.J56])/MAX(ABS([.G56]);ABS([.J56]));10))) ->  | N56: - | O56: not in paper
B57: - | C57: inact_slow.n.start | D57: achs | E57: inact_slow.n.start | F57: 1 | G57: - | H57: - | I57: 0.746918 | J57: - | K57: of:=IF(OR(ISTEXT([.G57]);ISTEXT([.H57]));"";IF([.G57]=[.H57];"equal";-LOG(ABS([.G57]-[.H57])/MAX(ABS([.G57]);ABS([.H57]));10))) ->  | L57: of:=IF(OR(ISTEXT([.H57]);ISTEXT([.I57]));"";IF([.H57]=[.I57];"equal";-LOG(ABS([.H57]-[.I57])/MAX(ABS([.H57]);ABS([.I57]));10))) ->  | M57: of:=IF(OR(ISTEXT([.G57]);ISTEXT([.J57]));"";IF([.G57]=[.J57];"equal";-LOG(ABS([.G57]-[.J57])/MAX(ABS([.G57]);ABS([.J57]));10))) ->  | N57: - | O57: not in paper
A58: CaHandling | B58: V_cell | C58: vol_cell | D58: V_cell | E58: v_cell | F58: m³ | G58: 3.5E-015 | H58: of:= 1/1000 * (([.$H14] - 0.00000000002) / 0.000000000045 * (0.000000000007147123 - 0.00000000000219911) + 0.00000000000219911) -> 4.39822688888889E-015 | I58: of:=0.00000439823 / POWER(1000;3) -> 4.39823E-015 | J58: of:= 1/1000 * (([.$J14] - 0.00000000002) / 0.000000000045 * (0.000000000007147123 - 0.00000000000219911) + 0.00000000000219911) -> 4.39822688888889E-015 | K58: of:=IF(OR(ISTEXT([.G58]);ISTEXT([.H58]));"";IF([.G58]=[.H58];"equal";-LOG(ABS([.G58]-[.H58])/MAX(ABS([.G58]);ABS([.H58]));10))) -> 0.68989157755861 | L58: of:=IF(OR(ISTEXT([.H58]);ISTEXT([.I58]));"";IF([.H58]=[.I58];"equal";-LOG(ABS([.H58]-[.I58])/MAX(ABS([.H58]);ABS([.I58]));10))) -> 6.15036241454006 | M58: of:=IF(OR(ISTEXT([.G58]);ISTEXT([.J58]));"";IF([.G58]=[.J58];"equal";-LOG(ABS([.G58]-[.J58])/MAX(ABS([.G58]);ABS([.J58]));10))) -> 0.68989157755861 | N58: Kurata2002,A1 | O58: C++ code uses function based on C_m that is not given in paper
B59: V_i | C59: vol_i | D59: v_cyto | E59: v_cyto | F59: m³ | G59: of:=0.46*[.G58]-[.G60] -> 1.575E-015 | H59: of:=0.46*[.H58]-[.H60] -> 1.9792021E-015 | I59: of:=0.46*[.I58]-[.I60] -> 1.9792035E-015 | J59: of:=0.46*[.J58]-[.J60] -> 1.9792021E-015 | K59: of:=IF(OR(ISTEXT([.G59]);ISTEXT([.H59]));"";IF([.G59]=[.H59];"equal";-LOG(ABS([.G59]-[.H59])/MAX(ABS([.G59]);ABS([.H59]));10))) -> 0.68989157755861 | L59: of:=IF(OR(ISTEXT([.H59]);ISTEXT([.I59]));"";IF([.H59]=[.I59];"equal";-LOG(ABS([.H59]-[.I59])/MAX(ABS([.H59]);ABS([.I59]));10))) -> 6.15036241444218 | M59: of:=IF(OR(ISTEXT([.G59]);ISTEXT([.J59]));"";IF([.G59]=[.J59];"equal";-LOG(ABS([.G59]-[.J59])/MAX(ABS([.G59]);ABS([.J59]));10))) -> 0.68989157755861 | N59: Kurata2002,A1
B60: V_sub | C60: vol_sub | D60: v_sub | E60: v_sub | F60: m³ | G60: of:=0.01*[.G58] -> 3.5E-017 | H60: of:=0.01*[.H58] -> 4.39822688888889E-017 | I60: of:=0.01*[.I58] -> 4.39823E-017 | J60: of:=0.01*[.J58] -> 4.39822688888889E-017 | K60: of:=IF(OR(ISTEXT([.G60]);ISTEXT([.H60]));"";IF([.G60]=[.H60];"equal";-LOG(ABS([.G60]-[.H60])/MAX(ABS([.G60]);ABS([.H60]));10))) -> 0.68989157755861 | L60: of:=IF(OR(ISTEXT([.H60]);ISTEXT([.I60]));"";IF([.H60]=[.I60];"equal";-LOG(ABS([.H60]-[.I60])/MAX(ABS([.H60]);ABS([.I60]));10))) -> 6.1503624145435 | M60: of:=IF(OR(ISTEXT([.G60]);ISTEXT([.J60]));"";IF([.G60]=[.J60];"equal";-LOG(ABS([.G60]-[.J60])/MAX(ABS([.G60]);ABS([.J60]));10))) -> 0.68989157755861 | N60: Kurata2002,A1
B61: V_rel | C61: vol_rel | D61: v_jsr/v_rel | E61: v_jsr | F61: m³ | G61: of:=0.0012*[.G58] -> 4.2E-018 | H61: of:=0.0012*[.H58] -> 5.27787226666667E-018 | I61: of:=0.0012*[.I58] -> 5.277876E-018 | J61: of:=0.0012*[.J58] -> 5.27787226666667E-018 | K61: of:=IF(OR(ISTEXT([.G61]);ISTEXT([.H61]));"";IF([.G61]=[.H61];"equal";-LOG(ABS([.G61]-[.H61])/MAX(ABS([.G61]);ABS([.H61]));10))) -> 0.68989157755861 | L61: of:=IF(OR(ISTEXT([.H61]);ISTEXT([.I61]));"";IF([.H61]=[.I61];"equal";-LOG(ABS([.H61]-[.I61])/MAX(ABS([.H61]);ABS([.I61]));10))) -> 6.15036241457576 | M61: of:=IF(OR(ISTEXT([.G61]);ISTEXT([.J61]));"";IF([.G61]=[.J61];"equal";-LOG(ABS([.G61]-[.J61])/MAX(ABS([.G61]);ABS([.J61]));10))) -> 0.68989157755861 | N61: Kurata2002,A1
B62: V_up | C62: vol_up | D62: v_nsr/v_up | E62: v_nsr | F62: m³ | G62: of:=0.0116*[.G58] -> 4.06E-017 | H62: of:=0.0116*[.H58] -> 5.10194319111111E-017 | I62: of:=0.0116*[.I58] -> 5.1019468E-017 | J62: of:=0.0116*[.J58] -> 5.10194319111111E-017 | K62: of:=IF(OR(ISTEXT([.G62]);ISTEXT([.H62]));"";IF([.G62]=[.H62];"equal";-LOG(ABS([.G62]-[.H62])/MAX(ABS([.G62]);ABS([.H62]));10))) -> 0.68989157755861 | L62: of:=IF(OR(ISTEXT([.H62]);ISTEXT([.I62]));"";IF([.H62]=[.I62];"equal";-LOG(ABS([.H62]-[.I62])/MAX(ABS([.H62]);ABS([.I62]));10))) -> 6.15036241458504 | M62: of:=IF(OR(ISTEXT([.G62]);ISTEXT([.J62]));"";IF([.G62]=[.J62];"equal";-LOG(ABS([.G62]-[.J62])/MAX(ABS([.G62]);ABS([.J62]));10))) -> 0.68989157755861 | N62: Kurata2002,A1
B63: k_b_CM | C63: - | D63: - | E63: BufferCM.kb | F63: 1/s | G63: 542 | H63: 542 | I63: 542 | J63: 542 | K63: of:=IF(OR(ISTEXT([.G63]);ISTEXT([.H63]));"";IF([.G63]=[.H63];"equal";-LOG(ABS([.G63]-[.H63])/MAX(ABS([.G63]);ABS([.H63]));10))) -> equal | L63: of:=IF(OR(ISTEXT([.H63]);ISTEXT([.I63]));"";IF([.H63]=[.I63];"equal";-LOG(ABS([.H63]-[.I63])/MAX(ABS([.H63]);ABS([.I63]));10))) -> equal | M63: of:=IF(OR(ISTEXT([.G63]);ISTEXT([.J63]));"";IF([.G63]=[.J63];"equal";-LOG(ABS([.G63]-[.J63])/MAX(ABS([.G63]);ABS([.J63]));10))) -> equal | N63: Kurata2002,A1
B64: k_b_CQ | C64: - | D64: - | E64: cq.kb | F64: 1/s | G64: 445 | H64: 445 | I64: 445 | J64: 445 | K64: of:=IF(OR(ISTEXT([.G64]);ISTEXT([.H64]));"";IF([.G64]=[.H64];"equal";-LOG(ABS([.G64]-[.H64])/MAX(ABS([.G64]);ABS([.H64]));10))) -> equal | L64: of:=IF(OR(ISTEXT([.H64]);ISTEXT([.I64]));"";IF([.H64]=[.I64];"equal";-LOG(ABS([.H64]-[.I64])/MAX(ABS([.H64]);ABS([.I64]));10))) -> equal | M64: of:=IF(OR(ISTEXT([.G64]);ISTEXT([.J64]));"";IF([.G64]=[.J64];"equal";-LOG(ABS([.G64]-[.J64])/MAX(ABS([.G64]);ABS([.J64]));10))) -> equal | N64: Kurata2002,A1
B65: k_b_TC | C65: - | D65: - | E65: tc.kb | F65: 1/s | G65: 446 | H65: 446 | I65: 446 | J65: 446 | K65: of:=IF(OR(ISTEXT([.G65]);ISTEXT([.H65]));"";IF([.G65]=[.H65];"equal";-LOG(ABS([.G65]-[.H65])/MAX(ABS([.G65]);ABS([.H65]));10))) -> equal | L65: of:=IF(OR(ISTEXT([.H65]);ISTEXT([.I65]));"";IF([.H65]=[.I65];"equal";-LOG(ABS([.H65]-[.I65])/MAX(ABS([.H65]);ABS([.I65]));10))) -> equal | M65: of:=IF(OR(ISTEXT([.G65]);ISTEXT([.J65]));"";IF([.G65]=[.J65];"equal";-LOG(ABS([.G65]-[.J65])/MAX(ABS([.G65]);ABS([.J65]));10))) -> equal | N65: Kurata2002,A1
B66: k_b_TMC | C66: - | D66: - | E66: tmc.kb | F66: 1/s | G66: 7.51 | H66: 7.51 | I66: 7.51 | J66: 7.51 | K66: of:=IF(OR(ISTEXT([.G66]);ISTEXT([.H66]));"";IF([.G66]=[.H66];"equal";-LOG(ABS([.G66]-[.H66])/MAX(ABS([.G66]);ABS([.H66]));10))) -> equal | L66: of:=IF(OR(ISTEXT([.H66]);ISTEXT([.I66]));"";IF([.H66]=[.I66];"equal";-LOG(ABS([.H66]-[.I66])/MAX(ABS([.H66]);ABS([.I66]));10))) -> equal | M66: of:=IF(OR(ISTEXT([.G66]);ISTEXT([.J66]));"";IF([.G66]=[.J66];"equal";-LOG(ABS([.G66]-[.J66])/MAX(ABS([.G66]);ABS([.J66]));10))) -> equal | N66: Kurata2002,A1
B67: k_b_TMM | C67: - | D67: - | E67: tmm.kb | F67: 1/s | G67: 751 | H67: 751 | I67: 751 | J67: 751 | K67: of:=IF(OR(ISTEXT([.G67]);ISTEXT([.H67]));"";IF([.G67]=[.H67];"equal";-LOG(ABS([.G67]-[.H67])/MAX(ABS([.G67]);ABS([.H67]));10))) -> equal | L67: of:=IF(OR(ISTEXT([.H67]);ISTEXT([.I67]));"";IF([.H67]=[.I67];"equal";-LOG(ABS([.H67]-[.I67])/MAX(ABS([.H67]);ABS([.I67]));10))) -> equal | M67: of:=IF(OR(ISTEXT([.G67]);ISTEXT([.J67]));"";IF([.G67]=[.J67];"equal";-LOG(ABS([.G67]-[.J67])/MAX(ABS([.G67]);ABS([.J67]));10))) -> equal | N67: Kurata2002,A1
B68: k_b_SL | C68: - | D68: - | E68: sl.kb | F68: 1/s | G68: 1 | H68: 1 | I68: 1 | J68: 1 | K68: of:=IF(OR(ISTEXT([.G68]);ISTEXT([.H68]));"";IF([.G68]=[.H68];"equal";-LOG(ABS([.G68]-[.H68])/MAX(ABS([.G68]);ABS([.H68]));10))) -> equal | L68: of:=IF(OR(ISTEXT([.H68]);ISTEXT([.I68]));"";IF([.H68]=[.I68];"equal";-LOG(ABS([.H68]-[.I68])/MAX(ABS([.H68]);ABS([.I68]));10))) -> equal | M68: of:=IF(OR(ISTEXT([.G68]);ISTEXT([.J68]));"";IF([.G68]=[.J68];"equal";-LOG(ABS([.G68]-[.J68])/MAX(ABS([.G68]);ABS([.J68]));10))) -> equal | N68: Inada2009,S12 | O68: diff_f_csl is multiplied by 0.001 after definition
B69: k_f_CM | C69: - | D69: - | E69: BufferCM.k | F69: 1/(mM s) | G69: 227700 | H69: 227700 | I69: 227700 | J69: 227700 | K69: of:=IF(OR(ISTEXT([.G69]);ISTEXT([.H69]));"";IF([.G69]=[.H69];"equal";-LOG(ABS([.G69]-[.H69])/MAX(ABS([.G69]);ABS([.H69]));10))) -> equal | L69: of:=IF(OR(ISTEXT([.H69]);ISTEXT([.I69]));"";IF([.H69]=[.I69];"equal";-LOG(ABS([.H69]-[.I69])/MAX(ABS([.H69]);ABS([.I69]));10))) -> equal | M69: of:=IF(OR(ISTEXT([.G69]);ISTEXT([.J69]));"";IF([.G69]=[.J69];"equal";-LOG(ABS([.G69]-[.J69])/MAX(ABS([.G69]);ABS([.J69]));10))) -> equal | N69: Kurata2002,A1
B70: k_f_CQ | C70: - | D70: - | E70: cq.k | F70: 1/(mM s) | G70: 534 | H70: 534 | I70: 543 | J70: 534 | K70: of:=IF(OR(ISTEXT([.G70]);ISTEXT([.H70]));"";IF([.G70]=[.H70];"equal";-LOG(ABS([.G70]-[.H70])/MAX(ABS([.G70]);ABS([.H70]));10))) -> equal | L70: of:=IF(OR(ISTEXT([.H70]);ISTEXT([.I70]));"";IF([.H70]=[.I70];"equal";-LOG(ABS([.H70]-[.I70])/MAX(ABS([.H70]);ABS([.I70]));10))) -> 1.78055732014952 | M70: of:=IF(OR(ISTEXT([.G70]);ISTEXT([.J70]));"";IF([.G70]=[.J70];"equal";-LOG(ABS([.G70]-[.J70])/MAX(ABS([.G70]);ABS([.J70]));10))) -> equal | N70: Kurata2002,A1
B71: k_f_TC | C71: - | D71: - | E71: tc.k | F71: 1/(mM s) | G71: 88800 | H71: 88800 | I71: 88800 | J71: 88800 | K71: of:=IF(OR(ISTEXT([.G71]);ISTEXT([.H71]));"";IF([.G71]=[.H71];"equal";-LOG(ABS([.G71]-[.H71])/MAX(ABS([.G71]);ABS([.H71]));10))) -> equal | L71: of:=IF(OR(ISTEXT([.H71]);ISTEXT([.I71]));"";IF([.H71]=[.I71];"equal";-LOG(ABS([.H71]-[.I71])/MAX(ABS([.H71]);ABS([.I71]));10))) -> equal | M71: of:=IF(OR(ISTEXT([.G71]);ISTEXT([.J71]));"";IF([.G71]=[.J71];"equal";-LOG(ABS([.G71]-[.J71])/MAX(ABS([.G71]);ABS([.J71]));10))) -> equal | N71: Kurata2002,A1
B72: k_f_TMC | C72: - | D72: - | E72: tmc.k | F72: 1/(mM s) | G72: 227700 | H72: 222700 | I72: 227700 | J72: 227700 | K72: of:=IF(OR(ISTEXT([.G72]);ISTEXT([.H72]));"";IF([.G72]=[.H72];"equal";-LOG(ABS([.G72]-[.H72])/MAX(ABS([.G72]);ABS([.H72]));10))) -> 1.65839302627912 | L72: of:=IF(OR(ISTEXT([.H72]);ISTEXT([.I72]));"";IF([.H72]=[.I72];"equal";-LOG(ABS([.H72]-[.I72])/MAX(ABS([.H72]);ABS([.I72]));10))) -> 1.65839302627912 | M72: of:=IF(OR(ISTEXT([.G72]);ISTEXT([.J72]));"";IF([.G72]=[.J72];"equal";-LOG(ABS([.G72]-[.J72])/MAX(ABS([.G72]);ABS([.J72]));10))) -> equal | N72: Kurata2002,A1
B73: k_f_TMM | C73: - | D73: - | E73: tmm.k | F73: 1/(mM s) | G73: 2277 | H73: 2277 | I73: 2277 | J73: 2277 | K73: of:=IF(OR(ISTEXT([.G73]);ISTEXT([.H73]));"";IF([.G73]=[.H73];"equal";-LOG(ABS([.G73]-[.H73])/MAX(ABS([.G73]);ABS([.H73]));10))) -> equal | L73: of:=IF(OR(ISTEXT([.H73]);ISTEXT([.I73]));"";IF([.H73]=[.I73];"equal";-LOG(ABS([.H73]-[.I73])/MAX(ABS([.H73]);ABS([.I73]));10))) -> equal | M73: of:=IF(OR(ISTEXT([.G73]);ISTEXT([.J73]));"";IF([.G73]=[.J73];"equal";-LOG(ABS([.G73]-[.J73])/MAX(ABS([.G73]);ABS([.J73]));10))) -> equal | N73: Kurata2002,A1
B74: k_f_SL | C74: - | D74: - | E74: sl.kb | F74: 1/(mM s) | G74: 0.115 | H74: 0.115 | I74: of:=0.001*115 -> 0.115 | J74: 0.115 | K74: of:=IF(OR(ISTEXT([.G74]);ISTEXT([.H74]));"";IF([.G74]=[.H74];"equal";-LOG(ABS([.G74]-[.H74])/MAX(ABS([.G74]);ABS([.H74]));10))) -> equal | L74: of:=IF(OR(ISTEXT([.H74]);ISTEXT([.I74]));"";IF([.H74]=[.I74];"equal";-LOG(ABS([.H74]-[.I74])/MAX(ABS([.H74]);ABS([.I74]));10))) -> equal | M74: of:=IF(OR(ISTEXT([.G74]);ISTEXT([.J74]));"";IF([.G74]=[.J74];"equal";-LOG(ABS([.G74]-[.J74])/MAX(ABS([.G74]);ABS([.J74]));10))) -> equal | N74: Inada2009,S12
B75: SL_tot | C75: - | D75: - | E75: cm_sl.c_tot | F75: mM | G75: - | H75: of:=31 / 1.2 -> 25.8333333333333 | I75: of:=0.031/1.2 -> 0.0258333333333333 | J75: of:=0.031/1.2 -> 0.0258333333333333 | K75: of:=IF(OR(ISTEXT([.G75]);ISTEXT([.H75]));"";IF([.G75]=[.H75];"equal";-LOG(ABS([.G75]-[.H75])/MAX(ABS([.G75]);ABS([.H75]));10))) ->  | L75: of:=IF(OR(ISTEXT([.H75]);ISTEXT([.I75]));"";IF([.H75]=[.I75];"equal";-LOG(ABS([.H75]-[.I75])/MAX(ABS([.H75]);ABS([.I75]));10))) -> 0.000434511774017692 | M75: of:=IF(OR(ISTEXT([.G75]);ISTEXT([.J75]));"";IF([.G75]=[.J75];"equal";-LOG(ABS([.G75]-[.J75])/MAX(ABS([.G75]);ABS([.J75]));10))) ->  | N75: - | O75: neither in Inada2009 nor Kurata2002, C++ has probably wrong order of magnitude
B76: [CM]_tot | C76: - | D76: - | E76: cm.c_tot | F76: mM | G76: 0.045 | H76: 0.045 | I76: 0.045 | J76: 0.045 | K76: of:=IF(OR(ISTEXT([.G76]);ISTEXT([.H76]));"";IF([.G76]=[.H76];"equal";-LOG(ABS([.G76]-[.H76])/MAX(ABS([.G76]);ABS([.H76]));10))) -> equal | L76: of:=IF(OR(ISTEXT([.H76]);ISTEXT([.I76]));"";IF([.H76]=[.I76];"equal";-LOG(ABS([.H76]-[.I76])/MAX(ABS([.H76]);ABS([.I76]));10))) -> equal | M76: of:=IF(OR(ISTEXT([.G76]);ISTEXT([.J76]));"";IF([.G76]=[.J76];"equal";-LOG(ABS([.G76]-[.J76])/MAX(ABS([.G76]);ABS([.J76]));10))) -> equal | N76: Kurata2002,A1
B77: [CQ]_tot | C77: - | D77: - | E77: cq.c_tot | F77: mM | G77: 10 | H77: 10 | I77: 10 | J77: 10 | K77: of:=IF(OR(ISTEXT([.G77]);ISTEXT([.H77]));"";IF([.G77]=[.H77];"equal";-LOG(ABS([.G77]-[.H77])/MAX(ABS([.G77]);ABS([.H77]));10))) -> equal | L77: of:=IF(OR(ISTEXT([.H77]);ISTEXT([.I77]));"";IF([.H77]=[.I77];"equal";-LOG(ABS([.H77]-[.I77])/MAX(ABS([.H77]);ABS([.I77]));10))) -> equal | M77: of:=IF(OR(ISTEXT([.G77]);ISTEXT([.J77]));"";IF([.G77]=[.J77];"equal";-LOG(ABS([.G77]-[.J77])/MAX(ABS([.G77]);ABS([.J77]));10))) -> equal | N77: Kurata2002,A1
B78: [TC]_tot | C78: - | D78: - | E78: tc.c_tot | F78: mM | G78: 0.031 | H78: 0.031 | I78: 0.031 | J78: 0.031 | K78: of:=IF(OR(ISTEXT([.G78]);ISTEXT([.H78]));"";IF([.G78]=[.H78];"equal";-LOG(ABS([.G78]-[.H78])/MAX(ABS([.G78]);ABS([.H78]));10))) -> equal | L78: of:=IF(OR(ISTEXT([.H78]);ISTEXT([.I78]));"";IF([.H78]=[.I78];"equal";-LOG(ABS([.H78]-[.I78])/MAX(ABS([.H78]);ABS([.I78]));10))) -> equal | M78: of:=IF(OR(ISTEXT([.G78]);ISTEXT([.J78]));"";IF([.G78]=[.J78];"equal";-LOG(ABS([.G78]-[.J78])/MAX(ABS([.G78]);ABS([.J78]));10))) -> equal | N78: Kurata2002,A1
B79: [TMC]_tot | C79: - | D79: - | E79: tmc.c_tot | F79: mM | G79: 0.062 | H79: 0.062 | I79: 0.062 | J79: 0.062 | K79: of:=IF(OR(ISTEXT([.G79]);ISTEXT([.H79]));"";IF([.G79]=[.H79];"equal";-LOG(ABS([.G79]-[.H79])/MAX(ABS([.G79]);ABS([.H79]));10))) -> equal | L79: of:=IF(OR(ISTEXT([.H79]);ISTEXT([.I79]));"";IF([.H79]=[.I79];"equal";-LOG(ABS([.H79]-[.I79])/MAX(ABS([.H79]);ABS([.I79]));10))) -> equal | M79: of:=IF(OR(ISTEXT([.G79]);ISTEXT([.J79]));"";IF([.G79]=[.J79];"equal";-LOG(ABS([.G79]-[.J79])/MAX(ABS([.G79]);ABS([.J79]));10))) -> equal | N79: Kurata2002,A1
B80: [Mg2+]_i | C80: - | D80: - | E80: mg.c_const | F80: mM | G80: 2.5 | H80: 2.5 | I80: 2.5 | J80: 2.5 | K80: of:=IF(OR(ISTEXT([.G80]);ISTEXT([.H80]));"";IF([.G80]=[.H80];"equal";-LOG(ABS([.G80]-[.H80])/MAX(ABS([.G80]);ABS([.H80]));10))) -> equal | L80: of:=IF(OR(ISTEXT([.H80]);ISTEXT([.I80]));"";IF([.H80]=[.I80];"equal";-LOG(ABS([.H80]-[.I80])/MAX(ABS([.H80]);ABS([.I80]));10))) -> equal | M80: of:=IF(OR(ISTEXT([.G80]);ISTEXT([.J80]));"";IF([.G80]=[.J80];"equal";-LOG(ABS([.G80]-[.J80])/MAX(ABS([.G80]);ABS([.J80]));10))) -> equal | N80: Kurata2002,A1
B81: K_rel | C81: - | D81: - | E81: jsr_sub.ka | F81: mM | G81: 0.0012 | H81: 0.0012 | I81: 0.0012 | J81: 0.0012 | K81: of:=IF(OR(ISTEXT([.G81]);ISTEXT([.H81]));"";IF([.G81]=[.H81];"equal";-LOG(ABS([.G81]-[.H81])/MAX(ABS([.G81]);ABS([.H81]));10))) -> equal | L81: of:=IF(OR(ISTEXT([.H81]);ISTEXT([.I81]));"";IF([.H81]=[.I81];"equal";-LOG(ABS([.H81]-[.I81])/MAX(ABS([.H81]);ABS([.I81]));10))) -> equal | M81: of:=IF(OR(ISTEXT([.G81]);ISTEXT([.J81]));"";IF([.G81]=[.J81];"equal";-LOG(ABS([.G81]-[.J81])/MAX(ABS([.G81]);ABS([.J81]));10))) -> equal | N81: Kurata2002,A1
B82: K_up | C82: - | D82: K_up | E82: cyto_nsr.k | F82: mM | G82: 0.0006 | H82: 0.0006 | I82: 0.0006 | J82: 0.0006 | K82: of:=IF(OR(ISTEXT([.G82]);ISTEXT([.H82]));"";IF([.G82]=[.H82];"equal";-LOG(ABS([.G82]-[.H82])/MAX(ABS([.G82]);ABS([.H82]));10))) -> equal | L82: of:=IF(OR(ISTEXT([.H82]);ISTEXT([.I82]));"";IF([.H82]=[.I82];"equal";-LOG(ABS([.H82]-[.I82])/MAX(ABS([.H82]);ABS([.I82]));10))) -> equal | M82: of:=IF(OR(ISTEXT([.G82]);ISTEXT([.J82]));"";IF([.G82]=[.J82];"equal";-LOG(ABS([.G82]-[.J82])/MAX(ABS([.G82]);ABS([.J82]));10))) -> equal | N82: Kurata2002,A1
B83: P_rel | C83: p_rel | D83: P_rel | E83: jsr_sub.p | F83: 1/s | G83: 5000 | H83: 1805.6 | I83: 1805.6 | J83: 1805.6 | K83: of:=IF(OR(ISTEXT([.G83]);ISTEXT([.H83]));"";IF([.G83]=[.H83];"equal";-LOG(ABS([.G83]-[.H83])/MAX(ABS([.G83]);ABS([.H83]));10))) -> 0.194580707149738 | L83: of:=IF(OR(ISTEXT([.H83]);ISTEXT([.I83]));"";IF([.H83]=[.I83];"equal";-LOG(ABS([.H83]-[.I83])/MAX(ABS([.H83]);ABS([.I83]));10))) -> equal | M83: of:=IF(OR(ISTEXT([.G83]);ISTEXT([.J83]));"";IF([.G83]=[.J83];"equal";-LOG(ABS([.G83]-[.J83])/MAX(ABS([.G83]);ABS([.J83]));10))) -> 0.194580707149738 | N83: Kurata2002,A1
B84: P_up | C84: p_up | D84: - | E84: cyto_nsr.p | F84: mM/s | G84: 5 | H84: 5 | I84: 5 | J84: 5 | K84: of:=IF(OR(ISTEXT([.G84]);ISTEXT([.H84]));"";IF([.G84]=[.H84];"equal";-LOG(ABS([.G84]-[.H84])/MAX(ABS([.G84]);ABS([.H84]));10))) -> equal | L84: of:=IF(OR(ISTEXT([.H84]);ISTEXT([.I84]));"";IF([.H84]=[.I84];"equal";-LOG(ABS([.H84]-[.I84])/MAX(ABS([.H84]);ABS([.I84]));10))) -> equal | M84: of:=IF(OR(ISTEXT([.G84]);ISTEXT([.J84]));"";IF([.G84]=[.J84];"equal";-LOG(ABS([.G84]-[.J84])/MAX(ABS([.G84]);ABS([.J84]));10))) -> equal | N84: Kurata2002,A1 | O84: C++ code contains p_up = 0.012, but this variable is never used
B85: tau_diff,Ca | C85: - | D85: - | E85: sub_cyto.tau | F85: s | G85: 0.00004 | H85: 0.00004 | I85: 0.00004 | J85: 0.00004 | K85: of:=IF(OR(ISTEXT([.G85]);ISTEXT([.H85]));"";IF([.G85]=[.H85];"equal";-LOG(ABS([.G85]-[.H85])/MAX(ABS([.G85]);ABS([.H85]));10))) -> equal | L85: of:=IF(OR(ISTEXT([.H85]);ISTEXT([.I85]));"";IF([.H85]=[.I85];"equal";-LOG(ABS([.H85]-[.I85])/MAX(ABS([.H85]);ABS([.I85]));10))) -> equal | M85: of:=IF(OR(ISTEXT([.G85]);ISTEXT([.J85]));"";IF([.G85]=[.J85];"equal";-LOG(ABS([.G85]-[.J85])/MAX(ABS([.G85]);ABS([.J85]));10))) -> equal | N85: Kurata2002,A1
B86: tau_tr | C86: - | D86: tau_tr | E86: nsr_jsr.tau | F86: s | G86: 0.06 | H86: 0.06 | I86: 0.06 | J86: 0.06 | K86: of:=IF(OR(ISTEXT([.G86]);ISTEXT([.H86]));"";IF([.G86]=[.H86];"equal";-LOG(ABS([.G86]-[.H86])/MAX(ABS([.G86]);ABS([.H86]));10))) -> equal | L86: of:=IF(OR(ISTEXT([.H86]);ISTEXT([.I86]));"";IF([.H86]=[.I86];"equal";-LOG(ABS([.H86]-[.I86])/MAX(ABS([.H86]);ABS([.I86]));10))) -> equal | M86: of:=IF(OR(ISTEXT([.G86]);ISTEXT([.J86]));"";IF([.G86]=[.J86];"equal";-LOG(ABS([.G86]-[.J86])/MAX(ABS([.G86]);ABS([.J86]));10))) -> equal | N86: Kurata2002,A1

Sheet: Initial values (AN)
A1: Part | B1: Name (paper) | C1: Name (C++) | D1: Name (CellML) | E1: Name (InaMo) | F1: Unit | G1: Value in paper | H1: Steady state in paper | I1: Value in C++ | J1: Value in CellML | K1: Value in InaMo | L1: Paper = C++ | M1: C++ = CellML | N1: InaMo = CellML | O1: Paper source
A2: Cell | B2: V (init) | C2: vm_1 | D2: V.init | E2: l2.v_init | F2: V | G2: -0.07003 | H2: - | I2: -0.070219 | J2: -0.071554 | K2: - | L2: of:=IF(OR(ISTEXT([.G2]);ISTEXT([.I2]));"";IF([.G2]=[.I2];"equal";-LOG(ABS([.G2]-[.I2])/MAX(ABS([.G2]);ABS([.I2]));10))) -> 2.56999283614299 | M2: of:=IF(OR(ISTEXT([.I2]);ISTEXT([.J2]));"";IF([.I2]=[.J2];"equal";-LOG(ABS([.I2]-[.J2])/MAX(ABS([.I2]);ABS([.J2]));10))) -> 1.72915265093288 | N2: of:=IF(OR(ISTEXT([.G2]);ISTEXT([.K2]));"";IF([.G2]=[.K2];"equal";-LOG(ABS([.G2]-[.K2])/MAX(ABS([.G2]);ABS([.K2]));10))) ->  | O2: Inada2009,S16
A3: I_Na | B3: m (init) | C3: act_na (init) | D3: m.init | E3: act.n.start | F3: 1 | G3: 0.01227 | H3: 0.0127677 | I3: 0.012459 | J3: 0.0104794 | K3: 0.01227 | L3: of:=IF(OR(ISTEXT([.G3]);ISTEXT([.I3]));"";IF([.G3]=[.I3];"equal";-LOG(ABS([.G3]-[.I3])/MAX(ABS([.G3]);ABS([.I3]));10))) -> 1.8190213816563 | M3: of:=IF(OR(ISTEXT([.I3]);ISTEXT([.J3]));"";IF([.I3]=[.J3];"equal";-LOG(ABS([.I3]-[.J3])/MAX(ABS([.I3]);ABS([.J3]));10))) -> 0.798905740690422 | N3: of:=IF(OR(ISTEXT([.G3]);ISTEXT([.K3]));"";IF([.G3]=[.K3];"equal";-LOG(ABS([.G3]-[.K3])/MAX(ABS([.G3]);ABS([.K3]));10))) -> equal | O3: Inada2009,S16
B4: h_2 (init) | C4: slow_inact_na (init) | D4: h2.init | E4: inact_slow.n.start | F4: 1 | G4: 0.6162 | H4: 0.721852 | I4: 0.63777 | J4: 0.788348 | K4: 0.6162 | L4: of:=IF(OR(ISTEXT([.G4]);ISTEXT([.I4]));"";IF([.G4]=[.I4];"equal";-LOG(ABS([.G4]-[.I4])/MAX(ABS([.G4]);ABS([.I4]));10))) -> 1.47081394154964 | M4: of:=IF(OR(ISTEXT([.I4]);ISTEXT([.J4]));"";IF([.I4]=[.J4];"equal";-LOG(ABS([.I4]-[.J4])/MAX(ABS([.I4]);ABS([.J4]));10))) -> 0.718956445699047 | N4: of:=IF(OR(ISTEXT([.G4]);ISTEXT([.K4]));"";IF([.G4]=[.K4];"equal";-LOG(ABS([.G4]-[.K4])/MAX(ABS([.G4]);ABS([.K4]));10))) -> equal | O4: Inada2009,S16
B5: h_1 (init) | C5: fast_inact_na (init) | D5: h1.init | E5: inact_fast.n.start | F5: 1 | G5: 0.717 | H5: 0.721852 | I5: 0.72733 | J5: 0.792211 | K5: 0.717 | L5: of:=IF(OR(ISTEXT([.G5]);ISTEXT([.I5]));"";IF([.G5]=[.I5];"equal";-LOG(ABS([.G5]-[.I5])/MAX(ABS([.G5]);ABS([.I5]));10))) -> 1.84763117965796 | M5: of:=IF(OR(ISTEXT([.I5]);ISTEXT([.J5]));"";IF([.I5]=[.J5];"equal";-LOG(ABS([.I5]-[.J5])/MAX(ABS([.I5]);ABS([.J5]));10))) -> 1.08672333340851 | N5: of:=IF(OR(ISTEXT([.G5]);ISTEXT([.K5]));"";IF([.G5]=[.K5];"equal";-LOG(ABS([.G5]-[.K5])/MAX(ABS([.G5]);ABS([.K5]));10))) -> equal | O5: Inada2009,S16
A6: I_Ca,L | B6: d_L (init) | C6: act_l (init) | D6: d.init | E6: act.n.start | F6: 1 | G6: 0.00004069 | H6: 0.0000406513 | I6: 0.000039525 | J6: 0.0000322867 | K6: 0.00004069 | L6: of:=IF(OR(ISTEXT([.G6]);ISTEXT([.I6]));"";IF([.G6]=[.I6];"equal";-LOG(ABS([.G6]-[.I6])/MAX(ABS([.G6]);ABS([.I6]));10))) -> 1.54316176449125 | M6: of:=IF(OR(ISTEXT([.I6]);ISTEXT([.J6]));"";IF([.I6]=[.J6];"equal";-LOG(ABS([.I6]-[.J6])/MAX(ABS([.I6]);ABS([.J6]));10))) -> 0.737235299604855 | N6: of:=IF(OR(ISTEXT([.G6]);ISTEXT([.K6]));"";IF([.G6]=[.K6];"equal";-LOG(ABS([.G6]-[.K6])/MAX(ABS([.G6]);ABS([.K6]));10))) -> equal | O6: Inada2009,S16
B7: f_L,fast (init) | C7: fast_inact_l (init) | D7: f.init | E7: inact_fast.n.start | F7: 1 | G7: 0.9985 | H7: 0.998502 | I7: 0.99854 | J7: of:=0.998816 -> 0.998816 | K7: 0.9985 | L7: of:=IF(OR(ISTEXT([.G7]);ISTEXT([.I7]));"";IF([.G7]=[.I7];"equal";-LOG(ABS([.G7]-[.I7])/MAX(ABS([.G7]);ABS([.I7]));10))) -> 4.39730547540715 | M7: of:=IF(OR(ISTEXT([.I7]);ISTEXT([.J7]));"";IF([.I7]=[.J7];"equal";-LOG(ABS([.I7]-[.J7])/MAX(ABS([.I7]);ABS([.J7]));10))) -> 3.55857640861847 | N7: of:=IF(OR(ISTEXT([.G7]);ISTEXT([.K7]));"";IF([.G7]=[.K7];"equal";-LOG(ABS([.G7]-[.K7])/MAX(ABS([.G7]);ABS([.K7]));10))) -> equal | O7: Inada2009,S16
B8: f_L,slow (init) | C8: slow_inact_l (init) | D8: f2.init | E8: inact_slow.n.start | F8: 1 | G8: 0.9875 | H8: 0.998502 | I8: 0.99111 | J8: 0.998822 | K8: 0.9875 | L8: of:=IF(OR(ISTEXT([.G8]);ISTEXT([.I8]));"";IF([.G8]=[.I8];"equal";-LOG(ABS([.G8]-[.I8])/MAX(ABS([.G8]);ABS([.I8]));10))) -> 2.43861465615364 | M8: of:=IF(OR(ISTEXT([.I8]);ISTEXT([.J8]));"";IF([.I8]=[.J8];"equal";-LOG(ABS([.I8]-[.J8])/MAX(ABS([.I8]);ABS([.J8]));10))) -> 2.11232107863694 | N8: of:=IF(OR(ISTEXT([.G8]);ISTEXT([.K8]));"";IF([.G8]=[.K8];"equal";-LOG(ABS([.G8]-[.K8])/MAX(ABS([.G8]);ABS([.K8]));10))) -> equal | O8: Inada2009,S16
A9: I_to | B9: r (init) | C9: act_to (init) | D9: r.init | E9: act.n.start | F9: 1 | G9: 0.008857 | H9: 0.00880335 | I9: 0.0087042 | J9: 0.00802881 | K9: 0.008857 | L9: of:=IF(OR(ISTEXT([.G9]);ISTEXT([.I9]));"";IF([.G9]=[.I9];"equal";-LOG(ABS([.G9]-[.I9])/MAX(ABS([.G9]);ABS([.I9]));10))) -> 1.76316329043813 | M9: of:=IF(OR(ISTEXT([.I9]);ISTEXT([.J9]));"";IF([.I9]=[.J9];"equal";-LOG(ABS([.I9]-[.J9])/MAX(ABS([.I9]);ABS([.J9]));10))) -> 1.11017423536257 | N9: of:=IF(OR(ISTEXT([.G9]);ISTEXT([.K9]));"";IF([.G9]=[.K9];"equal";-LOG(ABS([.G9]-[.K9])/MAX(ABS([.G9]);ABS([.K9]));10))) -> equal | O9: Inada2009,S16
B10: q_fast (init) | C10: fast_inact_to (init) | D10: q_fast.init | E10: inact_fast.n.start | F10: 1 | G10: 0.8734 | H10: 0.997322 | I10: 0.8847 | J10: 0.995494 | K10: 0.8734 | L10: of:=IF(OR(ISTEXT([.G10]);ISTEXT([.I10]));"";IF([.G10]=[.I10];"equal";-LOG(ABS([.G10]-[.I10])/MAX(ABS([.G10]);ABS([.I10]));10))) -> 1.89371758378804 | M10: of:=IF(OR(ISTEXT([.I10]);ISTEXT([.J10]));"";IF([.I10]=[.J10];"equal";-LOG(ABS([.I10]-[.J10])/MAX(ABS([.I10]);ABS([.J10]));10))) -> 0.953522404805794 | N10: of:=IF(OR(ISTEXT([.G10]);ISTEXT([.K10]));"";IF([.G10]=[.K10];"equal";-LOG(ABS([.G10]-[.K10])/MAX(ABS([.G10]);ABS([.K10]));10))) -> equal | O10: Inada2009,S16
B11: q_slow (init) | C11: slow_inact_to (init) | D11: q_slow.init | E11: inact_slow.n.start | F11: 1 | G11: 0.1503 | H11: 0.997322 | I11: 0.20263 | J11: 0.547967 | K11: 0.1503 | L11: of:=IF(OR(ISTEXT([.G11]);ISTEXT([.I11]));"";IF([.G11]=[.I11];"equal";-LOG(ABS([.G11]-[.I11])/MAX(ABS([.G11]);ABS([.I11]));10))) -> 0.587953009689975 | M11: of:=IF(OR(ISTEXT([.I11]);ISTEXT([.J11]));"";IF([.I11]=[.J11];"equal";-LOG(ABS([.I11]-[.J11])/MAX(ABS([.I11]);ABS([.J11]));10))) -> 0.200511293027077 | N11: of:=IF(OR(ISTEXT([.G11]);ISTEXT([.K11]));"";IF([.G11]=[.K11];"equal";-LOG(ABS([.G11]-[.K11])/MAX(ABS([.G11]);ABS([.K11]));10))) -> equal | O11: Inada2009,S16
A12: I_K,r | B12: p_a,slow (init) | C12: slow_act_kr (init) | D12: pas.init | E12: act_slow.n.start | F12: 1 | G12: 0.0484 | H12: 0.000878452 | I12: 0.034731 | J12: 0.00289901 | K12: 0.0484 | L12: of:=IF(OR(ISTEXT([.G12]);ISTEXT([.I12]));"";IF([.G12]=[.I12];"equal";-LOG(ABS([.G12]-[.I12])/MAX(ABS([.G12]);ABS([.I12]));10))) -> 0.549108618134939 | M12: of:=IF(OR(ISTEXT([.I12]);ISTEXT([.J12]));"";IF([.I12]=[.J12];"equal";-LOG(ABS([.I12]-[.J12])/MAX(ABS([.I12]);ABS([.J12]));10))) -> 0.0378534983057115 | N12: of:=IF(OR(ISTEXT([.G12]);ISTEXT([.K12]));"";IF([.G12]=[.K12];"equal";-LOG(ABS([.G12]-[.K12])/MAX(ABS([.G12]);ABS([.K12]));10))) -> equal | O12: Inada2009,S16
B13: p_a,fast (init) | C13: fast_act_kr (init) | D13: paf.init | E13: act_fast.n.start | F13: 1 | G13: 0.07107 | H13: 0.000878452 | I13: 0.034731 | J13: 0.000907827 | K13: 0.07107 | L13: of:=IF(OR(ISTEXT([.G13]);ISTEXT([.I13]));"";IF([.G13]=[.I13];"equal";-LOG(ABS([.G13]-[.I13])/MAX(ABS([.G13]);ABS([.I13]));10))) -> 0.291313343501162 | M13: of:=IF(OR(ISTEXT([.I13]);ISTEXT([.J13]));"";IF([.I13]=[.J13];"equal";-LOG(ABS([.I13]-[.J13])/MAX(ABS([.I13]);ABS([.J13]));10))) -> 0.0115029410543736 | N13: of:=IF(OR(ISTEXT([.G13]);ISTEXT([.K13]));"";IF([.G13]=[.K13];"equal";-LOG(ABS([.G13]-[.K13])/MAX(ABS([.G13]);ABS([.K13]));10))) -> equal | O13: Inada2009,S16
B14: p_i (init) | C14: inact_kr (init) | D14: pik.init | E14: inact.n.start | F14: 1 | G14: 0.9866 | H14: 0.986621 | I14: 0.98678 | J14: 0.98789 | K14: 0.9866 | L14: of:=IF(OR(ISTEXT([.G14]);ISTEXT([.I14]));"";IF([.G14]=[.I14];"equal";-LOG(ABS([.G14]-[.I14])/MAX(ABS([.G14]);ABS([.I14]));10))) -> 3.73894783354824 | M14: of:=IF(OR(ISTEXT([.I14]);ISTEXT([.J14]));"";IF([.I14]=[.J14];"equal";-LOG(ABS([.I14]-[.J14])/MAX(ABS([.I14]);ABS([.J14]));10))) -> 2.94938561048455 | N14: of:=IF(OR(ISTEXT([.G14]);ISTEXT([.K14]));"";IF([.G14]=[.K14];"equal";-LOG(ABS([.G14]-[.K14])/MAX(ABS([.G14]);ABS([.K14]));10))) -> equal | O14: Inada2009,S16
A15: I_f | B15: y (init) | C15: act_f | D15: y.init | E15: act.n.start | F15: 1 | G15: - | H15: - | I15: - | J15: 0.231893 | K15: - | L15: of:=IF(OR(ISTEXT([.G15]);ISTEXT([.I15]));"";IF([.G15]=[.I15];"equal";-LOG(ABS([.G15]-[.I15])/MAX(ABS([.G15]);ABS([.I15]));10))) ->  | M15: of:=IF(OR(ISTEXT([.I15]);ISTEXT([.J15]));"";IF([.I15]=[.J15];"equal";-LOG(ABS([.I15]-[.J15])/MAX(ABS([.I15]);ABS([.J15]));10))) ->  | N15: of:=IF(OR(ISTEXT([.G15]);ISTEXT([.K15]));"";IF([.G15]=[.K15];"equal";-LOG(ABS([.G15]-[.K15])/MAX(ABS([.G15]);ABS([.K15]));10))) ->  | O15: Inada2009,S16
A16: I_st | B16: q_a (init) | C16: act_st | D16: qa.init | E16: act.n.start | F16: 1 | G16: - | H16: - | I16: - | J16: 0.0758461 | K16: - | L16: of:=IF(OR(ISTEXT([.G16]);ISTEXT([.I16]));"";IF([.G16]=[.I16];"equal";-LOG(ABS([.G16]-[.I16])/MAX(ABS([.G16]);ABS([.I16]));10))) ->  | M16: of:=IF(OR(ISTEXT([.I16]);ISTEXT([.J16]));"";IF([.I16]=[.J16];"equal";-LOG(ABS([.I16]-[.J16])/MAX(ABS([.I16]);ABS([.J16]));10))) ->  | N16: of:=IF(OR(ISTEXT([.G16]);ISTEXT([.K16]));"";IF([.G16]=[.K16];"equal";-LOG(ABS([.G16]-[.K16])/MAX(ABS([.G16]);ABS([.K16]));10))) ->  | O16: Inada2009,S16
B17: q_i (init) | C17: inact_st | D17: qi.init | E17: inact.n.start | F17: 1 | G17: - | H17: - | I17: - | J17: 0.943346 | K17: - | L17: of:=IF(OR(ISTEXT([.G17]);ISTEXT([.I17]));"";IF([.G17]=[.I17];"equal";-LOG(ABS([.G17]-[.I17])/MAX(ABS([.G17]);ABS([.I17]));10))) ->  | M17: of:=IF(OR(ISTEXT([.I17]);ISTEXT([.J17]));"";IF([.I17]=[.J17];"equal";-LOG(ABS([.I17]-[.J17])/MAX(ABS([.I17]);ABS([.J17]));10))) ->  | N17: of:=IF(OR(ISTEXT([.G17]);ISTEXT([.K17]));"";IF([.G17]=[.K17];"equal";-LOG(ABS([.G17]-[.K17])/MAX(ABS([.G17]);ABS([.K17]));10))) ->  | O17: Inada2009,S16
A18: CaHandling | B18: [Ca2+]_i (init) | C18: ca_in (init) | D18: Cai.init | E18: cyto.c_start | F18: mM | G18: 0.0001206 | H18: - | I18: of:=['Parameters (AN)'.H7] -> 0.00010817 | J18: 0.000031043 | K18: 0.0001206 | L18: of:=IF(OR(ISTEXT([.G18]);ISTEXT([.I18]));"";IF([.G18]=[.I18];"equal";-LOG(ABS([.G18]-[.I18])/MAX(ABS([.G18]);ABS([.I18]));10))) -> 0.986876179162488 | M18: of:=IF(OR(ISTEXT([.I18]);ISTEXT([.J18]));"";IF([.I18]=[.J18];"equal";-LOG(ABS([.I18]-[.J18])/MAX(ABS([.I18]);ABS([.J18]));10))) -> 0.146900390718833 | N18: of:=IF(OR(ISTEXT([.G18]);ISTEXT([.K18]));"";IF([.G18]=[.K18];"equal";-LOG(ABS([.G18]-[.K18])/MAX(ABS([.G18]);ABS([.K18]));10))) -> equal | O18: Inada2009,S16
B19: [Ca2+]_sub (init) | C19: ca_sub (init) | D19: Casub.init | E19: sub.c_start | F19: mM | G19: 0.00006397 | H19: - | I19: 0.0000586 | J19: 0.0000286963 | K19: 0.00006397 | L19: of:=IF(OR(ISTEXT([.G19]);ISTEXT([.I19]));"";IF([.G19]=[.I19];"equal";-LOG(ABS([.G19]-[.I19])/MAX(ABS([.G19]);ABS([.I19]));10))) -> 1.07600206501801 | M19: of:=IF(OR(ISTEXT([.I19]);ISTEXT([.J19]));"";IF([.I19]=[.J19];"equal";-LOG(ABS([.I19]-[.J19])/MAX(ABS([.I19]);ABS([.J19]));10))) -> 0.292172688892045 | N19: of:=IF(OR(ISTEXT([.G19]);ISTEXT([.K19]));"";IF([.G19]=[.K19];"equal";-LOG(ABS([.G19]-[.K19])/MAX(ABS([.G19]);ABS([.K19]));10))) -> equal | O19: Inada2009,S16
B20: [Ca2+]_rel (init) | C20: ca_rel (init) | D20: Ca_rel | E20: jsr.c_start | F20: mM | G20: 0.4273 | H20: - | I20: 0.40019 | J20: 0.557459 | K20: 0.4273 | L20: of:=IF(OR(ISTEXT([.G20]);ISTEXT([.I20]));"";IF([.G20]=[.I20];"equal";-LOG(ABS([.G20]-[.I20])/MAX(ABS([.G20]);ABS([.I20]));10))) -> 1.19760337523671 | M20: of:=IF(OR(ISTEXT([.I20]);ISTEXT([.J20]));"";IF([.I20]=[.J20];"equal";-LOG(ABS([.I20]-[.J20])/MAX(ABS([.I20]);ABS([.J20]));10))) -> 0.549569806079521 | N20: of:=IF(OR(ISTEXT([.G20]);ISTEXT([.K20]));"";IF([.G20]=[.K20];"equal";-LOG(ABS([.G20]-[.K20])/MAX(ABS([.G20]);ABS([.K20]));10))) -> equal | O20: Inada2009,S16
B21: [Ca2+]_up (init) | C21: ca_up (init) | D21: Ca_up | E21: nsr.c_start | F21: mM | G21: 1.068 | H21: - | I21: 0.95955 | J21: 0.667221 | K21: 1.068 | L21: of:=IF(OR(ISTEXT([.G21]);ISTEXT([.I21]));"";IF([.G21]=[.I21];"equal";-LOG(ABS([.G21]-[.I21])/MAX(ABS([.G21]);ABS([.I21]));10))) -> 0.993341696342325 | M21: of:=IF(OR(ISTEXT([.I21]);ISTEXT([.J21]));"";IF([.I21]=[.J21];"equal";-LOG(ABS([.I21]-[.J21])/MAX(ABS([.I21]);ABS([.J21]));10))) -> 0.516195708835087 | N21: of:=IF(OR(ISTEXT([.G21]);ISTEXT([.K21]));"";IF([.G21]=[.K21];"equal";-LOG(ABS([.G21]-[.K21])/MAX(ABS([.G21]);ABS([.K21]));10))) -> equal | O21: Inada2009,S16
B22: f_TC (init) | C22: f_tc (init) | D22: f_TC | E22: tc.f_start | F22: 1 | G22: 0.02359 | H22: 0.0234488 | I22: 0.021203 | J22: 0.00615578 | K22: 0.02359 | L22: of:=IF(OR(ISTEXT([.G22]);ISTEXT([.I22]));"";IF([.G22]=[.I22];"equal";-LOG(ABS([.G22]-[.I22])/MAX(ABS([.G22]);ABS([.I22]));10))) -> 0.994875521878841 | M22: of:=IF(OR(ISTEXT([.I22]);ISTEXT([.J22]));"";IF([.I22]=[.J22];"equal";-LOG(ABS([.I22]-[.J22])/MAX(ABS([.I22]);ABS([.J22]));10))) -> 0.148941042665209 | N22: of:=IF(OR(ISTEXT([.G22]);ISTEXT([.K22]));"";IF([.G22]=[.K22];"equal";-LOG(ABS([.G22]-[.K22])/MAX(ABS([.G22]);ABS([.K22]));10))) -> equal | O22: Inada2009,S16
B23: f_TMC (init) | C23: f_tmc (init) | D23: f_TMC | E23: tmc.f_start | F23: 1 | G23: 0.3667 | H23: 0.298824 | I23: 0.33949 | J23: 0.112201 | K23: 0.3667 | L23: of:=IF(OR(ISTEXT([.G23]);ISTEXT([.I23]));"";IF([.G23]=[.I23];"equal";-LOG(ABS([.G23]-[.I23])/MAX(ABS([.G23]);ABS([.I23]));10))) -> 1.12958236818084 | M23: of:=IF(OR(ISTEXT([.I23]);ISTEXT([.J23]));"";IF([.I23]=[.J23];"equal";-LOG(ABS([.I23]-[.J23])/MAX(ABS([.I23]);ABS([.J23]));10))) -> 0.174248568363425 | N23: of:=IF(OR(ISTEXT([.G23]);ISTEXT([.K23]));"";IF([.G23]=[.K23];"equal";-LOG(ABS([.G23]-[.K23])/MAX(ABS([.G23]);ABS([.K23]));10))) -> equal | O23: Inada2009,S16
B24: f_TMM (init) | C24: f_tmm (init) | D24: f_TMM | E24: tmm.f_start | F24: 1 | G24: 0.5594 | H24: 0.619453 | I24: 0.58343 | J24: 0.78431 | K24: 0.5594 | L24: of:=IF(OR(ISTEXT([.G24]);ISTEXT([.I24]));"";IF([.G24]=[.I24];"equal";-LOG(ABS([.G24]-[.I24])/MAX(ABS([.G24]);ABS([.I24]));10))) -> 1.38523498600012 | M24: of:=IF(OR(ISTEXT([.I24]);ISTEXT([.J24]));"";IF([.I24]=[.J24];"equal";-LOG(ABS([.I24]-[.J24])/MAX(ABS([.I24]);ABS([.J24]));10))) -> 0.591551052621472 | N24: of:=IF(OR(ISTEXT([.G24]);ISTEXT([.K24]));"";IF([.G24]=[.K24];"equal";-LOG(ABS([.G24]-[.K24])/MAX(ABS([.G24]);ABS([.K24]));10))) -> equal | O24: Inada2009,S16
B25: f_CM_i (init) | C25: f_cmi (init) | D25: f_CMi | E25: cm_cyto.f_start | F25: 1 | G25: 0.04845 | H25: 0.0482222 | I25: 0.043662 | J25: 0.0128957 | K25: 0.04845 | L25: of:=IF(OR(ISTEXT([.G25]);ISTEXT([.I25]));"";IF([.G25]=[.I25];"equal";-LOG(ABS([.G25]-[.I25])/MAX(ABS([.G25]);ABS([.I25]));10))) -> 1.00513963965241 | M25: of:=IF(OR(ISTEXT([.I25]);ISTEXT([.J25]));"";IF([.I25]=[.J25];"equal";-LOG(ABS([.I25]-[.J25])/MAX(ABS([.I25]);ABS([.J25]));10))) -> 0.152028354803578 | N25: of:=IF(OR(ISTEXT([.G25]);ISTEXT([.K25]));"";IF([.G25]=[.K25];"equal";-LOG(ABS([.G25]-[.K25])/MAX(ABS([.G25]);ABS([.K25]));10))) -> equal | O25: Inada2009,S16
B26: f_CM_s (init) | C26: f_cms (init) | D26: f_CMs | E26: cm_sub.f_start | F26: 1 | G26: 0.02626 | H26: 0.0261711 | I26: 0.024102 | J26: 0.0119202 | K26: 0.02626 | L26: of:=IF(OR(ISTEXT([.G26]);ISTEXT([.I26]));"";IF([.G26]=[.I26];"equal";-LOG(ABS([.G26]-[.I26])/MAX(ABS([.G26]);ABS([.I26]));10))) -> 1.08524328140657 | M26: of:=IF(OR(ISTEXT([.I26]);ISTEXT([.J26]));"";IF([.I26]=[.J26];"equal";-LOG(ABS([.I26]-[.J26])/MAX(ABS([.I26]);ABS([.J26]));10))) -> 0.296341617109935 | N26: of:=IF(OR(ISTEXT([.G26]);ISTEXT([.K26]));"";IF([.G26]=[.K26];"equal";-LOG(ABS([.G26]-[.K26])/MAX(ABS([.G26]);ABS([.K26]));10))) -> equal | O26: Inada2009,S16
B27: f_CQ (init) | C27: f_cq (init) | D27: f_CQ | E27: cq.f_start | F27: 1 | G27: 0.3379 | H27: 0.338957 | I27: 0.32345 | J27: 0.400684 | K27: 0.3379 | L27: of:=IF(OR(ISTEXT([.G27]);ISTEXT([.I27]));"";IF([.G27]=[.I27];"equal";-LOG(ABS([.G27]-[.I27])/MAX(ABS([.G27]);ABS([.I27]));10))) -> 1.36892034468233 | M27: of:=IF(OR(ISTEXT([.I27]);ISTEXT([.J27]));"";IF([.I27]=[.J27];"equal";-LOG(ABS([.I27]-[.J27])/MAX(ABS([.I27]);ABS([.J27]));10))) -> 0.714993472835075 | N27: of:=IF(OR(ISTEXT([.G27]);ISTEXT([.K27]));"";IF([.G27]=[.K27];"equal";-LOG(ABS([.G27]-[.K27])/MAX(ABS([.G27]);ABS([.K27]));10))) -> equal | O27: Inada2009,S16
B28: f_CSL (init) | C28: f_csl (init) | D28: f_CSL | E28: cm_sl.f_start | F28: 1 | G28: 0.00003936 | H28: 0.0000073565 | I28: 0.000030851 | J28: 0.00000891124 | K28: 0.00003936 | L28: of:=IF(OR(ISTEXT([.G28]);ISTEXT([.I28]));"";IF([.G28]=[.I28];"equal";-LOG(ABS([.G28]-[.I28])/MAX(ABS([.G28]);ABS([.I28]));10))) -> 0.66517656610252 | M28: of:=IF(OR(ISTEXT([.I28]);ISTEXT([.J28]));"";IF([.I28]=[.J28];"equal";-LOG(ABS([.I28]-[.J28])/MAX(ABS([.I28]);ABS([.J28]));10))) -> 0.148037373259791 | N28: of:=IF(OR(ISTEXT([.G28]);ISTEXT([.K28]));"";IF([.G28]=[.K28];"equal";-LOG(ABS([.G28]-[.K28])/MAX(ABS([.G28]);ABS([.K28]));10))) -> equal | O28: Inada2009,S16

Sheet: Initial values (N)
A1: Part | B1: Name (paper) | C1: Name (C++) | D1: Name (CellML) | E1: Name (InaMo) | F1: Unit | G1: Value in paper | H1: Steady state in paper | I1: Value in C++ | J1: Value in CellML | K1: Value in InaMo | L1: Paper = C++ | M1: C++ = CellML | N1: InaMo = CellML | O1: Paper source
A2: Cell | B2: V (init) | C2: vm_1 | D2: V.init | E2: l2.v_init | F2: V | G2: of:=-0.06213 -> -0.06213 | H2: - | I2: -0.062132 | J2: -0.0497094 | K2: - | L2: of:=IF(OR(ISTEXT([.G2]);ISTEXT([.I2]));"";IF([.G2]=[.I2];"equal";-LOG(ABS([.G2]-[.I2])/MAX(ABS([.G2]);ABS([.I2]));10))) -> 4.49228533790981 | M2: of:=IF(OR(ISTEXT([.I2]);ISTEXT([.J2]));"";IF([.I2]=[.J2];"equal";-LOG(ABS([.I2]-[.J2])/MAX(ABS([.I2]);ABS([.J2]));10))) -> 0.699102832139479 | N2: of:=IF(OR(ISTEXT([.G2]);ISTEXT([.K2]));"";IF([.G2]=[.K2];"equal";-LOG(ABS([.G2]-[.K2])/MAX(ABS([.G2]);ABS([.K2]));10))) ->  | O2: Inada2009,S16
A3: I_Na | B3: m (init) | C3: act_na (init) | D3: m.init | E3: act.n.start | F3: 1 | G3: - | H3: - | I3: - | J3: 0.143642 | K3: - | L3: of:=IF(OR(ISTEXT([.G3]);ISTEXT([.I3]));"";IF([.G3]=[.I3];"equal";-LOG(ABS([.G3]-[.I3])/MAX(ABS([.G3]);ABS([.I3]));10))) ->  | M3: of:=IF(OR(ISTEXT([.I3]);ISTEXT([.J3]));"";IF([.I3]=[.J3];"equal";-LOG(ABS([.I3]-[.J3])/MAX(ABS([.I3]);ABS([.J3]));10))) ->  | N3: of:=IF(OR(ISTEXT([.G3]);ISTEXT([.K3]));"";IF([.G3]=[.K3];"equal";-LOG(ABS([.G3]-[.K3])/MAX(ABS([.G3]);ABS([.K3]));10))) ->  | O3: Inada2009,S16
B4: h_2 (init) | C4: slow_inact_na (init) | D4: h2.init | E4: inact_slow.n.start | F4: 1 | G4: - | H4: - | I4: - | J4: 0.0157156 | K4: - | L4: of:=IF(OR(ISTEXT([.G4]);ISTEXT([.I4]));"";IF([.G4]=[.I4];"equal";-LOG(ABS([.G4]-[.I4])/MAX(ABS([.G4]);ABS([.I4]));10))) ->  | M4: of:=IF(OR(ISTEXT([.I4]);ISTEXT([.J4]));"";IF([.I4]=[.J4];"equal";-LOG(ABS([.I4]-[.J4])/MAX(ABS([.I4]);ABS([.J4]));10))) ->  | N4: of:=IF(OR(ISTEXT([.G4]);ISTEXT([.K4]));"";IF([.G4]=[.K4];"equal";-LOG(ABS([.G4]-[.K4])/MAX(ABS([.G4]);ABS([.K4]));10))) ->  | O4: Inada2009,S16
B5: h_1 (init) | C5: fast_inact_na (init) | D5: h1.init | E5: inact_fast.n.start | F5: 1 | G5: - | H5: - | I5: - | J5: 0.024321 | K5: - | L5: of:=IF(OR(ISTEXT([.G5]);ISTEXT([.I5]));"";IF([.G5]=[.I5];"equal";-LOG(ABS([.G5]-[.I5])/MAX(ABS([.G5]);ABS([.I5]));10))) ->  | M5: of:=IF(OR(ISTEXT([.I5]);ISTEXT([.J5]));"";IF([.I5]=[.J5];"equal";-LOG(ABS([.I5]-[.J5])/MAX(ABS([.I5]);ABS([.J5]));10))) ->  | N5: of:=IF(OR(ISTEXT([.G5]);ISTEXT([.K5]));"";IF([.G5]=[.K5];"equal";-LOG(ABS([.G5]-[.K5])/MAX(ABS([.G5]);ABS([.K5]));10))) ->  | O5: Inada2009,S16
A6: I_Ca,L | B6: d_L (init) | C6: act_l (init) | D6: d.init | E6: act.n.start | F6: 1 | G6: 0.0001533 | H6: 0.000134303 | I6: 0.0001534 | J6: 0.0017925 | K6: 0.0001533 | L6: of:=IF(OR(ISTEXT([.G6]);ISTEXT([.I6]));"";IF([.G6]=[.I6];"equal";-LOG(ABS([.G6]-[.I6])/MAX(ABS([.G6]);ABS([.I6]));10))) -> 3.18582535961307 | M6: of:=IF(OR(ISTEXT([.I6]);ISTEXT([.J6]));"";IF([.I6]=[.J6];"equal";-LOG(ABS([.I6]-[.J6])/MAX(ABS([.I6]);ABS([.J6]));10))) -> 0.0388537140497732 | N6: of:=IF(OR(ISTEXT([.G6]);ISTEXT([.K6]));"";IF([.G6]=[.K6];"equal";-LOG(ABS([.G6]-[.K6])/MAX(ABS([.G6]);ABS([.K6]));10))) -> equal | O6: Inada2009,S16
B7: f_L,fast (init) | C7: fast_inact_l (init) | D7: f.init | E7: inact_fast.n.start | F7: 1 | G7: 0.6861 | H7: 0.994782 | I7: 0.68093 | J7: 0.97555 | K7: 0.6861 | L7: of:=IF(OR(ISTEXT([.G7]);ISTEXT([.I7]));"";IF([.G7]=[.I7];"equal";-LOG(ABS([.G7]-[.I7])/MAX(ABS([.G7]);ABS([.I7]));10))) -> 2.12289687623247 | M7: of:=IF(OR(ISTEXT([.I7]);ISTEXT([.J7]));"";IF([.I7]=[.J7];"equal";-LOG(ABS([.I7]-[.J7])/MAX(ABS([.I7]);ABS([.J7]));10))) -> 0.519987308079134 | N7: of:=IF(OR(ISTEXT([.G7]);ISTEXT([.K7]));"";IF([.G7]=[.K7];"equal";-LOG(ABS([.G7]-[.K7])/MAX(ABS([.G7]);ABS([.K7]));10))) -> equal | O7: Inada2009,S16
B8: f_L,slow (init) | C8: slow_inact_l (init) | D8: f2.init | E8: inact_slow.n.start | F8: 1 | G8: 0.4441 | H8: 0.994782 | I8: 0.33202 | J8: 0.774394 | K8: 0.4441 | L8: of:=IF(OR(ISTEXT([.G8]);ISTEXT([.I8]));"";IF([.G8]=[.I8];"equal";-LOG(ABS([.G8]-[.I8])/MAX(ABS([.G8]);ABS([.I8]));10))) -> 0.597952650895958 | M8: of:=IF(OR(ISTEXT([.I8]);ISTEXT([.J8]));"";IF([.I8]=[.J8];"equal";-LOG(ABS([.I8]-[.J8])/MAX(ABS([.I8]);ABS([.J8]));10))) -> 0.24317238549169 | N8: of:=IF(OR(ISTEXT([.G8]);ISTEXT([.K8]));"";IF([.G8]=[.K8];"equal";-LOG(ABS([.G8]-[.K8])/MAX(ABS([.G8]);ABS([.K8]));10))) -> equal | O8: Inada2009,S16
A9: I_to | B9: r (init) | C9: act_to (init) | D9: r.init | E9: act.n.start | F9: 1 | G9: - | H9: - | I9: - | J9: 0.0296517 | K9: - | L9: of:=IF(OR(ISTEXT([.G9]);ISTEXT([.I9]));"";IF([.G9]=[.I9];"equal";-LOG(ABS([.G9]-[.I9])/MAX(ABS([.G9]);ABS([.I9]));10))) ->  | M9: of:=IF(OR(ISTEXT([.I9]);ISTEXT([.J9]));"";IF([.I9]=[.J9];"equal";-LOG(ABS([.I9]-[.J9])/MAX(ABS([.I9]);ABS([.J9]));10))) ->  | N9: of:=IF(OR(ISTEXT([.G9]);ISTEXT([.K9]));"";IF([.G9]=[.K9];"equal";-LOG(ABS([.G9]-[.K9])/MAX(ABS([.G9]);ABS([.K9]));10))) ->  | O9: Inada2009,S16
B10: q_fast (init) | C10: fast_inact_to (init) | D10: q_fast.init | E10: inact_fast.n.start | F10: 1 | G10: - | H10: - | I10: - | J10: 0.899732 | K10: - | L10: of:=IF(OR(ISTEXT([.G10]);ISTEXT([.I10]));"";IF([.G10]=[.I10];"equal";-LOG(ABS([.G10]-[.I10])/MAX(ABS([.G10]);ABS([.I10]));10))) ->  | M10: of:=IF(OR(ISTEXT([.I10]);ISTEXT([.J10]));"";IF([.I10]=[.J10];"equal";-LOG(ABS([.I10]-[.J10])/MAX(ABS([.I10]);ABS([.J10]));10))) ->  | N10: of:=IF(OR(ISTEXT([.G10]);ISTEXT([.K10]));"";IF([.G10]=[.K10];"equal";-LOG(ABS([.G10]-[.K10])/MAX(ABS([.G10]);ABS([.K10]));10))) ->  | O10: Inada2009,S16
B11: q_slow (init) | C11: slow_inact_to (init) | D11: q_slow.init | E11: inact_slow.n.start | F11: 1 | G11: - | H11: - | I11: - | J11: 0.190112 | K11: - | L11: of:=IF(OR(ISTEXT([.G11]);ISTEXT([.I11]));"";IF([.G11]=[.I11];"equal";-LOG(ABS([.G11]-[.I11])/MAX(ABS([.G11]);ABS([.I11]));10))) ->  | M11: of:=IF(OR(ISTEXT([.I11]);ISTEXT([.J11]));"";IF([.I11]=[.J11];"equal";-LOG(ABS([.I11]-[.J11])/MAX(ABS([.I11]);ABS([.J11]));10))) ->  | N11: of:=IF(OR(ISTEXT([.G11]);ISTEXT([.K11]));"";IF([.G11]=[.K11];"equal";-LOG(ABS([.G11]-[.K11])/MAX(ABS([.G11]);ABS([.K11]));10))) ->  | O11: Inada2009,S16
A12: I_K,r | B12: p_a,slow (init) | C12: slow_act_kr (init) | D12: pas.init | E12: act_slow.n.start | F12: 1 | G12: 0.1287 | H12: 0.00222214 | I12: 0.12876 | J12: 0.0797183 | K12: 0.1287 | L12: of:=IF(OR(ISTEXT([.G12]);ISTEXT([.I12]));"";IF([.G12]=[.I12];"equal";-LOG(ABS([.G12]-[.I12])/MAX(ABS([.G12]);ABS([.I12]));10))) -> 3.3316297176299 | M12: of:=IF(OR(ISTEXT([.I12]);ISTEXT([.J12]));"";IF([.I12]=[.J12];"equal";-LOG(ABS([.I12]-[.J12])/MAX(ABS([.I12]);ABS([.J12]));10))) -> 0.419215451694434 | N12: of:=IF(OR(ISTEXT([.G12]);ISTEXT([.K12]));"";IF([.G12]=[.K12];"equal";-LOG(ABS([.G12]-[.K12])/MAX(ABS([.G12]);ABS([.K12]));10))) -> equal | O12: Inada2009,S16
B13: p_a,fast (init) | C13: fast_act_kr (init) | D13: paf.init | E13: act_fast.n.start | F13: 1 | G13: 0.6067 | H13: 0.00222214 | I13: 0.60607 | J13: 0.192515 | K13: 0.6067 | L13: of:=IF(OR(ISTEXT([.G13]);ISTEXT([.I13]));"";IF([.G13]=[.I13];"equal";-LOG(ABS([.G13]-[.I13])/MAX(ABS([.G13]);ABS([.I13]));10))) -> 2.98363344549045 | M13: of:=IF(OR(ISTEXT([.I13]);ISTEXT([.J13]));"";IF([.I13]=[.J13];"equal";-LOG(ABS([.I13]-[.J13])/MAX(ABS([.I13]);ABS([.J13]));10))) -> 0.165989511358841 | N13: of:=IF(OR(ISTEXT([.G13]);ISTEXT([.K13]));"";IF([.G13]=[.K13];"equal";-LOG(ABS([.G13]-[.K13])/MAX(ABS([.G13]);ABS([.K13]));10))) -> equal | O13: Inada2009,S16
B14: p_i (init) | C14: inact_kr (init) | D14: pik.init | E14: inact.n.start | F14: 1 | G14: 0.9775 | H14: 0.977558 | I14: 0.97752 | J14: 0.949023 | K14: 0.9775 | L14: of:=IF(OR(ISTEXT([.G14]);ISTEXT([.I14]));"";IF([.G14]=[.I14];"equal";-LOG(ABS([.G14]-[.I14])/MAX(ABS([.G14]);ABS([.I14]));10))) -> 4.6890956561356 | M14: of:=IF(OR(ISTEXT([.I14]);ISTEXT([.J14]));"";IF([.I14]=[.J14];"equal";-LOG(ABS([.I14]-[.J14])/MAX(ABS([.I14]);ABS([.J14]));10))) -> 1.53532650940395 | N14: of:=IF(OR(ISTEXT([.G14]);ISTEXT([.K14]));"";IF([.G14]=[.K14];"equal";-LOG(ABS([.G14]-[.K14])/MAX(ABS([.G14]);ABS([.K14]));10))) -> equal | O14: Inada2009,S16
A15: I_f | B15: y (init) | C15: act_f | D15: y.init | E15: act.n.start | F15: 1 | G15: 0.03825 | H15: 0.174639 | I15: 0.038225 | J15: 0.0462303 | K15: 0.03825 | L15: of:=IF(OR(ISTEXT([.G15]);ISTEXT([.I15]));"";IF([.G15]=[.I15];"equal";-LOG(ABS([.G15]-[.I15])/MAX(ABS([.G15]);ABS([.I15]));10))) -> 3.18469143081765 | M15: of:=IF(OR(ISTEXT([.I15]);ISTEXT([.J15]));"";IF([.I15]=[.J15];"equal";-LOG(ABS([.I15]-[.J15])/MAX(ABS([.I15]);ABS([.J15]));10))) -> 0.761549099871938 | N15: of:=IF(OR(ISTEXT([.G15]);ISTEXT([.K15]));"";IF([.G15]=[.K15];"equal";-LOG(ABS([.G15]-[.K15])/MAX(ABS([.G15]);ABS([.K15]));10))) -> equal | O15: Inada2009,S16
A16: I_st | B16: q_a (init) | C16: act_st | D16: qa.init | E16: act.n.start | F16: 1 | G16: 0.1933 | H16: 0.189847 | I16: 0.19362 | J16: 0.476405 | K16: 0.1933 | L16: of:=IF(OR(ISTEXT([.G16]);ISTEXT([.I16]));"";IF([.G16]=[.I16];"equal";-LOG(ABS([.G16]-[.I16])/MAX(ABS([.G16]);ABS([.I16]));10))) -> 2.78180023746766 | M16: of:=IF(OR(ISTEXT([.I16]);ISTEXT([.J16]));"";IF([.I16]=[.J16];"equal";-LOG(ABS([.I16]-[.J16])/MAX(ABS([.I16]);ABS([.J16]));10))) -> 0.226519941780994 | N16: of:=IF(OR(ISTEXT([.G16]);ISTEXT([.K16]));"";IF([.G16]=[.K16];"equal";-LOG(ABS([.G16]-[.K16])/MAX(ABS([.G16]);ABS([.K16]));10))) -> equal | O16: Inada2009,S16
B17: q_i (init) | C17: inact_st | D17: qi.init | E17: inact.n.start | F17: 1 | G17: 0.4886 | H17: 0.993424 | I17: 0.4885 | J17: 0.542304 | K17: 0.4886 | L17: of:=IF(OR(ISTEXT([.G17]);ISTEXT([.I17]));"";IF([.G17]=[.I17];"equal";-LOG(ABS([.G17]-[.I17])/MAX(ABS([.G17]);ABS([.I17]));10))) -> 3.68895346263747 | M17: of:=IF(OR(ISTEXT([.I17]);ISTEXT([.J17]));"";IF([.I17]=[.J17];"equal";-LOG(ABS([.I17]-[.J17])/MAX(ABS([.I17]);ABS([.J17]));10))) -> 1.00342824375724 | N17: of:=IF(OR(ISTEXT([.G17]);ISTEXT([.K17]));"";IF([.G17]=[.K17];"equal";-LOG(ABS([.G17]-[.K17])/MAX(ABS([.G17]);ABS([.K17]));10))) -> equal | O17: Inada2009,S16
A18: CaHandling | B18: [Ca2+]_i (init) | C18: ca_in (init) | D18: Cai.init | E18: cyto.c_start | F18: mM | G18: 0.0003623 | H18: - | I18: of:=['Parameters (N)'.H7] -> 0.00036327 | J18: 0.00018497 | K18: 0.0003623 | L18: of:=IF(OR(ISTEXT([.G18]);ISTEXT([.I18]));"";IF([.G18]=[.I18];"equal";-LOG(ABS([.G18]-[.I18])/MAX(ABS([.G18]);ABS([.I18]));10))) -> 2.57345779964816 | M18: of:=IF(OR(ISTEXT([.I18]);ISTEXT([.J18]));"";IF([.I18]=[.J18];"equal";-LOG(ABS([.I18]-[.J18])/MAX(ABS([.I18]);ABS([.J18]));10))) -> 0.309078190739043 | N18: of:=IF(OR(ISTEXT([.G18]);ISTEXT([.K18]));"";IF([.G18]=[.K18];"equal";-LOG(ABS([.G18]-[.K18])/MAX(ABS([.G18]);ABS([.K18]));10))) -> equal | O18: Inada2009,S16
B19: [Ca2+]_sub (init) | C19: ca_sub (init) | D19: Casub.init | E19: sub.c_start | F19: mM | G19: 0.0002294 | H19: - | I19: 0.00023 | J19: 0.000160311 | K19: 0.0002294 | L19: of:=IF(OR(ISTEXT([.G19]);ISTEXT([.I19]));"";IF([.G19]=[.I19];"equal";-LOG(ABS([.G19]-[.I19])/MAX(ABS([.G19]);ABS([.I19]));10))) -> 2.58357658563394 | M19: of:=IF(OR(ISTEXT([.I19]);ISTEXT([.J19]));"";IF([.I19]=[.J19];"equal";-LOG(ABS([.I19]-[.J19])/MAX(ABS([.I19]);ABS([.J19]));10))) -> 0.518563603347284 | N19: of:=IF(OR(ISTEXT([.G19]);ISTEXT([.K19]));"";IF([.G19]=[.K19];"equal";-LOG(ABS([.G19]-[.K19])/MAX(ABS([.G19]);ABS([.K19]));10))) -> equal | O19: Inada2009,S16
B20: [Ca2+]_rel (init) | C20: ca_rel (init) | D20: Ca_rel | E20: jsr.c_start | F20: mM | G20: 0.08227 | H20: - | I20: 0.081847 | J20: 0.29625 | K20: 0.08227 | L20: of:=IF(OR(ISTEXT([.G20]);ISTEXT([.I20]));"";IF([.G20]=[.I20];"equal";-LOG(ABS([.G20]-[.I20])/MAX(ABS([.G20]);ABS([.I20]));10))) -> 2.28890112993116 | M20: of:=IF(OR(ISTEXT([.I20]);ISTEXT([.J20]));"";IF([.I20]=[.J20];"equal";-LOG(ABS([.I20]-[.J20])/MAX(ABS([.I20]);ABS([.J20]));10))) -> 0.1404275011582 | N20: of:=IF(OR(ISTEXT([.G20]);ISTEXT([.K20]));"";IF([.G20]=[.K20];"equal";-LOG(ABS([.G20]-[.K20])/MAX(ABS([.G20]);ABS([.K20]));10))) -> equal | O20: Inada2009,S16
B21: [Ca2+]_up (init) | C21: ca_up (init) | D21: Ca_up | E21: nsr.c_start | F21: mM | G21: 1.146 | H21: - | I21: 1.1463 | J21: 1.11093 | K21: 1.146 | L21: of:=IF(OR(ISTEXT([.G21]);ISTEXT([.I21]));"";IF([.G21]=[.I21];"equal";-LOG(ABS([.G21]-[.I21])/MAX(ABS([.G21]);ABS([.I21]));10))) -> 3.58217703768813 | M21: of:=IF(OR(ISTEXT([.I21]);ISTEXT([.J21]));"";IF([.I21]=[.J21];"equal";-LOG(ABS([.I21]-[.J21])/MAX(ABS([.I21]);ABS([.J21]));10))) -> 1.51066323259332 | N21: of:=IF(OR(ISTEXT([.G21]);ISTEXT([.K21]));"";IF([.G21]=[.K21];"equal";-LOG(ABS([.G21]-[.K21])/MAX(ABS([.G21]);ABS([.K21]));10))) -> equal | O21: Inada2009,S16
B22: f_TC (init) | C22: f_tc (init) | D22: f_TC | E22: tc.f_start | F22: 1 | G22: 0.6838 | H22: 0.0672817 | I22: 0.068561 | J22: 0.0356473 | K22: 0.6838 | L22: of:=IF(OR(ISTEXT([.G22]);ISTEXT([.I22]));"";IF([.G22]=[.I22];"equal";-LOG(ABS([.G22]-[.I22])/MAX(ABS([.G22]);ABS([.I22]));10))) -> 0.0458852388675437 | M22: of:=IF(OR(ISTEXT([.I22]);ISTEXT([.J22]));"";IF([.I22]=[.J22];"equal";-LOG(ABS([.I22]-[.J22])/MAX(ABS([.I22]);ABS([.J22]));10))) -> 0.318700437048363 | N22: of:=IF(OR(ISTEXT([.G22]);ISTEXT([.K22]));"";IF([.G22]=[.K22];"equal";-LOG(ABS([.G22]-[.K22])/MAX(ABS([.G22]);ABS([.K22]));10))) -> equal | O22: Inada2009,S16 | P22: Probably there should be one more zero in the Paper
B23: f_TMC (init) | C23: f_tmc (init) | D23: f_TMC | E23: tmc.f_start | F23: 1 | G23: 0.6192 | H23: 0.56146 | I23: 0.61949 | J23: 0.443317 | K23: 0.6192 | L23: of:=IF(OR(ISTEXT([.G23]);ISTEXT([.I23]));"";IF([.G23]=[.I23];"equal";-LOG(ABS([.G23]-[.I23])/MAX(ABS([.G23]);ABS([.I23]));10))) -> 3.32963630235327 | M23: of:=IF(OR(ISTEXT([.I23]);ISTEXT([.J23]));"";IF([.I23]=[.J23];"equal";-LOG(ABS([.I23]-[.J23])/MAX(ABS([.I23]);ABS([.J23]));10))) -> 0.546094950373238 | N23: of:=IF(OR(ISTEXT([.G23]);ISTEXT([.K23]));"";IF([.G23]=[.K23];"equal";-LOG(ABS([.G23]-[.K23])/MAX(ABS([.G23]);ABS([.K23]));10))) -> equal | O23: Inada2009,S16
B24: f_TMM (init) | C24: f_tmm (init) | D24: f_TMM | E24: tmm.f_start | F24: 1 | G24: 0.3363 | H24: 0.387428 | I24: 0.33603 | J24: 0.391719 | K24: 0.3363 | L24: of:=IF(OR(ISTEXT([.G24]);ISTEXT([.I24]));"";IF([.G24]=[.I24];"equal";-LOG(ABS([.G24]-[.I24])/MAX(ABS([.G24]);ABS([.I24]));10))) -> 3.09536310315566 | M24: of:=IF(OR(ISTEXT([.I24]);ISTEXT([.J24]));"";IF([.I24]=[.J24];"equal";-LOG(ABS([.I24]-[.J24])/MAX(ABS([.I24]);ABS([.J24]));10))) -> 0.847205217755362 | N24: of:=IF(OR(ISTEXT([.G24]);ISTEXT([.K24]));"";IF([.G24]=[.K24];"equal";-LOG(ABS([.G24]-[.K24])/MAX(ABS([.G24]);ABS([.K24]));10))) -> equal | O24: Inada2009,S16
B25: f_CM_i (init) | C25: f_cmi (init) | D25: f_CMi | E25: cm_cyto.f_start | F25: 1 | G25: 0.1336 | H25: 0.1321 | I25: 0.13393 | J25: 0.0723008 | K25: 0.1336 | L25: of:=IF(OR(ISTEXT([.G25]);ISTEXT([.I25]));"";IF([.G25]=[.I25];"equal";-LOG(ABS([.G25]-[.I25])/MAX(ABS([.G25]);ABS([.I25]));10))) -> 2.60836392895738 | M25: of:=IF(OR(ISTEXT([.I25]);ISTEXT([.J25]));"";IF([.I25]=[.J25];"equal";-LOG(ABS([.I25]-[.J25])/MAX(ABS([.I25]);ABS([.J25]));10))) -> 0.33709133858375 | N25: of:=IF(OR(ISTEXT([.G25]);ISTEXT([.K25]));"";IF([.G25]=[.K25];"equal";-LOG(ABS([.G25]-[.K25])/MAX(ABS([.G25]);ABS([.K25]));10))) -> equal | O25: Inada2009,S16
B26: f_CM_s (init) | C26: f_cms (init) | D26: f_CMs | E26: cm_sub.f_start | F26: 1 | G26: 0.08894 | H26: 0.087902 | I26: 0.089149 | J26: 0.0630771 | K26: 0.08894 | L26: of:=IF(OR(ISTEXT([.G26]);ISTEXT([.I26]));"";IF([.G26]=[.I26];"equal";-LOG(ABS([.G26]-[.I26])/MAX(ABS([.G26]);ABS([.I26]));10))) -> 2.62997018987011 | M26: of:=IF(OR(ISTEXT([.I26]);ISTEXT([.J26]));"";IF([.I26]=[.J26];"equal";-LOG(ABS([.I26]-[.J26])/MAX(ABS([.I26]);ABS([.J26]));10))) -> 0.53394379427782 | N26: of:=IF(OR(ISTEXT([.G26]);ISTEXT([.K26]));"";IF([.G26]=[.K26];"equal";-LOG(ABS([.G26]-[.K26])/MAX(ABS([.G26]);ABS([.K26]));10))) -> equal | O26: Inada2009,S16
B27: f_CQ (init) | C27: f_cq (init) | D27: f_CQ | E27: cq.f_start | F27: 1 | G27: 0.08736 | H27: 0.0898533 | I27: 0.086939 | J27: 0.261431 | K27: 0.08736 | L27: of:=IF(OR(ISTEXT([.G27]);ISTEXT([.I27]));"";IF([.G27]=[.I27];"equal";-LOG(ABS([.G27]-[.I27])/MAX(ABS([.G27]);ABS([.I27]));10))) -> 2.317030529525 | M27: of:=IF(OR(ISTEXT([.I27]);ISTEXT([.J27]));"";IF([.I27]=[.J27];"equal";-LOG(ABS([.I27]-[.J27])/MAX(ABS([.I27]);ABS([.J27]));10))) -> 0.175581563637 | N27: of:=IF(OR(ISTEXT([.G27]);ISTEXT([.K27]));"";IF([.G27]=[.K27];"equal";-LOG(ABS([.G27]-[.K27])/MAX(ABS([.G27]);ABS([.K27]));10))) -> equal | O27: Inada2009,S16
B28: f_CSL (init) | C28: f_csl (init) | D28: f_CSL | E28: cm_sl.f_start | F28: 1 | G28: 0.00004764 | H28: 0.0000263803 | I28: 0.000046743 | J28: 0.0000414977 | K28: 0.00004764 | L28: of:=IF(OR(ISTEXT([.G28]);ISTEXT([.I28]));"";IF([.G28]=[.I28];"equal";-LOG(ABS([.G28]-[.I28])/MAX(ABS([.G28]);ABS([.I28]));10))) -> 1.72517930976665 | M28: of:=IF(OR(ISTEXT([.I28]);ISTEXT([.J28]));"";IF([.I28]=[.J28];"equal";-LOG(ABS([.I28]-[.J28])/MAX(ABS([.I28]);ABS([.J28]));10))) -> 0.949946249984532 | N28: of:=IF(OR(ISTEXT([.G28]);ISTEXT([.K28]));"";IF([.G28]=[.K28];"equal";-LOG(ABS([.G28]-[.K28])/MAX(ABS([.G28]);ABS([.K28]));10))) -> equal | O28: Inada2009,S16

Sheet: Initial values (NH)
A1: Part | B1: Name (paper) | C1: Name (C++) | D1: Name (CellML) | E1: Name (InaMo) | F1: Unit | G1: Value in paper | H1: Steady state in paper | I1: Value in C++ | J1: Value in CellML | K1: Value in InaMo | L1: Paper = C++ | M1: C++ = CellML | N1: InaMo = CellML | O1: Paper source
A2: Cell | B2: V (init) | C2: vm_1 | D2: V.init | E2: l2.v_init | F2: V | G2: -0.06863 | H2: - | I2: -0.068668 | J2: -0.0697603 | K2: - | L2: of:=IF(OR(ISTEXT([.G2]);ISTEXT([.I2]));"";IF([.G2]=[.I2];"equal";-LOG(ABS([.G2]-[.I2])/MAX(ABS([.G2]);ABS([.I2]));10))) -> 3.25697080185325 | M2: of:=IF(OR(ISTEXT([.I2]);ISTEXT([.J2]));"";IF([.I2]=[.J2];"equal";-LOG(ABS([.I2]-[.J2])/MAX(ABS([.I2]);ABS([.J2]));10))) -> 1.80526640593238 | N2: of:=IF(OR(ISTEXT([.G2]);ISTEXT([.K2]));"";IF([.G2]=[.K2];"equal";-LOG(ABS([.G2]-[.K2])/MAX(ABS([.G2]);ABS([.K2]));10))) ->  | O2: Inada2009,S16
A3: I_Na | B3: m (init) | C3: act_na (init) | D3: m.init | E3: act.n.start | F3: 1 | G3: 0.01529 | H3: 0.0152886 | I3: 0.015215 | J3: 0.01322 | K3: 0.01529 | L3: of:=IF(OR(ISTEXT([.G3]);ISTEXT([.I3]));"";IF([.G3]=[.I3];"equal";-LOG(ABS([.G3]-[.I3])/MAX(ABS([.G3]);ABS([.I3]));10))) -> 2.30934622202062 | M3: of:=IF(OR(ISTEXT([.I3]);ISTEXT([.J3]));"";IF([.I3]=[.J3];"equal";-LOG(ABS([.I3]-[.J3])/MAX(ABS([.I3]);ABS([.J3]));10))) -> 0.882329056671419 | N3: of:=IF(OR(ISTEXT([.G3]);ISTEXT([.K3]));"";IF([.G3]=[.K3];"equal";-LOG(ABS([.G3]-[.K3])/MAX(ABS([.G3]);ABS([.K3]));10))) -> equal | O3: Inada2009,S16
B4: h_2 (init) | C4: slow_inact_na (init) | D4: h2.init | E4: inact_slow.n.start | F4: 1 | G4: 0.5552 | H4: 0.644769 | I4: 0.56383 | J4: 0.701627 | K4: 0.5552 | L4: of:=IF(OR(ISTEXT([.G4]);ISTEXT([.I4]));"";IF([.G4]=[.I4];"equal";-LOG(ABS([.G4]-[.I4])/MAX(ABS([.G4]);ABS([.I4]));10))) -> 1.81513738417056 | M4: of:=IF(OR(ISTEXT([.I4]);ISTEXT([.J4]));"";IF([.I4]=[.J4];"equal";-LOG(ABS([.I4]-[.J4])/MAX(ABS([.I4]);ABS([.J4]));10))) -> 0.706866530611926 | N4: of:=IF(OR(ISTEXT([.G4]);ISTEXT([.K4]));"";IF([.G4]=[.K4];"equal";-LOG(ABS([.G4]-[.K4])/MAX(ABS([.G4]);ABS([.K4]));10))) -> equal | O4: Inada2009,S16
B5: h_1 (init) | C5: fast_inact_na (init) | D5: h1.init | E5: inact_fast.n.start | F5: 1 | G5: 0.6438 | H5: 0.644769 | I5: 0.64629 | J5: 0.706623 | K5: 0.6438 | L5: of:=IF(OR(ISTEXT([.G5]);ISTEXT([.I5]));"";IF([.G5]=[.I5];"equal";-LOG(ABS([.G5]-[.I5])/MAX(ABS([.G5]);ABS([.I5]));10))) -> 2.41422808907076 | M5: of:=IF(OR(ISTEXT([.I5]);ISTEXT([.J5]));"";IF([.I5]=[.J5];"equal";-LOG(ABS([.I5]-[.J5])/MAX(ABS([.I5]);ABS([.J5]));10))) -> 1.06863284853277 | N5: of:=IF(OR(ISTEXT([.G5]);ISTEXT([.K5]));"";IF([.G5]=[.K5];"equal";-LOG(ABS([.G5]-[.K5])/MAX(ABS([.G5]);ABS([.K5]));10))) -> equal | O5: Inada2009,S16
A6: I_Ca,L | B6: d_L (init) | C6: act_l (init) | D6: d.init | E6: act.n.start | F6: 1 | G6: 0.00005025 | H6: 0.0000502405 | I6: 0.000049961 | J6: 0.00004235 | K6: 0.00005025 | L6: of:=IF(OR(ISTEXT([.G6]);ISTEXT([.I6]));"";IF([.G6]=[.I6];"equal";-LOG(ABS([.G6]-[.I6])/MAX(ABS([.G6]);ABS([.I6]));10))) -> 2.24023822333597 | M6: of:=IF(OR(ISTEXT([.I6]);ISTEXT([.J6]));"";IF([.I6]=[.J6];"equal";-LOG(ABS([.I6]-[.J6])/MAX(ABS([.I6]);ABS([.J6]));10))) -> 0.817189400517621 | N6: of:=IF(OR(ISTEXT([.G6]);ISTEXT([.K6]));"";IF([.G6]=[.K6];"equal";-LOG(ABS([.G6]-[.K6])/MAX(ABS([.G6]);ABS([.K6]));10))) -> equal | O6: Inada2009,S16
B7: f_L,fast (init) | C7: fast_inact_l (init) | D7: f.init | E7: inact_fast.n.start | F7: 1 | G7: 0.9981 | H7: 0.998131 | I7: 0.99814 | J7: 0.998435 | K7: 0.9985 | L7: of:=IF(OR(ISTEXT([.G7]);ISTEXT([.I7]));"";IF([.G7]=[.I7];"equal";-LOG(ABS([.G7]-[.I7])/MAX(ABS([.G7]);ABS([.I7]));10))) -> 4.39713146875983 | M7: of:=IF(OR(ISTEXT([.I7]);ISTEXT([.J7]));"";IF([.I7]=[.J7];"equal";-LOG(ABS([.I7]-[.J7])/MAX(ABS([.I7]);ABS([.J7]));10))) -> 3.52949778075976 | N7: of:=IF(OR(ISTEXT([.G7]);ISTEXT([.K7]));"";IF([.G7]=[.K7];"equal";-LOG(ABS([.G7]-[.K7])/MAX(ABS([.G7]);ABS([.K7]));10))) -> 3.39728807787869 | O7: Inada2009,S16
B8: f_L,slow (init) | C8: slow_inact_l (init) | D8: f2.init | E8: inact_slow.n.start | F8: 1 | G8: 0.9831 | H8: 0.998131 | I8: 0.98513 | J8: 0.998424 | K8: 0.9831 | L8: of:=IF(OR(ISTEXT([.G8]);ISTEXT([.I8]));"";IF([.G8]=[.I8];"equal";-LOG(ABS([.G8]-[.I8])/MAX(ABS([.G8]);ABS([.I8]));10))) -> 2.68599750685578 | M8: of:=IF(OR(ISTEXT([.I8]);ISTEXT([.J8]));"";IF([.I8]=[.J8];"equal";-LOG(ABS([.I8]-[.J8])/MAX(ABS([.I8]);ABS([.J8]));10))) -> 1.87565933754595 | N8: of:=IF(OR(ISTEXT([.G8]);ISTEXT([.K8]));"";IF([.G8]=[.K8];"equal";-LOG(ABS([.G8]-[.K8])/MAX(ABS([.G8]);ABS([.K8]));10))) -> equal | O8: Inada2009,S16
A9: I_to | B9: r (init) | C9: act_to (init) | D9: r.init | E9: act.n.start | F9: 1 | G9: 0.009581 | H9: 0.00958035 | I9: 0.0095587 | J9: 0.00894826 | K9: 0.009581 | L9: of:=IF(OR(ISTEXT([.G9]);ISTEXT([.I9]));"";IF([.G9]=[.I9];"equal";-LOG(ABS([.G9]-[.I9])/MAX(ABS([.G9]);ABS([.I9]));10))) -> 2.63310597711774 | M9: of:=IF(OR(ISTEXT([.I9]);ISTEXT([.J9]));"";IF([.I9]=[.J9];"equal";-LOG(ABS([.I9]-[.J9])/MAX(ABS([.I9]);ABS([.J9]));10))) -> 1.19475584780038 | N9: of:=IF(OR(ISTEXT([.G9]);ISTEXT([.K9]));"";IF([.G9]=[.K9];"equal";-LOG(ABS([.G9]-[.K9])/MAX(ABS([.G9]);ABS([.K9]));10))) -> equal | O9: Inada2009,S16
B10: q_fast (init) | C10: fast_inact_to (init) | D10: q_fast.init | E10: inact_fast.n.start | F10: 1 | G10: 0.864 | H10: 0.996636 | I10: 0.8708 | J10: 0.994837 | K10: 0.864 | L10: of:=IF(OR(ISTEXT([.G10]);ISTEXT([.I10]));"";IF([.G10]=[.I10];"equal";-LOG(ABS([.G10]-[.I10])/MAX(ABS([.G10]);ABS([.I10]));10))) -> 2.10740950766282 | M10: of:=IF(OR(ISTEXT([.I10]);ISTEXT([.J10]));"";IF([.I10]=[.J10];"equal";-LOG(ABS([.I10]-[.J10])/MAX(ABS([.I10]);ABS([.J10]));10))) -> 0.904200675486372 | N10: of:=IF(OR(ISTEXT([.G10]);ISTEXT([.K10]));"";IF([.G10]=[.K10];"equal";-LOG(ABS([.G10]-[.K10])/MAX(ABS([.G10]);ABS([.K10]));10))) -> equal | O10: Inada2009,S16 | R10: of:=500 -> 500
B11: q_slow (init) | C11: slow_inact_to (init) | D11: q_slow.init | E11: inact_slow.n.start | F11: 1 | G11: 0.1297 | H11: 0.996636 | I11: 0.13435 | J11: 0.427382 | K11: 0.1297 | L11: of:=IF(OR(ISTEXT([.G11]);ISTEXT([.I11]));"";IF([.G11]=[.I11];"equal";-LOG(ABS([.G11]-[.I11])/MAX(ABS([.G11]);ABS([.I11]));10))) -> 1.46078471787923 | M11: of:=IF(OR(ISTEXT([.I11]);ISTEXT([.J11]));"";IF([.I11]=[.J11];"equal";-LOG(ABS([.I11]-[.J11])/MAX(ABS([.I11]);ABS([.J11]));10))) -> 0.163901177837558 | N11: of:=IF(OR(ISTEXT([.G11]);ISTEXT([.K11]));"";IF([.G11]=[.K11];"equal";-LOG(ABS([.G11]-[.K11])/MAX(ABS([.G11]);ABS([.K11]));10))) -> equal | O11: Inada2009,S16
A12: I_K,r | B12: p_a,slow (init) | C12: slow_act_kr (init) | D12: pas.init | E12: act_slow.n.start | F12: 1 | G12: 0.07024 | H12: 0.00103557 | I12: 0.067693 | J12: 0.00539772 | K12: 0.07024 | L12: of:=IF(OR(ISTEXT([.G12]);ISTEXT([.I12]));"";IF([.G12]=[.I12];"equal";-LOG(ABS([.G12]-[.I12])/MAX(ABS([.G12]);ABS([.I12]));10))) -> 1.44055555793443 | M12: of:=IF(OR(ISTEXT([.I12]);ISTEXT([.J12]));"";IF([.I12]=[.J12];"equal";-LOG(ABS([.I12]-[.J12])/MAX(ABS([.I12]);ABS([.J12]));10))) -> 0.0360886192655803 | N12: of:=IF(OR(ISTEXT([.G12]);ISTEXT([.K12]));"";IF([.G12]=[.K12];"equal";-LOG(ABS([.G12]-[.K12])/MAX(ABS([.G12]);ABS([.K12]));10))) -> equal | O12: Inada2009,S16
B13: p_a,fast (init) | C13: fast_act_kr (init) | D13: paf.init | E13: act_fast.n.start | F13: 1 | G13: 0.09949 | H13: 0.00103557 | I13: 0.093329 | J13: 0.00141763 | K13: 0.09949 | L13: of:=IF(OR(ISTEXT([.G13]);ISTEXT([.I13]));"";IF([.G13]=[.I13];"equal";-LOG(ABS([.G13]-[.I13])/MAX(ABS([.G13]);ABS([.I13]));10))) -> 1.20812822207219 | M13: of:=IF(OR(ISTEXT([.I13]);ISTEXT([.J13]));"";IF([.I13]=[.J13];"equal";-LOG(ABS([.I13]-[.J13])/MAX(ABS([.I13]);ABS([.J13]));10))) -> 0.00664737288247179 | N13: of:=IF(OR(ISTEXT([.G13]);ISTEXT([.K13]));"";IF([.G13]=[.K13];"equal";-LOG(ABS([.G13]-[.K13])/MAX(ABS([.G13]);ABS([.K13]));10))) -> equal | O13: Inada2009,S16
B14: p_i (init) | C14: inact_kr (init) | D14: pik.init | E14: inact.n.start | F14: 1 | G14: 0.9853 | H14: 0.985338 | I14: 0.98537 | J14: 0.986382 | K14: 0.9853 | L14: of:=IF(OR(ISTEXT([.G14]);ISTEXT([.I14]));"";IF([.G14]=[.I14];"equal";-LOG(ABS([.G14]-[.I14])/MAX(ABS([.G14]);ABS([.I14]));10))) -> 4.14850129584946 | M14: of:=IF(OR(ISTEXT([.I14]);ISTEXT([.J14]));"";IF([.I14]=[.J14];"equal";-LOG(ABS([.I14]-[.J14])/MAX(ABS([.I14]);ABS([.J14]));10))) -> 2.98886462592979 | N14: of:=IF(OR(ISTEXT([.G14]);ISTEXT([.K14]));"";IF([.G14]=[.K14];"equal";-LOG(ABS([.G14]-[.K14])/MAX(ABS([.G14]);ABS([.K14]));10))) -> equal | O14: Inada2009,S16
A15: I_f | B15: y (init) | C15: act_f | D15: y.init | E15: act.n.start | F15: 1 | G15: - | H15: - | I15: - | J15: 0.195841 | K15: - | L15: of:=IF(OR(ISTEXT([.G15]);ISTEXT([.I15]));"";IF([.G15]=[.I15];"equal";-LOG(ABS([.G15]-[.I15])/MAX(ABS([.G15]);ABS([.I15]));10))) ->  | M15: of:=IF(OR(ISTEXT([.I15]);ISTEXT([.J15]));"";IF([.I15]=[.J15];"equal";-LOG(ABS([.I15]-[.J15])/MAX(ABS([.I15]);ABS([.J15]));10))) ->  | N15: of:=IF(OR(ISTEXT([.G15]);ISTEXT([.K15]));"";IF([.G15]=[.K15];"equal";-LOG(ABS([.G15]-[.K15])/MAX(ABS([.G15]);ABS([.K15]));10))) ->  | O15: Inada2009,S16
A16: I_st | B16: q_a (init) | C16: act_st | D16: qa.init | E16: act.n.start | F16: 1 | G16: - | H16: - | I16: - | J16: 0.0910882 | K16: - | L16: of:=IF(OR(ISTEXT([.G16]);ISTEXT([.I16]));"";IF([.G16]=[.I16];"equal";-LOG(ABS([.G16]-[.I16])/MAX(ABS([.G16]);ABS([.I16]));10))) ->  | M16: of:=IF(OR(ISTEXT([.I16]);ISTEXT([.J16]));"";IF([.I16]=[.J16];"equal";-LOG(ABS([.I16]-[.J16])/MAX(ABS([.I16]);ABS([.J16]));10))) ->  | N16: of:=IF(OR(ISTEXT([.G16]);ISTEXT([.K16]));"";IF([.G16]=[.K16];"equal";-LOG(ABS([.G16]-[.K16])/MAX(ABS([.G16]);ABS([.K16]));10))) ->  | O16: Inada2009,S16
B17: q_i (init) | C17: inact_st | D17: qi.init | E17: inact.n.start | F17: 1 | G17: - | H17: - | I17: - | J17: 0.890389 | K17: - | L17: of:=IF(OR(ISTEXT([.G17]);ISTEXT([.I17]));"";IF([.G17]=[.I17];"equal";-LOG(ABS([.G17]-[.I17])/MAX(ABS([.G17]);ABS([.I17]));10))) ->  | M17: of:=IF(OR(ISTEXT([.I17]);ISTEXT([.J17]));"";IF([.I17]=[.J17];"equal";-LOG(ABS([.I17]-[.J17])/MAX(ABS([.I17]);ABS([.J17]));10))) ->  | N17: of:=IF(OR(ISTEXT([.G17]);ISTEXT([.K17]));"";IF([.G17]=[.K17];"equal";-LOG(ABS([.G17]-[.K17])/MAX(ABS([.G17]);ABS([.K17]));10))) ->  | O17: Inada2009,S16
A18: CaHandling | B18: [Ca2+]_i (init) | C18: ca_in (init) | D18: Cai.init | E18: cyto.c_start | F18: mM | G18: 0.0001386 | H18: - | I18: 0.00013399 | J18: 0.0000373317 | K18: 0.0001386 | L18: of:=IF(OR(ISTEXT([.G18]);ISTEXT([.I18]));"";IF([.G18]=[.I18];"equal";-LOG(ABS([.G18]-[.I18])/MAX(ABS([.G18]);ABS([.I18]));10))) -> 1.47806230488614 | M18: of:=IF(OR(ISTEXT([.I18]);ISTEXT([.J18]));"";IF([.I18]=[.J18];"equal";-LOG(ABS([.I18]-[.J18])/MAX(ABS([.I18]);ABS([.J18]));10))) -> 0.141833234503141 | N18: of:=IF(OR(ISTEXT([.G18]);ISTEXT([.K18]));"";IF([.G18]=[.K18];"equal";-LOG(ABS([.G18]-[.K18])/MAX(ABS([.G18]);ABS([.K18]));10))) -> equal | O18: Inada2009,S16
B19: [Ca2+]_sub (init) | C19: ca_sub (init) | D19: Casub.init | E19: sub.c_start | F19: mM | G19: 0.00007314 | H19: - | I19: 0.000071222 | J19: 0.0000327336 | K19: 0.00007314 | L19: of:=IF(OR(ISTEXT([.G19]);ISTEXT([.I19]));"";IF([.G19]=[.I19];"equal";-LOG(ABS([.G19]-[.I19])/MAX(ABS([.G19]);ABS([.I19]));10))) -> 1.58130635316738 | M19: of:=IF(OR(ISTEXT([.I19]);ISTEXT([.J19]));"";IF([.I19]=[.J19];"equal";-LOG(ABS([.I19]-[.J19])/MAX(ABS([.I19]);ABS([.J19]));10))) -> 0.267284307596055 | N19: of:=IF(OR(ISTEXT([.G19]);ISTEXT([.K19]));"";IF([.G19]=[.K19];"equal";-LOG(ABS([.G19]-[.K19])/MAX(ABS([.G19]);ABS([.K19]));10))) -> equal | O19: Inada2009,S16
B20: [Ca2+]_rel (init) | C20: ca_rel (init) | D20: Ca_rel | E20: jsr.c_start | F20: mM | G20: 0.4438 | H20: - | I20: 0.44752 | J20: 0.682159 | K20: 0.4438 | L20: of:=IF(OR(ISTEXT([.G20]);ISTEXT([.I20]));"";IF([.G20]=[.I20];"equal";-LOG(ABS([.G20]-[.I20])/MAX(ABS([.G20]);ABS([.I20]));10))) -> 2.08026950914555 | M20: of:=IF(OR(ISTEXT([.I20]);ISTEXT([.J20]));"";IF([.I20]=[.J20];"equal";-LOG(ABS([.I20]-[.J20])/MAX(ABS([.I20]);ABS([.J20]));10))) -> 0.463485414257199 | N20: of:=IF(OR(ISTEXT([.G20]);ISTEXT([.K20]));"";IF([.G20]=[.K20];"equal";-LOG(ABS([.G20]-[.K20])/MAX(ABS([.G20]);ABS([.K20]));10))) -> equal | O20: Inada2009,S16
B21: [Ca2+]_up (init) | C21: ca_up (init) | D21: Ca_up | E21: nsr.c_start | F21: mM | G21: 1.187 | H21: - | I21: 1.1631 | J21: 0.818672 | K21: 1.187 | L21: of:=IF(OR(ISTEXT([.G21]);ISTEXT([.I21]));"";IF([.G21]=[.I21];"equal";-LOG(ABS([.G21]-[.I21])/MAX(ABS([.G21]);ABS([.I21]));10))) -> 1.69605281800645 | M21: of:=IF(OR(ISTEXT([.I21]);ISTEXT([.J21]));"";IF([.I21]=[.J21];"equal";-LOG(ABS([.I21]-[.J21])/MAX(ABS([.I21]);ABS([.J21]));10))) -> 0.528518605886018 | N21: of:=IF(OR(ISTEXT([.G21]);ISTEXT([.K21]));"";IF([.G21]=[.K21];"equal";-LOG(ABS([.G21]-[.K21])/MAX(ABS([.G21]);ABS([.K21]));10))) -> equal | O21: Inada2009,S16
B22: f_TC (init) | C22: f_tc (init) | D22: f_TC | E22: tc.f_start | F22: 1 | G22: 0.02703 | H22: 0.0268546 | I22: 0.026148 | J22: 0.00739583 | K22: 0.02703 | L22: of:=IF(OR(ISTEXT([.G22]);ISTEXT([.I22]));"";IF([.G22]=[.I22];"equal";-LOG(ABS([.G22]-[.I22])/MAX(ABS([.G22]);ABS([.I22]));10))) -> 1.48637746056691 | M22: of:=IF(OR(ISTEXT([.I22]);ISTEXT([.J22]));"";IF([.I22]=[.J22];"equal";-LOG(ABS([.I22]-[.J22])/MAX(ABS([.I22]);ABS([.J22]));10))) -> 0.144386944790394 | N22: of:=IF(OR(ISTEXT([.G22]);ISTEXT([.K22]));"";IF([.G22]=[.K22];"equal";-LOG(ABS([.G22]-[.K22])/MAX(ABS([.G22]);ABS([.K22]));10))) -> equal | O22: Inada2009,S16
B23: f_TMC (init) | C23: f_tmc (init) | D23: f_TMC | E23: tmc.f_start | F23: 1 | G23: 0.402 | H23: 0.328762 | I23: 0.39299 | J23: 0.133734 | K23: 0.402 | L23: of:=IF(OR(ISTEXT([.G23]);ISTEXT([.I23]));"";IF([.G23]=[.I23];"equal";-LOG(ABS([.G23]-[.I23])/MAX(ABS([.G23]);ABS([.I23]));10))) -> 1.64950126210541 | M23: of:=IF(OR(ISTEXT([.I23]);ISTEXT([.J23]));"";IF([.I23]=[.J23];"equal";-LOG(ABS([.I23]-[.J23])/MAX(ABS([.I23]);ABS([.J23]));10))) -> 0.180652683365761 | N23: of:=IF(OR(ISTEXT([.G23]);ISTEXT([.K23]));"";IF([.G23]=[.K23];"equal";-LOG(ABS([.G23]-[.K23])/MAX(ABS([.G23]);ABS([.K23]));10))) -> equal | O23: Inada2009,S16
B24: f_TMM (init) | C24: f_tmm (init) | D24: f_TMM | E24: tmm.f_start | F24: 1 | G24: 0.5282 | H24: 0.593004 | I24: 0.53615 | J24: 0.765246 | K24: 0.5282 | L24: of:=IF(OR(ISTEXT([.G24]);ISTEXT([.I24]));"";IF([.G24]=[.I24];"equal";-LOG(ABS([.G24]-[.I24])/MAX(ABS([.G24]);ABS([.I24]));10))) -> 1.82891918166813 | M24: of:=IF(OR(ISTEXT([.I24]);ISTEXT([.J24]));"";IF([.I24]=[.J24];"equal";-LOG(ABS([.I24]-[.J24])/MAX(ABS([.I24]);ABS([.J24]));10))) -> 0.523783561679901 | N24: of:=IF(OR(ISTEXT([.G24]);ISTEXT([.K24]));"";IF([.G24]=[.K24];"equal";-LOG(ABS([.G24]-[.K24])/MAX(ABS([.G24]);ABS([.K24]));10))) -> equal | O24: Inada2009,S16
B25: f_CM_i (init) | C25: f_cmi (init) | D25: f_CMi | E25: cm_cyto.f_start | F25: 1 | G25: 0.0553 | H25: 0.0550235 | I25: 0.05355 | J25: 0.0154714 | K25: 0.0553 | L25: of:=IF(OR(ISTEXT([.G25]);ISTEXT([.I25]));"";IF([.G25]=[.I25];"equal";-LOG(ABS([.G25]-[.I25])/MAX(ABS([.G25]);ABS([.I25]));10))) -> 1.4996870826184 | M25: of:=IF(OR(ISTEXT([.I25]);ISTEXT([.J25]));"";IF([.I25]=[.J25];"equal";-LOG(ABS([.I25]-[.J25])/MAX(ABS([.I25]);ABS([.J25]));10))) -> 0.148078502457844 | N25: of:=IF(OR(ISTEXT([.G25]);ISTEXT([.K25]));"";IF([.G25]=[.K25];"equal";-LOG(ABS([.G25]-[.K25])/MAX(ABS([.G25]);ABS([.K25]));10))) -> equal | O25: Inada2009,S16
B26: f_CM_s (init) | C26: f_cms (init) | D26: f_CMs | E26: cm_sub.f_start | F26: 1 | G26: 0.02992 | H26: 0.0298109 | I26: 0.029115 | J26: 0.0135768 | K26: 0.02992 | L26: of:=IF(OR(ISTEXT([.G26]);ISTEXT([.I26]));"";IF([.G26]=[.I26];"equal";-LOG(ABS([.G26]-[.I26])/MAX(ABS([.G26]);ABS([.I26]));10))) -> 1.57016570882456 | M26: of:=IF(OR(ISTEXT([.I26]);ISTEXT([.J26]));"";IF([.I26]=[.J26];"equal";-LOG(ABS([.I26]-[.J26])/MAX(ABS([.I26]);ABS([.J26]));10))) -> 0.272716087272898 | N26: of:=IF(OR(ISTEXT([.G26]);ISTEXT([.K26]));"";IF([.G26]=[.K26];"equal";-LOG(ABS([.G26]-[.K26])/MAX(ABS([.G26]);ABS([.K26]));10))) -> equal | O26: Inada2009,S16
B27: f_CQ (init) | C27: f_cq (init) | D27: f_CQ | E27: cq.f_start | F27: 1 | G27: 0.3463 | H27: 0.347497 | I27: 0.34828 | J27: 0.449992 | K27: 0.3463 | L27: of:=IF(OR(ISTEXT([.G27]);ISTEXT([.I27]));"";IF([.G27]=[.I27];"equal";-LOG(ABS([.G27]-[.I27])/MAX(ABS([.G27]);ABS([.I27]));10))) -> 2.24526334552594 | M27: of:=IF(OR(ISTEXT([.I27]);ISTEXT([.J27]));"";IF([.I27]=[.J27];"equal";-LOG(ABS([.I27]-[.J27])/MAX(ABS([.I27]);ABS([.J27]));10))) -> 0.645832598829542 | N27: of:=IF(OR(ISTEXT([.G27]);ISTEXT([.K27]));"";IF([.G27]=[.K27];"equal";-LOG(ABS([.G27]-[.K27])/MAX(ABS([.G27]);ABS([.K27]));10))) -> equal | O27: Inada2009,S16
B28: f_CSL (init) | C28: f_csl (init) | D28: f_CSL | E28: cm_sl.f_start | F28: 1 | G28: 0.00004843 | H28: 0.00000841103 | I28: 0.000044471 | J28: 0.0000121722 | K28: 0.00004843 | L28: of:=IF(OR(ISTEXT([.G28]);ISTEXT([.I28]));"";IF([.G28]=[.I28];"equal";-LOG(ABS([.G28]-[.I28])/MAX(ABS([.G28]);ABS([.I28]));10))) -> 1.08752896729433 | M28: of:=IF(OR(ISTEXT([.I28]);ISTEXT([.J28]));"";IF([.I28]=[.J28];"equal";-LOG(ABS([.I28]-[.J28])/MAX(ABS([.I28]);ABS([.J28]));10))) -> 0.138890508097654 | N28: of:=IF(OR(ISTEXT([.G28]);ISTEXT([.K28]));"";IF([.G28]=[.K28];"equal";-LOG(ABS([.G28]-[.K28])/MAX(ABS([.G28]);ABS([.K28]));10))) -> equal | O28: Inada2009,S16